(PJ3.1) PS C:\Users\User\OneDrive\Cloud\0. Studying\250516 AIO2025\z. Git\AIO\250914 Project 4> streamlit run app.py --server.fileWatcherType none --logger.level=debug
2025-10-01 09:55:11.634 Starting new event loop for server
2025-10-01 09:55:11.635 Starting server...
2025-10-01 09:55:11.636 Serving static content from C:\Users\User\miniconda3\envs\PJ3.1\Lib\site-packages\streamlit\static
2025-10-01 09:55:11.642 Server started on port 8501
2025-10-01 09:55:11.642 Runtime state: RuntimeState.INITIAL -> RuntimeState.NO_SESSIONS_CONNECTED

  You can now view your Streamlit app in your browser.

  Local URL: http://localhost:8501
  Network URL: http://192.168.1.182:8501

2025-10-01 09:55:11.785 Setting up signal handler
2025-10-01 09:55:12.614 AppSession initialized (id=22a85a02-40b7-4cef-a39e-93f4fcfc16c8)
2025-10-01 09:55:12.614 Created new session for client 1898955593872. Session ID: 22a85a02-40b7-4cef-a39e-93f4fcfc16c8
2025-10-01 09:55:12.614 Runtime state: RuntimeState.NO_SESSIONS_CONNECTED -> RuntimeState.ONE_OR_MORE_SESSIONS_CONNECTED
2025-10-01 09:55:12.700 Received the following back message:
rerun_script {
  widget_states {
  }
  context_info {
    timezone: "Asia/Saigon"
    timezone_offset: -420
    locale: "en-GB"
    url: "http://localhost:8501/"
    is_embedded: false
    color_scheme: "dark"
  }
}

2025-10-01 09:55:12.700 Beginning script thread
2025-10-01 09:55:12.701 Running script RerunData(widget_states=, context_info=timezone: "Asia/Saigon"
timezone_offset: -420
locale: "en-GB"
url: "http://localhost:8501/"
is_embedded: false
color_scheme: "dark"
)
2025-10-01 09:55:12.701 Disconnecting files for session with ID 22a85a02-40b7-4cef-a39e-93f4fcfc16c8
2025-10-01 09:55:12.701 Sessions still active: dict_keys([])
2025-10-01 09:55:12.701 Files: 0; Sessions with files: 0
SUCCESS: Temp file cleanup registered in training_pipeline
SUCCESS: Temp file cleanup registered in cache_manager
All models registered successfully!
Available models: ['kmeans', 'knn', 'decision_tree', 'naive_bayes', 'svm', 'logistic_regression', 'linear_svc', 'random_forest', 'adaboost', 'gradient_boosting', 'xgboost', 'lightgbm', 'catboost', 'voting_ensemble_hard', 'voting_ensemble_soft', 'stacking_ensemble_logistic_regression', 'stacking_ensemble_random_forest', 'stacking_ensemble_xgboost']

Model Categories:
  clustering: kmeans
  classification: knn, decision_tree, naive_bayes, svm, logistic_regression, linear_svc, random_forest, adaboost, gradient_boosting, xgboost, lightgbm, catboost
  ensemble: voting_ensemble_hard, voting_ensemble_soft, stacking_ensemble_logistic_regression, stacking_ensemble_random_forest, stacking_ensemble_xgboost
All models registered successfully!
Available models: ['kmeans', 'knn', 'decision_tree', 'naive_bayes', 'svm', 'logistic_regression', 'linear_svc', 'random_forest', 'adaboost', 'gradient_boosting', 'xgboost', 'lightgbm', 'catboost', 'voting_ensemble_hard', 'voting_ensemble_soft', 'stacking_ensemble_logistic_regression', 'stacking_ensemble_random_forest', 'stacking_ensemble_xgboost']

Model Categories:
  clustering: kmeans
  classification: knn, decision_tree, naive_bayes, svm, logistic_regression, linear_svc, random_forest, adaboost, gradient_boosting, xgboost, lightgbm, catboost
  ensemble: voting_ensemble_hard, voting_ensemble_soft, stacking_ensemble_logistic_regression, stacking_ensemble_random_forest, stacking_ensemble_xgboost
2025-10-01 09:55:18.365 Creating new ResourceCache (key=33b391f503e826b4611af003bb487669)
2025-10-01 09:55:18.366 Cache key: d41d8cd98f00b204e9800998ecf8427e
INFO:wizard_ui.session_manager:Loading session from backup saved at: 2025-09-30T23:18:54.554102
INFO:wizard_ui.session_manager:Session state restored successfully
INFO:wizard_ui.session_manager:Session state loaded from file: C:\Users\User\OneDrive\Cloud\0. Studying\250516 AIO2025\z. Git\AIO\250914 Project 4\wizard_ui\session_backup.json
INFO:wizard_ui.session_manager:Session state auto-restored from backup
INFO:wizard_ui.session_manager:Session Manager initialized
SUCCESS: Step 1 data saved to session state
DEBUG: Auto-save disabled to prevent crashes
SUCCESS: Step 1 data saved to session state
DEBUG: Auto-save disabled to prevent crashes
SUCCESS: Step 1 data saved to session state
DEBUG: Auto-save disabled to prevent crashes
💾 Saved default sampling config from sample: {'num_samples': 100000, 'sampling_strategy': 'Stratified (Recommended)'}
SUCCESS: Step 1 data saved to session state
DEBUG: Auto-save disabled to prevent crashes
SUCCESS: Step 1 data saved to session state
DEBUG: Auto-save disabled to prevent crashes
💾 [STEP1] Saved sampling config to session: {'num_samples': 100000, 'sampling_strategy': 'Stratified (Recommended)'}
📊 [STEP1] Dataset size: 300,000, Requested samples: 100,000
2025-10-01 09:55:20.430 Removing orphaned files...
2025-10-01 09:55:38.805 Received the following back message:
rerun_script {
  widget_states {
    widgets {
      id: "$$ID-9ebffe1e51b0bcf570d59ea8fd826d1a-None"
      string_value: "Use Sample Dataset (Cache Folder)"
    }
    widgets {
      id: "$$ID-9ee83401b0c7d4595da2e8ac6e0e0d46-None"
      string_value: "heart.csv"
    }
    widgets {
      id: "$$ID-e8f0b348eb01525f2f22d93a4e95911c-None"
      double_array_value {
        data: 100000
      }
    }
    widgets {
      id: "$$ID-ad59a5b4f412c26a40baa50e51b55411-None"
      int_value: 1
    }
  }
  page_script_hash: "3f41e546893dc64b71aaacad12cad815"
  context_info {
    timezone: "Asia/Saigon"
    timezone_offset: -420
    locale: "en-GB"
    url: "http://localhost:8501/"
    is_embedded: false
    color_scheme: "dark"
  }
}

2025-10-01 09:55:38.808 Beginning script thread
2025-10-01 09:55:38.808 Running script RerunData(widget_states=widgets {
  id: "$$ID-9ebffe1e51b0bcf570d59ea8fd826d1a-None"
  string_value: "Use Sample Dataset (Cache Folder)"
}
widgets {
  id: "$$ID-9ee83401b0c7d4595da2e8ac6e0e0d46-None"
  string_value: "heart.csv"
}
widgets {
  id: "$$ID-e8f0b348eb01525f2f22d93a4e95911c-None"
  double_array_value {
    data: 100000
  }
}
widgets {
  id: "$$ID-ad59a5b4f412c26a40baa50e51b55411-None"
  int_value: 1
}
, page_script_hash='3f41e546893dc64b71aaacad12cad815', context_info=timezone: "Asia/Saigon"
timezone_offset: -420
locale: "en-GB"
url: "http://localhost:8501/"
is_embedded: false
color_scheme: "dark"
)
2025-10-01 09:55:38.809 Disconnecting files for session with ID 22a85a02-40b7-4cef-a39e-93f4fcfc16c8
2025-10-01 09:55:38.809 Sessions still active: dict_keys([])
2025-10-01 09:55:38.809 Files: 0; Sessions with files: 0
2025-10-01 09:55:38.811 Cache key: d41d8cd98f00b204e9800998ecf8427e
SUCCESS: Step 1 data saved to session state
DEBUG: Auto-save disabled to prevent crashes
SUCCESS: Step 1 data saved to session state
DEBUG: Auto-save disabled to prevent crashes
SUCCESS: Step 1 data saved to session state
DEBUG: Auto-save disabled to prevent crashes
💾 Saved default sampling config from sample: {'num_samples': 1025, 'sampling_strategy': 'Stratified (Recommended)'}
SUCCESS: Step 1 data saved to session state
DEBUG: Auto-save disabled to prevent crashes
SUCCESS: Step 1 data saved to session state
DEBUG: Auto-save disabled to prevent crashes
💾 [STEP1] Saved sampling config to session: {'num_samples': 1025, 'sampling_strategy': 'Stratified (Recommended)'}
📊 [STEP1] Dataset size: 1,025, Requested samples: 1,025
2025-10-01 09:55:38.976 Removing orphaned files...
2025-10-01 09:55:40.662 Received the following back message:
rerun_script {
  widget_states {
    widgets {
      id: "$$ID-9ebffe1e51b0bcf570d59ea8fd826d1a-None"
      string_value: "Use Sample Dataset (Cache Folder)"
    }
    widgets {
      id: "$$ID-9ee83401b0c7d4595da2e8ac6e0e0d46-None"
      string_value: "heart.csv"
    }
    widgets {
      id: "$$ID-ad59a5b4f412c26a40baa50e51b55411-None"
      int_value: 1
    }
    widgets {
      id: "$$ID-5ea744d2af25a3a5075eb1f827cf2ffa-None"
      double_array_value {
        data: 1025
      }
    }
    widgets {
      id: "$$ID-891d9fe078fd3b2097115dd2d8c5580e-next_btn_1"
      trigger_value: true
    }
  }
  page_script_hash: "3f41e546893dc64b71aaacad12cad815"
  context_info {
    timezone: "Asia/Saigon"
    timezone_offset: -420
    locale: "en-GB"
    url: "http://localhost:8501/"
    is_embedded: false
    color_scheme: "dark"
  }
}

2025-10-01 09:55:40.663 Beginning script thread
2025-10-01 09:55:40.664 Running script RerunData(widget_states=widgets {
  id: "$$ID-9ebffe1e51b0bcf570d59ea8fd826d1a-None"
  string_value: "Use Sample Dataset (Cache Folder)"
}
widgets {
  id: "$$ID-9ee83401b0c7d4595da2e8ac6e0e0d46-None"
  string_value: "heart.csv"
}
widgets {
  id: "$$ID-ad59a5b4f412c26a40baa50e51b55411-None"
  int_value: 1
}
widgets {
  id: "$$ID-5ea744d2af25a3a5075eb1f827cf2ffa-None"
  double_array_value {
    data: 1025
  }
}
widgets {
  id: "$$ID-891d9fe078fd3b2097115dd2d8c5580e-next_btn_1"
  trigger_value: true
}
, page_script_hash='3f41e546893dc64b71aaacad12cad815', context_info=timezone: "Asia/Saigon"
timezone_offset: -420
locale: "en-GB"
url: "http://localhost:8501/"
is_embedded: false
color_scheme: "dark"
)
2025-10-01 09:55:40.664 Disconnecting files for session with ID 22a85a02-40b7-4cef-a39e-93f4fcfc16c8
2025-10-01 09:55:40.664 Sessions still active: dict_keys([])
2025-10-01 09:55:40.664 Files: 0; Sessions with files: 0
2025-10-01 09:55:40.665 Cache key: d41d8cd98f00b204e9800998ecf8427e
SUCCESS: Step 1 data saved to session state
DEBUG: Auto-save disabled to prevent crashes
SUCCESS: Step 1 data saved to session state
DEBUG: Auto-save disabled to prevent crashes
SUCCESS: Step 1 data saved to session state
DEBUG: Auto-save disabled to prevent crashes
💾 Saved default sampling config from sample: {'num_samples': 1025, 'sampling_strategy': 'Stratified (Recommended)'}
SUCCESS: Step 1 data saved to session state
DEBUG: Auto-save disabled to prevent crashes
SUCCESS: Step 1 data saved to session state
DEBUG: Auto-save disabled to prevent crashes
💾 [STEP1] Saved sampling config to session: {'num_samples': 1025, 'sampling_strategy': 'Stratified (Recommended)'}
📊 [STEP1] Dataset size: 1,025, Requested samples: 1,025

🔄 [NAVIGATION] Moving from Step 1 to Step 2...
📊 [NAVIGATION] Step 1 data keys: ['dataframe', 'file_path', 'sampling_config', 'dataset_size']
💾 [NAVIGATION] Sampling config found: {'num_samples': 1025, 'sampling_strategy': 'Stratified (Recommended)'}
📊 [NAVIGATION] Dataset size: 1,025, Requested samples: 1025
2025-10-01 09:55:40.690 Removing orphaned files...
2025-10-01 09:55:40.808 Running script RerunData(page_script_hash='3f41e546893dc64b71aaacad12cad815', context_info=timezone: "Asia/Saigon"
timezone_offset: -420
locale: "en-GB"
url: "http://localhost:8501/"
is_embedded: false
color_scheme: "dark"
)
2025-10-01 09:55:40.808 Disconnecting files for session with ID 22a85a02-40b7-4cef-a39e-93f4fcfc16c8
2025-10-01 09:55:40.809 Sessions still active: dict_keys([])
2025-10-01 09:55:40.809 Files: 0; Sessions with files: 0
2025-10-01 09:55:40.810 Cache key: d41d8cd98f00b204e9800998ecf8427e
WARNING: Label column has only 2 classes (binary classification)
2025-10-01 09:55:40.844 Removing orphaned files...
2025-10-01 09:55:47.313 Received the following back message:
rerun_script {
  widget_states {
    widgets {
      id: "$$ID-c4830022cb40e4a63331d72f3196190a-None"
      string_value: "age"
    }
    widgets {
      id: "$$ID-9e8c706f48af9c9ea1cc8d22e38f695c-None"
      string_value: "sex"
    }
    widgets {
      id: "$$ID-4fe318aa9a47ac8d004fc218c4e588fe-None"
      bool_value: true
    }
    widgets {
      id: "$$ID-59334011565792afb3da2286c983bf6a-None"
      bool_value: true
    }
    widgets {
      id: "$$ID-ca9c21a5d143f084815c4ed662b92149-None"
      bool_value: true
    }
    widgets {
      id: "$$ID-7ec44be39cd6fbaabb18564f4901bbce-None"
      bool_value: true
    }
    widgets {
      id: "$$ID-dfea30af62d7f0a160467f694d883282-None"
      bool_value: false
    }
    widgets {
      id: "$$ID-1b6a7a129ba30661b9e0e5ea23e32650-None"
      bool_value: false
    }
    widgets {
      id: "$$ID-266ce47a97b9875897ab61d2722eff40-None"
      bool_value: false
    }
    widgets {
      id: "$$ID-9989725332afeb2f8d63cebf622197d2-None"
      bool_value: false
    }
    widgets {
      id: "$$ID-a69787b253181e91d28d3928c18a3283-multi_input_label_col"
      string_value: "target"
    }
    widgets {
      id: "$$ID-e6afcb40529c98f6a4c2cc649eec3c5e-multi_input_text_encoding"
      string_value: "None"
    }
    widgets {
      id: "$$ID-0d722c7ab474fcff7d9c4e638c1eff6d-multi_input_remove_duplicates"
      bool_value: false
    }
    widgets {
      id: "$$ID-4afc705390e6f167ae6194b3fee551a6-multi_input_outlier_detection"
      bool_value: false
    }
    widgets {
      id: "$$ID-87c2cdf4bf3cea63097cea81697ca967-multi_input_missing_strategy"
      string_value: "Fill with mean/median"
    }
    widgets {
      id: "$$ID-2d33f069dc41d37996098e6db5b0aa48-multi_input_input_cols"
      string_array_value {
        data: "age"
        data: "sex"
        data: "cp"
        data: "trestbps"
        data: "chol"
        data: "fbs"
        data: "restecg"
        data: "thalach"
        data: "exang"
        data: "oldpeak"
        data: "slope"
        data: "ca"
        data: "thal"
      }
    }
    widgets {
      id: "$$ID-1bd81b78063333b77cd229ca735366d5-multi_input_numeric_scaler"
      string_array_value {
        data: "StandardScaler"
        data: "MinMaxScaler"
      }
    }
  }
  page_script_hash: "3f41e546893dc64b71aaacad12cad815"
  context_info {
    timezone: "Asia/Saigon"
    timezone_offset: -420
    locale: "en-GB"
    url: "http://localhost:8501/"
    is_embedded: false
    color_scheme: "dark"
  }
}

2025-10-01 09:55:47.314 Beginning script thread
2025-10-01 09:55:47.315 Running script RerunData(widget_states=widgets {
  id: "$$ID-c4830022cb40e4a63331d72f3196190a-None"
  string_value: "age"
}
widgets {
  id: "$$ID-9e8c706f48af9c9ea1cc8d22e38f695c-None"
  string_value: "sex"
}
widgets {
  id: "$$ID-4fe318aa9a47ac8d004fc218c4e588fe-None"
  bool_value: true
}
widgets {
  id: "$$ID-59334011565792afb3da2286c983bf6a-None"
  bool_value: true
}
widgets {
  id: "$$ID-ca9c21a5d143f084815c4ed662b92149-None"
  bool_value: true
}
widgets {
  id: "$$ID-7ec44be39cd6fbaabb18564f4901bbce-None"
  bool_value: true
}
widgets {
  id: "$$ID-dfea30af62d7f0a160467f694d883282-None"
  bool_value: false
}
widgets {
  id: "$$ID-1b6a7a129ba30661b9e0e5ea23e32650-None"
  bool_value: false
}
widgets {
  id: "$$ID-266ce47a97b9875897ab61d2722eff40-None"
  bool_value: false
}
widgets {
  id: "$$ID-9989725332afeb2f8d63cebf622197d2-None"
  bool_value: false
}
widgets {
  id: "$$ID-a69787b253181e91d28d3928c18a3283-multi_input_label_col"
  string_value: "target"
}
widgets {
  id: "$$ID-e6afcb40529c98f6a4c2cc649eec3c5e-multi_input_text_encoding"
  string_value: "None"
}
widgets {
  id: "$$ID-0d722c7ab474fcff7d9c4e638c1eff6d-multi_input_remove_duplicates"
  bool_value: false
}
widgets {
  id: "$$ID-4afc705390e6f167ae6194b3fee551a6-multi_input_outlier_detection"
  bool_value: false
}
widgets {
  id: "$$ID-87c2cdf4bf3cea63097cea81697ca967-multi_input_missing_strategy"
  string_value: "Fill with mean/median"
}
widgets {
  id: "$$ID-2d33f069dc41d37996098e6db5b0aa48-multi_input_input_cols"
  string_array_value {
    data: "age"
    data: "sex"
    data: "cp"
    data: "trestbps"
    data: "chol"
    data: "fbs"
    data: "restecg"
    data: "thalach"
    data: "exang"
    data: "oldpeak"
    data: "slope"
    data: "ca"
    data: "thal"
  }
}
widgets {
  id: "$$ID-1bd81b78063333b77cd229ca735366d5-multi_input_numeric_scaler"
  string_array_value {
    data: "StandardScaler"
    data: "MinMaxScaler"
  }
}
, page_script_hash='3f41e546893dc64b71aaacad12cad815', context_info=timezone: "Asia/Saigon"
timezone_offset: -420
locale: "en-GB"
url: "http://localhost:8501/"
is_embedded: false
color_scheme: "dark"
)
2025-10-01 09:55:47.315 Disconnecting files for session with ID 22a85a02-40b7-4cef-a39e-93f4fcfc16c8
2025-10-01 09:55:47.315 Sessions still active: dict_keys([])
2025-10-01 09:55:47.315 Files: 0; Sessions with files: 0
2025-10-01 09:55:47.316 Cache key: d41d8cd98f00b204e9800998ecf8427e
WARNING: Label column has only 2 classes (binary classification)
2025-10-01 09:55:47.350 Removing orphaned files...
2025-10-01 09:55:47.777 Received the following back message:
rerun_script {
  widget_states {
    widgets {
      id: "$$ID-c4830022cb40e4a63331d72f3196190a-None"
      string_value: "age"
    }
    widgets {
      id: "$$ID-9e8c706f48af9c9ea1cc8d22e38f695c-None"
      string_value: "sex"
    }
    widgets {
      id: "$$ID-4fe318aa9a47ac8d004fc218c4e588fe-None"
      bool_value: true
    }
    widgets {
      id: "$$ID-59334011565792afb3da2286c983bf6a-None"
      bool_value: true
    }
    widgets {
      id: "$$ID-ca9c21a5d143f084815c4ed662b92149-None"
      bool_value: true
    }
    widgets {
      id: "$$ID-7ec44be39cd6fbaabb18564f4901bbce-None"
      bool_value: true
    }
    widgets {
      id: "$$ID-dfea30af62d7f0a160467f694d883282-None"
      bool_value: false
    }
    widgets {
      id: "$$ID-1b6a7a129ba30661b9e0e5ea23e32650-None"
      bool_value: false
    }
    widgets {
      id: "$$ID-266ce47a97b9875897ab61d2722eff40-None"
      bool_value: false
    }
    widgets {
      id: "$$ID-9989725332afeb2f8d63cebf622197d2-None"
      bool_value: false
    }
    widgets {
      id: "$$ID-a69787b253181e91d28d3928c18a3283-multi_input_label_col"
      string_value: "target"
    }
    widgets {
      id: "$$ID-e6afcb40529c98f6a4c2cc649eec3c5e-multi_input_text_encoding"
      string_value: "None"
    }
    widgets {
      id: "$$ID-0d722c7ab474fcff7d9c4e638c1eff6d-multi_input_remove_duplicates"
      bool_value: false
    }
    widgets {
      id: "$$ID-4afc705390e6f167ae6194b3fee551a6-multi_input_outlier_detection"
      bool_value: false
    }
    widgets {
      id: "$$ID-87c2cdf4bf3cea63097cea81697ca967-multi_input_missing_strategy"
      string_value: "Fill with mean/median"
    }
    widgets {
      id: "$$ID-2d33f069dc41d37996098e6db5b0aa48-multi_input_input_cols"
      string_array_value {
        data: "age"
        data: "sex"
        data: "cp"
        data: "trestbps"
        data: "chol"
        data: "fbs"
        data: "restecg"
        data: "thalach"
        data: "exang"
        data: "oldpeak"
        data: "slope"
        data: "ca"
        data: "thal"
      }
    }
    widgets {
      id: "$$ID-1bd81b78063333b77cd229ca735366d5-multi_input_numeric_scaler"
      string_array_value {
        data: "StandardScaler"
        data: "MinMaxScaler"
        data: "RobustScaler"
      }
    }
  }
  page_script_hash: "3f41e546893dc64b71aaacad12cad815"
  context_info {
    timezone: "Asia/Saigon"
    timezone_offset: -420
    locale: "en-GB"
    url: "http://localhost:8501/"
    is_embedded: false
    color_scheme: "dark"
  }
}

2025-10-01 09:55:47.779 Beginning script thread
2025-10-01 09:55:47.779 Running script RerunData(widget_states=widgets {
  id: "$$ID-c4830022cb40e4a63331d72f3196190a-None"
  string_value: "age"
}
widgets {
  id: "$$ID-9e8c706f48af9c9ea1cc8d22e38f695c-None"
  string_value: "sex"
}
widgets {
  id: "$$ID-4fe318aa9a47ac8d004fc218c4e588fe-None"
  bool_value: true
}
widgets {
  id: "$$ID-59334011565792afb3da2286c983bf6a-None"
  bool_value: true
}
widgets {
  id: "$$ID-ca9c21a5d143f084815c4ed662b92149-None"
  bool_value: true
}
widgets {
  id: "$$ID-7ec44be39cd6fbaabb18564f4901bbce-None"
  bool_value: true
}
widgets {
  id: "$$ID-dfea30af62d7f0a160467f694d883282-None"
  bool_value: false
}
widgets {
  id: "$$ID-1b6a7a129ba30661b9e0e5ea23e32650-None"
  bool_value: false
}
widgets {
  id: "$$ID-266ce47a97b9875897ab61d2722eff40-None"
  bool_value: false
}
widgets {
  id: "$$ID-9989725332afeb2f8d63cebf622197d2-None"
  bool_value: false
}
widgets {
  id: "$$ID-a69787b253181e91d28d3928c18a3283-multi_input_label_col"
  string_value: "target"
}
widgets {
  id: "$$ID-e6afcb40529c98f6a4c2cc649eec3c5e-multi_input_text_encoding"
  string_value: "None"
}
widgets {
  id: "$$ID-0d722c7ab474fcff7d9c4e638c1eff6d-multi_input_remove_duplicates"
  bool_value: false
}
widgets {
  id: "$$ID-4afc705390e6f167ae6194b3fee551a6-multi_input_outlier_detection"
  bool_value: false
}
widgets {
  id: "$$ID-87c2cdf4bf3cea63097cea81697ca967-multi_input_missing_strategy"
  string_value: "Fill with mean/median"
}
widgets {
  id: "$$ID-2d33f069dc41d37996098e6db5b0aa48-multi_input_input_cols"
  string_array_value {
    data: "age"
    data: "sex"
    data: "cp"
    data: "trestbps"
    data: "chol"
    data: "fbs"
    data: "restecg"
    data: "thalach"
    data: "exang"
    data: "oldpeak"
    data: "slope"
    data: "ca"
    data: "thal"
  }
}
widgets {
  id: "$$ID-1bd81b78063333b77cd229ca735366d5-multi_input_numeric_scaler"
  string_array_value {
    data: "StandardScaler"
    data: "MinMaxScaler"
    data: "RobustScaler"
  }
}
, page_script_hash='3f41e546893dc64b71aaacad12cad815', context_info=timezone: "Asia/Saigon"
timezone_offset: -420
locale: "en-GB"
url: "http://localhost:8501/"
is_embedded: false
color_scheme: "dark"
)
2025-10-01 09:55:47.780 Disconnecting files for session with ID 22a85a02-40b7-4cef-a39e-93f4fcfc16c8
2025-10-01 09:55:47.780 Sessions still active: dict_keys([])
2025-10-01 09:55:47.780 Files: 0; Sessions with files: 0
2025-10-01 09:55:47.781 Cache key: d41d8cd98f00b204e9800998ecf8427e
WARNING: Label column has only 2 classes (binary classification)
2025-10-01 09:55:47.817 Removing orphaned files...
2025-10-01 09:55:50.111 Received the following back message:
rerun_script {
  widget_states {
    widgets {
      id: "$$ID-c4830022cb40e4a63331d72f3196190a-None"
      string_value: "age"
    }
    widgets {
      id: "$$ID-9e8c706f48af9c9ea1cc8d22e38f695c-None"
      string_value: "sex"
    }
    widgets {
      id: "$$ID-4fe318aa9a47ac8d004fc218c4e588fe-None"
      bool_value: true
    }
    widgets {
      id: "$$ID-59334011565792afb3da2286c983bf6a-None"
      bool_value: true
    }
    wi