[I 2025-10-01 09:56:27,724] Trial 5 finished with value: 1.0 and parameters: {'iterations': 404, 'depth': 4, 'learning_rate': 0.05748924681991978, 'l2_leaf_reg': 3.9121416285496955, 'border_count': 42}. Best is trial 0 with value: 1.0.
INFO:gpu_config_manager:GPU mode enabled for catboost: GPU: NVIDIA GeForce RTX 3060 (1 devices, 12.0GB)
🚀 CatBoost configured for GPU: GPU: NVIDIA GeForce RTX 3060 (1 devices, 12.0GB)
[I 2025-10-01 09:56:29,191] Trial 6 finished with value: 0.9313725490196079 and parameters: {'iterations': 324, 'depth': 4, 'learning_rate': 0.012476394272569451, 'l2_leaf_reg': 8.88966790701893, 'border_count': 248}. Best is trial 0 with value: 1.0.
INFO:gpu_config_manager:GPU mode enabled for catboost: GPU: NVIDIA GeForce RTX 3060 (1 devices, 12.0GB)
🚀 CatBoost configured for GPU: GPU: NVIDIA GeForce RTX 3060 (1 devices, 12.0GB)
[I 2025-10-01 09:56:31,228] Trial 7 finished with value: 1.0 and parameters: {'iterations': 414, 'depth': 5, 'learning_rate': 0.013940346079873234, 'l2_leaf_reg': 4.833180632488465, 'border_count': 130}. Best is trial 0 with value: 1.0.
INFO:gpu_config_manager:GPU mode enabled for catboost: GPU: NVIDIA GeForce RTX 3060 (1 devices, 12.0GB)
🚀 CatBoost configured for GPU: GPU: NVIDIA GeForce RTX 3060 (1 devices, 12.0GB)
[I 2025-10-01 09:56:31,873] Trial 8 finished with value: 0.9215686274509803 and parameters: {'iterations': 105, 'depth': 6, 'learning_rate': 0.011240768803005551, 'l2_leaf_reg': 8.115595675970502, 'border_count': 89}. Best is trial 0 with value: 1.0.
INFO:gpu_config_manager:GPU mode enabled for catboost: GPU: NVIDIA GeForce RTX 3060 (1 devices, 12.0GB)
🚀 CatBoost configured for GPU: GPU: NVIDIA GeForce RTX 3060 (1 devices, 12.0GB)
[I 2025-10-01 09:56:33,686] Trial 9 finished with value: 1.0 and parameters: {'iterations': 348, 'depth': 5, 'learning_rate': 0.05864129169696527, 'l2_leaf_reg': 3.521358805467868, 'border_count': 73}. Best is trial 0 with value: 1.0.
INFO:optuna_optimizer:Optimization completed for catboost
INFO:optuna_optimizer:Best score: 1.0000
INFO:optuna_optimizer:Best params: {'iterations': 218, 'depth': 10, 'learning_rate': 0.1205712628744377, 'l2_leaf_reg': 3.968793330444372, 'border_count': 66}
INFO:gpu_config_manager:GPU mode enabled for catboost: GPU: NVIDIA GeForce RTX 3060 (1 devices, 12.0GB)
🚀 CatBoost configured for GPU: GPU: NVIDIA GeForce RTX 3060 (1 devices, 12.0GB)
DEBUG: Starting cache save for catboost
DEBUG: Cache directory created: cache\models\catboost\numeric_dataset_StandardScaler\1a951cb75f7849e000b77f9f7bd0d0c9b8e4e7b37bf444706aff0eadb72226fd
DEBUG: Model artifact saved: cache\models\catboost\numeric_dataset_StandardScaler\1a951cb75f7849e000b77f9f7bd0d0c9b8e4e7b37bf444706aff0eadb72226fd\model.cbm
DEBUG: Params saved: cache\models\catboost\numeric_dataset_StandardScaler\1a951cb75f7849e000b77f9f7bd0d0c9b8e4e7b37bf444706aff0eadb72226fd\params.json
DEBUG: Metrics saved: cache\models\catboost\numeric_dataset_StandardScaler\1a951cb75f7849e000b77f9f7bd0d0c9b8e4e7b37bf444706aff0eadb72226fd\metrics.json
DEBUG: Config saved: cache\models\catboost\numeric_dataset_StandardScaler\1a951cb75f7849e000b77f9f7bd0d0c9b8e4e7b37bf444706aff0eadb72226fd\config.json
INFO:cache_manager:Cache saved for catboost at cache\models\catboost\numeric_dataset_StandardScaler\1a951cb75f7849e000b77f9f7bd0d0c9b8e4e7b37bf444706aff0eadb72226fd
DEBUG: Garbage collection completed for catboost
DEBUG: Garbage collection completed for catboost
[I 2025-10-01 09:56:37,749] A new study created in memory with name: adaboost_optimization
INFO:optuna_optimizer:Created Optuna study: adaboost_optimization
INFO:optuna_optimizer:Starting optimization for adaboost...
[I 2025-10-01 09:56:37,889] Trial 0 finished with value: 0.9117647058823529 and parameters: {'n_estimators': 87, 'learning_rate': 1.5403596595019242}. Best is trial 0 with value: 0.9117647058823529.
[I 2025-10-01 09:56:38,112] Trial 1 finished with value: 0.8823529411764706 and parameters: {'n_estimators': 152, 'learning_rate': 0.23852347578447078}. Best is trial 0 with value: 0.9117647058823529.
[I 2025-10-01 09:56:38,174] Trial 2 finished with value: 0.8529411764705882 and parameters: {'n_estimators': 48, 'learning_rate': 0.022853255256339213}. Best is trial 0 with value: 0.9117647058823529.
[I 2025-10-01 09:56:38,219] Trial 3 finished with value: 0.8431372549019608 and parameters: {'n_estimators': 30, 'learning_rate': 0.98423157385026}. Best is trial 0 with value: 0.9117647058823529.
[I 2025-10-01 09:56:38,399] Trial 4 finished with value: 0.9019607843137255 and parameters: {'n_estimators': 128, 'learning_rate': 0.4258888210290082}. Best is trial 0 with value: 0.9117647058823529.
[I 2025-10-01 09:56:38,431] Trial 5 finished with value: 0.8725490196078431 and parameters: {'n_estimators': 23, 'learning_rate': 1.7052641538983098}. Best is trial 0 with value: 0.9117647058823529.
[I 2025-10-01 09:56:38,709] Trial 6 finished with value: 0.8823529411764706 and parameters: {'n_estimators': 170, 'learning_rate': 0.030803400529839688}. Best is trial 0 with value: 0.9117647058823529.
[I 2025-10-01 09:56:38,795] Trial 7 finished with value: 0.8823529411764706 and parameters: {'n_estimators': 52, 'learning_rate': 0.02642526057549918}. Best is trial 0 with value: 0.9117647058823529.
[I 2025-10-01 09:56:38,905] Trial 8 finished with value: 0.8627450980392157 and parameters: {'n_estimators': 75, 'learning_rate': 0.16124278458562616}. Best is trial 0 with value: 0.9117647058823529.
[I 2025-10-01 09:56:39,049] Trial 9 finished with value: 0.8725490196078431 and parameters: {'n_estimators': 98, 'learning_rate': 0.04678719265016203}. Best is trial 0 with value: 0.9117647058823529.
INFO:optuna_optimizer:Optimization completed for adaboost
INFO:optuna_optimizer:Best score: 0.9118
INFO:optuna_optimizer:Best params: {'n_estimators': 87, 'learning_rate': 1.5403596595019242}
DEBUG: Starting cache save for adaboost
DEBUG: Cache directory created: cache\models\adaboost\numeric_dataset_StandardScaler\3e294c821ced5dfd356b784893759002790c0f8bb8b37995f3dcc3f33e9c49a5
DEBUG: Model artifact saved: cache\models\adaboost\numeric_dataset_StandardScaler\3e294c821ced5dfd356b784893759002790c0f8bb8b37995f3dcc3f33e9c49a5\model.pkl
DEBUG: Params saved: cache\models\adaboost\numeric_dataset_StandardScaler\3e294c821ced5dfd356b784893759002790c0f8bb8b37995f3dcc3f33e9c49a5\params.json
DEBUG: Metrics saved: cache\models\adaboost\numeric_dataset_StandardScaler\3e294c821ced5dfd356b784893759002790c0f8bb8b37995f3dcc3f33e9c49a5\metrics.json
DEBUG: Config saved: cache\models\adaboost\numeric_dataset_StandardScaler\3e294c821ced5dfd356b784893759002790c0f8bb8b37995f3dcc3f33e9c49a5\config.json
INFO:cache_manager:Cache saved for adaboost at cache\models\adaboost\numeric_dataset_StandardScaler\3e294c821ced5dfd356b784893759002790c0f8bb8b37995f3dcc3f33e9c49a5
DEBUG: Garbage collection completed for adaboost
DEBUG: Garbage collection completed for adaboost
[I 2025-10-01 09:56:39,473] A new study created in memory with name: gradient_boosting_optimization
INFO:optuna_optimizer:Created Optuna study: gradient_boosting_optimization
INFO:optuna_optimizer:Starting optimization for gradient_boosting...
[I 2025-10-01 09:56:39,878] Trial 0 finished with value: 1.0 and parameters: {'n_estimators': 144, 'learning_rate': 0.2536999076681772, 'max_depth': 8, 'subsample': 0.8394633936788146}. Best is trial 0 with value: 1.0.
[I 2025-10-01 09:56:40,006] Trial 1 finished with value: 0.8431372549019608 and parameters: {'n_estimators': 89, 'learning_rate': 0.01699897838270077, 'max_depth': 3, 'subsample': 0.9464704583099741}. Best is trial 0 with value: 1.0.
[I 2025-10-01 09:56:40,289] Trial 2 finished with value: 1.0 and parameters: {'n_estimators': 200, 'learning_rate': 0.11114989443094977, 'max_depth': 3, 'subsample': 0.9879639408647978}. Best is trial 0 with value: 1.0.
[I 2025-10-01 09:56:40,767] Trial 3 finished with value: 1.0 and parameters: {'n_estimators': 258, 'learning_rate': 0.020589728197687916, 'max_depth': 4, 'subsample': 0.6733618039413735}. Best is trial 0 with value: 1.0.
[I 2025-10-01 09:56:41,142] Trial 4 finished with value: 1.0 and parameters: {'n_estimators': 126, 'learning_rate': 0.05958389350068958, 'max_depth': 6, 'subsample': 0.7164916560792167}. Best is trial 0 with value: 1.0.
[I 2025-10-01 09:56:41,654] Trial 5 finished with value: 1.0 and parameters: {'n_estimators': 203, 'learning_rate': 0.01607123851203988, 'max_depth': 5, 'subsample': 0.7465447373174767}. Best is trial 0 with value: 1.0.
[I 2025-10-01 09:56:41,925] Trial 6 finished with value: 1.0 and parameters: {'n_estimators': 164, 'learning_rate': 0.14447746112718687, 'max_depth': 4, 'subsample': 0.8056937753654446}. Best is trial 0 with value: 1.0.
[I 2025-10-01 09:56:42,592] Trial 7 finished with value: 1.0 and parameters: {'n_estimators': 198, 'learning_rate': 0.011711509955524094, 'max_depth': 7, 'subsample': 0.6682096494749166}. Best is trial 0 with value: 1.0.
[I 2025-10-01 09:56:42,802] Trial 8 finished with value: 0.9803921568627451 and parameters: {'n_estimators': 66, 'learning_rate': 0.2521267904777921, 'max_depth': 10, 'subsample': 0.9233589392465844}. Best is trial 0 with value: 1.0.
[I 2025-10-01 09:56:43,291] Trial 9 finished with value: 0.9803921568627451 and parameters: {'n_estimators': 126, 'learning_rate': 0.013940346079873234, 'max_depth': 8, 'subsample': 0.7760609974958406}. Best is trial 0 with value: 1.0.
INFO:optuna_optimizer:Optimization completed for gradient_boosting
INFO:optuna_optimizer:Best score: 1.0000
INFO:optuna_optimizer:Best params: {'n_estimators': 144, 'learning_rate': 0.2536999076681772, 'max_depth': 8, 'subsample': 0.8394633936788146}
DEBUG: Starting cache save for gradient_boosting
DEBUG: Cache directory created: cache\models\gradient_boosting\numeric_dataset_StandardScaler\7f45f2ecfc186e79f23f837c081468fffed776514686c000c83f25ea45b5c1e2
DEBUG: Model artifact saved: cache\models\gradient_boosting\numeric_dataset_StandardScaler\7f45f2ecfc186e79f23f837c081468fffed776514686c000c83f25ea45b5c1e2\model.pkl
DEBUG: Params saved: cache\models\gradient_boosting\numeric_dataset_StandardScaler\7f45f2ecfc186e79f23f837c081468fffed776514686c000c83f25ea45b5c1e2\params.json
DEBUG: Metrics saved: cache\models\gradient_boosting\numeric_dataset_StandardScaler\7f45f2ecfc186e79f23f837c081468fffed776514686c000c83f25ea45b5c1e2\metrics.json
DEBUG: Config saved: cache\models\gradient_boosting\numeric_dataset_StandardScaler\7f45f2ecfc186e79f23f837c081468fffed776514686c000c83f25ea45b5c1e2\config.json
INFO:cache_manager:Cache saved for gradient_boosting at cache\models\gradient_boosting\numeric_dataset_StandardScaler\7f45f2ecfc186e79f23f837c081468fffed776514686c000c83f25ea45b5c1e2
DEBUG: Garbage collection completed for gradient_boosting
DEBUG: Garbage collection completed for gradient_boosting
[I 2025-10-01 09:56:43,921] A new study created in memory with name: decision_tree_optimization
INFO:optuna_optimizer:Created Optuna study: decision_tree_optimization
INFO:optuna_optimizer:Starting optimization for decision_tree...
🖥️ Using CPU without pruning (CCP disabled on Windows)
[I 2025-10-01 09:56:43,925] Trial 0 finished with value: 0.9803921568627451 and parameters: {}. Best is trial 0 with value: 0.9803921568627451.
🖥️ Using CPU without pruning (CCP disabled on Windows)
[I 2025-10-01 09:56:43,928] Trial 1 finished with value: 0.9803921568627451 and parameters: {}. Best is trial 0 with value: 0.9803921568627451.
🖥️ Using CPU without pruning (CCP disabled on Windows)
[I 2025-10-01 09:56:43,932] Trial 2 finished with value: 0.9803921568627451 and parameters: {}. Best is trial 0 with value: 0.9803921568627451.
🖥️ Using CPU without pruning (CCP disabled on Windows)
[I 2025-10-01 09:56:43,934] Trial 3 finished with value: 0.9803921568627451 and parameters: {}. Best is trial 0 with value: 0.9803921568627451.
🖥️ Using CPU without pruning (CCP disabled on Windows)
[I 2025-10-01 09:56:43,937] Trial 4 finished with value: 0.9803921568627451 and parameters: {}. Best is trial 0 with value: 0.9803921568627451.
🖥️ Using CPU without pruning (CCP disabled on Windows)
[I 2025-10-01 09:56:43,940] Trial 5 finished with value: 0.9803921568627451 and parameters: {}. Best is trial 0 with value: 0.9803921568627451.
🖥️ Using CPU without pruning (CCP disabled on Windows)
[I 2025-10-01 09:56:43,943] Trial 6 finished with value: 0.9803921568627451 and parameters: {}. Best is trial 0 with value: 0.9803921568627451.
🖥️ Using CPU without pruning (CCP disabled on Windows)
[I 2025-10-01 09:56:43,947] Trial 7 finished with value: 0.9803921568627451 and parameters: {}. Best is trial 0 with value: 0.9803921568627451.
🖥️ Using CPU without pruning (CCP disabled on Windows)
[I 2025-10-01 09:56:43,950] Trial 8 finished with value: 0.9803921568627451 and parameters: {}. Best is trial 0 with value: 0.9803921568627451.
🖥️ Using CPU without pruning (CCP disabled on Windows)
[I 2025-10-01 09:56:43,954] Trial 9 finished with value: 0.9803921568627451 and parameters: {}. Best is trial 0 with value: 0.9803921568627451.
INFO:optuna_optimizer:Optimization completed for decision_tree
INFO:optuna_optimizer:Best score: 0.9804
INFO:optuna_optimizer:Best params: {}
🖥️ Using CPU without pruning (CCP disabled on Windows)
DEBUG: Starting cache save for decision_tree
DEBUG: Cache directory created: cache\models\decision_tree\numeric_dataset_StandardScaler\bd725e1127e6942d2cabd875aabcf68f096e7253b033ad48d65454cbc006d797
DEBUG: Model artifact saved: cache\models\decision_tree\numeric_dataset_StandardScaler\bd725e1127e6942d2cabd875aabcf68f096e7253b033ad48d65454cbc006d797\model.pkl
DEBUG: Params saved: cache\models\decision_tree\numeric_dataset_StandardScaler\bd725e1127e6942d2cabd875aabcf68f096e7253b033ad48d65454cbc006d797\params.json
DEBUG: Metrics saved: cache\models\decision_tree\numeric_dataset_StandardScaler\bd725e1127e6942d2cabd875aabcf68f096e7253b033ad48d65454cbc006d797\metrics.json
DEBUG: Config saved: cache\models\decision_tree\numeric_dataset_StandardScaler\bd725e1127e6942d2cabd875aabcf68f096e7253b033ad48d65454cbc006d797\config.json
INFO:cache_manager:Cache saved for decision_tree at cache\models\decision_tree\numeric_dataset_StandardScaler\bd725e1127e6942d2cabd875aabcf68f096e7253b033ad48d65454cbc006d797
DEBUG: Garbage collection completed for decision_tree
DEBUG: Garbage collection completed for decision_tree
[I 2025-10-01 09:56:44,227] A new study created in memory with name: logistic_regression_optimization
INFO:optuna_optimizer:Created Optuna study: logistic_regression_optimization
INFO:optuna_optimizer:Starting optimization for logistic_regression...
🔄 CPU multithreading: Using all 12 available cores
[I 2025-10-01 09:56:44,231] Trial 0 finished with value: 0.8137254901960784 and parameters: {}. Best is trial 0 with value: 0.8137254901960784.
🔄 CPU multithreading: Using all 12 available cores
[I 2025-10-01 09:56:44,235] Trial 1 finished with value: 0.8137254901960784 and parameters: {}. Best is trial 0 with value: 0.8137254901960784.
🔄 CPU multithreading: Using all 12 available cores
[I 2025-10-01 09:56:44,239] Trial 2 finished with value: 0.8137254901960784 and parameters: {}. Best is trial 0 with value: 0.8137254901960784.
🔄 CPU multithreading: Using all 12 available cores
[I 2025-10-01 09:56:44,242] Trial 3 finished with value: 0.8137254901960784 and parameters: {}. Best is trial 0 with value: 0.8137254901960784.
🔄 CPU multithreading: Using all 12 available cores
[I 2025-10-01 09:56:44,246] Trial 4 finished with value: 0.8137254901960784 and parameters: {}. Best is trial 0 with value: 0.8137254901960784.
🔄 CPU multithreading: Using all 12 available cores
[I 2025-10-01 09:56:44,250] Trial 5 finished with value: 0.8137254901960784 and parameters: {}. Best is trial 0 with value: 0.8137254901960784.
🔄 CPU multithreading: Using all 12 available cores
[I 2025-10-01 09:56:44,254] Trial 6 finished with value: 0.8137254901960784 and parameters: {}. Best is trial 0 with value: 0.8137254901960784.
🔄 CPU multithreading: Using all 12 available cores
[I 2025-10-01 09:56:44,258] Trial 7 finished with value: 0.8137254901960784 and parameters: {}. Best is trial 0 with value: 0.8137254901960784.
🔄 CPU multithreading: Using all 12 available cores
[I 2025-10-01 09:56:44,261] Trial 8 finished with value: 0.8137254901960784 and parameters: {}. Best is trial 0 with value: 0.8137254901960784.
🔄 CPU multithreading: Using all 12 available cores
[I 2025-10-01 09:56:44,264] Trial 9 finished with value: 0.8137254901960784 and parameters: {}. Best is trial 0 with value: 0.8137254901960784.
INFO:optuna_optimizer:Optimization completed for logistic_regression
INFO:optuna_optimizer:Best score: 0.8137
INFO:optuna_optimizer:Best params: {}
🔄 CPU multithreading: Using all 12 available cores
DEBUG: Starting cache save for logistic_regression
DEBUG: Cache directory created: cache\models\logistic_regression\numeric_dataset_StandardScaler\7b6c6457b746766d8fc6a5daef0b3a925227491c97a59011f3066a4429289aa9
DEBUG: Model artifact saved: cache\models\logistic_regression\numeric_dataset_StandardScaler\7b6c6457b746766d8fc6a5daef0b3a925227491c97a59011f3066a4429289aa9\model.pkl
DEBUG: Params saved: cache\models\logistic_regression\numeric_dataset_StandardScaler\7b6c6457b746766d8fc6a5daef0b3a925227491c97a59011f3066a4429289aa9\params.json
DEBUG: Metrics saved: cache\models\logistic_regression\numeric_dataset_StandardScaler\7b6c6457b746766d8fc6a5daef0b3a925227491c97a59011f3066a4429289aa9\metrics.json
DEBUG: Config saved: cache\models\logistic_regression\numeric_dataset_StandardScaler\7b6c6457b746766d8fc6a5daef0b3a925227491c97a59011f3066a4429289aa9\config.json
INFO:cache_manager:Cache saved for logistic_regression at cache\models\logistic_regression\numeric_dataset_StandardScaler\7b6c6457b746766d8fc6a5daef0b3a925227491c97a59011f3066a4429289aa9
DEBUG: Garbage collection completed for logistic_regression
DEBUG: Garbage collection completed for logistic_regression
⚡ Using SGDClassifier (fastest overall)
[I 2025-10-01 09:56:44,544] A new study created in memory with name: svm_optimization
INFO:optuna_optimizer:Created Optuna study: svm_optimization
INFO:optuna_optimizer:Starting optimization for svm...
⚡ Using SGDClassifier (fastest overall)
INFO:SVM_Training:🚀 Starting SVM training at 2025-10-01 09:56:44
INFO:SVM_Training:📊 Data: 820 samples, 13 features, 1 classes
INFO:SVM_Training:⚙️  Parameters: {'C': 1.0, 'kernel': 'rbf', 'gamma': 'scale', 'random_state': 42, 'max_iter': 1000, 'tol': 0.001, 'auto_fast': True}
INFO:SVM_Training:💾 Estimated memory: 0.08 MB
INFO:SVM_Training:💻 Using CPU (scikit-learn) - Fast and reliable
📊 Using dense array for SVM training: (820, 13)
INFO:SVM_Training:🔧 Data preparation: dense_array
INFO:SVM_Training:✅ Training completed on CPU in 0.0015s
INFO:SVM_Training:🎯 Total support vectors: 0
INFO:SVM_Training:🔮 Prediction on 102 samples using CPU in 0.0000s
[I 2025-10-01 09:56:44,547] Trial 0 finished with value: 0.7647058823529411 and parameters: {}. Best is trial 0 with value: 0.7647058823529411.
⚡ Using SGDClassifier (fastest overall)
INFO:SVM_Training:🚀 Starting SVM training at 2025-10-01 09:56:44
INFO:SVM_Training:📊 Data: 820 samples, 13 features, 1 classes
INFO:SVM_Training:⚙️  Parameters: {'C': 1.0, 'kernel': 'rbf', 'gamma': 'scale', 'random_state': 42, 'max_iter': 1000, 'tol': 0.001, 'auto_fast': True}
INFO:SVM_Training:💾 Estimated memory: 0.08 MB
INFO:SVM_Training:💻 Using CPU (scikit-learn) - Fast and reliable
📊 Using dense array for SVM training: (820, 13)
INFO:SVM_Training:🔧 Data preparation: dense_array
INFO:SVM_Training:✅ Training completed on CPU in 0.0010s
INFO:SVM_Training:🎯 Total support vectors: 0
INFO:SVM_Training:🔮 Prediction on 102 samples using CPU in 0.0000s
[I 2025-10-01 09:56:44,550] Trial 1 finished with value: 0.7647058823529411 and parameters: {}. Best is trial 0 with value: 0.7647058823529411.
⚡ Using SGDClassifier (fastest overall)
INFO:SVM_Training:🚀 Starting SVM training at 2025-10-01 09:56:44
INFO:SVM_Training:📊 Data: 820 samples, 13 features, 1 classes
INFO:SVM_Training:⚙️  Parameters: {'C': 1.0, 'kernel': 'rbf', 'gamma': 'scale', 'random_state': 42, 'max_iter': 1000, 'tol': 0.001, 'auto_fast': True}
INFO:SVM_Training:💾 Estimated memory: 0.08 MB
INFO:SVM_Training:💻 Using CPU (scikit-learn) - Fast and reliable
📊 Using dense array for SVM training: (820, 13)
INFO:SVM_Training:🔧 Data preparation: dense_array
INFO:SVM_Training:✅ Training completed on CPU in 0.0010s
INFO:SVM_Training:🎯 Total support vectors: 0
INFO:SVM_Training:🔮 Prediction on 102 samples using CPU in 0.0000s
[I 2025-10-01 09:56:44,552] Trial 2 finished with value: 0.7647058823529411 and parameters: {}. Best is trial 0 with value: 0.7647058823529411.
⚡ Using SGDClassifier (fastest overall)
INFO:SVM_Training:🚀 Starting SVM training at 2025-10-01 09:56:44
INFO:SVM_Training:📊 Data: 820 samples, 13 features, 1 classes
INFO:SVM_Training:⚙️  Parameters: {'C': 1.0, 'kernel': 'rbf', 'gamma': 'scale', 'random_state': 42, 'max_iter': 1000, 'tol': 0.001, 'auto_fast': True}
INFO:SVM_Training:💾 Estimated memory: 0.08 MB
INFO:SVM_Training:💻 Using CPU (scikit-learn) - Fast and reliable
📊 Using dense array for SVM training: (820, 13)
INFO:SVM_Training:🔧 Data preparation: dense_array
INFO:SVM_Training:✅ Training completed on CPU in 0.0010s
INFO:SVM_Training:🎯 Total support vectors: 0
INFO:SVM_Training:🔮 Prediction on 102 samples using CPU in 0.0010s
