[I 2025-10-01 09:56:44,555] Trial 3 finished with value: 0.7647058823529411 and parameters: {}. Best is trial 0 with value: 0.7647058823529411.
⚡ Using SGDClassifier (fastest overall)
INFO:SVM_Training:🚀 Starting SVM training at 2025-10-01 09:56:44
INFO:SVM_Training:📊 Data: 820 samples, 13 features, 1 classes
INFO:SVM_Training:⚙️  Parameters: {'C': 1.0, 'kernel': 'rbf', 'gamma': 'scale', 'random_state': 42, 'max_iter': 1000, 'tol': 0.001, 'auto_fast': True}
INFO:SVM_Training:💾 Estimated memory: 0.08 MB
INFO:SVM_Training:💻 Using CPU (scikit-learn) - Fast and reliable
📊 Using dense array for SVM training: (820, 13)
INFO:SVM_Training:🔧 Data preparation: dense_array
INFO:SVM_Training:✅ Training completed on CPU in 0.0010s
INFO:SVM_Training:🎯 Total support vectors: 0
INFO:SVM_Training:🔮 Prediction on 102 samples using CPU in 0.0000s
[I 2025-10-01 09:56:44,558] Trial 4 finished with value: 0.7647058823529411 and parameters: {}. Best is trial 0 with value: 0.7647058823529411.
⚡ Using SGDClassifier (fastest overall)
INFO:SVM_Training:🚀 Starting SVM training at 2025-10-01 09:56:44
INFO:SVM_Training:📊 Data: 820 samples, 13 features, 1 classes
INFO:SVM_Training:⚙️  Parameters: {'C': 1.0, 'kernel': 'rbf', 'gamma': 'scale', 'random_state': 42, 'max_iter': 1000, 'tol': 0.001, 'auto_fast': True}
INFO:SVM_Training:💾 Estimated memory: 0.08 MB
INFO:SVM_Training:💻 Using CPU (scikit-learn) - Fast and reliable
📊 Using dense array for SVM training: (820, 13)
INFO:SVM_Training:🔧 Data preparation: dense_array
INFO:SVM_Training:✅ Training completed on CPU in 0.0010s
INFO:SVM_Training:🎯 Total support vectors: 0
INFO:SVM_Training:🔮 Prediction on 102 samples using CPU in 0.0010s
[I 2025-10-01 09:56:44,561] Trial 5 finished with value: 0.7647058823529411 and parameters: {}. Best is trial 0 with value: 0.7647058823529411.
⚡ Using SGDClassifier (fastest overall)
INFO:SVM_Training:🚀 Starting SVM training at 2025-10-01 09:56:44
INFO:SVM_Training:📊 Data: 820 samples, 13 features, 1 classes
INFO:SVM_Training:⚙️  Parameters: {'C': 1.0, 'kernel': 'rbf', 'gamma': 'scale', 'random_state': 42, 'max_iter': 1000, 'tol': 0.001, 'auto_fast': True}
INFO:SVM_Training:💾 Estimated memory: 0.08 MB
INFO:SVM_Training:💻 Using CPU (scikit-learn) - Fast and reliable
📊 Using dense array for SVM training: (820, 13)
INFO:SVM_Training:🔧 Data preparation: dense_array
INFO:SVM_Training:✅ Training completed on CPU in 0.0010s
INFO:SVM_Training:🎯 Total support vectors: 0
INFO:SVM_Training:🔮 Prediction on 102 samples using CPU in 0.0000s
[I 2025-10-01 09:56:44,564] Trial 6 finished with value: 0.7647058823529411 and parameters: {}. Best is trial 0 with value: 0.7647058823529411.
⚡ Using SGDClassifier (fastest overall)
INFO:SVM_Training:🚀 Starting SVM training at 2025-10-01 09:56:44
INFO:SVM_Training:📊 Data: 820 samples, 13 features, 1 classes
INFO:SVM_Training:⚙️  Parameters: {'C': 1.0, 'kernel': 'rbf', 'gamma': 'scale', 'random_state': 42, 'max_iter': 1000, 'tol': 0.001, 'auto_fast': True}
INFO:SVM_Training:💾 Estimated memory: 0.08 MB
INFO:SVM_Training:💻 Using CPU (scikit-learn) - Fast and reliable
📊 Using dense array for SVM training: (820, 13)
INFO:SVM_Training:🔧 Data preparation: dense_array
INFO:SVM_Training:✅ Training completed on CPU in 0.0020s
INFO:SVM_Training:🎯 Total support vectors: 0
INFO:SVM_Training:🔮 Prediction on 102 samples using CPU in 0.0000s
[I 2025-10-01 09:56:44,566] Trial 7 finished with value: 0.7647058823529411 and parameters: {}. Best is trial 0 with value: 0.7647058823529411.
⚡ Using SGDClassifier (fastest overall)
INFO:SVM_Training:🚀 Starting SVM training at 2025-10-01 09:56:44
INFO:SVM_Training:📊 Data: 820 samples, 13 features, 1 classes
INFO:SVM_Training:⚙️  Parameters: {'C': 1.0, 'kernel': 'rbf', 'gamma': 'scale', 'random_state': 42, 'max_iter': 1000, 'tol': 0.001, 'auto_fast': True}
INFO:SVM_Training:💾 Estimated memory: 0.08 MB
INFO:SVM_Training:💻 Using CPU (scikit-learn) - Fast and reliable
📊 Using dense array for SVM training: (820, 13)
INFO:SVM_Training:🔧 Data preparation: dense_array
INFO:SVM_Training:✅ Training completed on CPU in 0.0010s
INFO:SVM_Training:🎯 Total support vectors: 0
INFO:SVM_Training:🔮 Prediction on 102 samples using CPU in 0.0010s
[I 2025-10-01 09:56:44,570] Trial 8 finished with value: 0.7647058823529411 and parameters: {}. Best is trial 0 with value: 0.7647058823529411.
⚡ Using SGDClassifier (fastest overall)
INFO:SVM_Training:🚀 Starting SVM training at 2025-10-01 09:56:44
INFO:SVM_Training:📊 Data: 820 samples, 13 features, 1 classes
INFO:SVM_Training:⚙️  Parameters: {'C': 1.0, 'kernel': 'rbf', 'gamma': 'scale', 'random_state': 42, 'max_iter': 1000, 'tol': 0.001, 'auto_fast': True}
INFO:SVM_Training:💾 Estimated memory: 0.08 MB
INFO:SVM_Training:💻 Using CPU (scikit-learn) - Fast and reliable
📊 Using dense array for SVM training: (820, 13)
INFO:SVM_Training:🔧 Data preparation: dense_array
INFO:SVM_Training:✅ Training completed on CPU in 0.0010s
INFO:SVM_Training:🎯 Total support vectors: 0
INFO:SVM_Training:🔮 Prediction on 102 samples using CPU in 0.0000s
[I 2025-10-01 09:56:44,572] Trial 9 finished with value: 0.7647058823529411 and parameters: {}. Best is trial 0 with value: 0.7647058823529411.
INFO:optuna_optimizer:Optimization completed for svm
INFO:optuna_optimizer:Best score: 0.7647
INFO:optuna_optimizer:Best params: {}
⚡ Using SGDClassifier (fastest overall)
INFO:SVM_Training:🚀 Starting SVM training at 2025-10-01 09:56:44
INFO:SVM_Training:📊 Data: 820 samples, 13 features, 1 classes
INFO:SVM_Training:⚙️  Parameters: {'C': 1.0, 'kernel': 'rbf', 'gamma': 'scale', 'random_state': 42, 'max_iter': 1000, 'tol': 0.001, 'auto_fast': True}
INFO:SVM_Training:💾 Estimated memory: 0.08 MB
INFO:SVM_Training:💻 Using CPU (scikit-learn) - Fast and reliable
📊 Using dense array for SVM training: (820, 13)
INFO:SVM_Training:🔧 Data preparation: dense_array
INFO:SVM_Training:✅ Training completed on CPU in 0.0010s
INFO:SVM_Training:🎯 Total support vectors: 0
INFO:SVM_Training:🔮 Prediction on 103 samples using CPU in 0.0000s
DEBUG: Starting cache save for svm
DEBUG: Cache directory created: cache\models\svm\numeric_dataset_StandardScaler\c583dba7b20fff6e580535de53acca23a835791cb152106d3bba0f97481633b2
DEBUG: Model artifact saved: cache\models\svm\numeric_dataset_StandardScaler\c583dba7b20fff6e580535de53acca23a835791cb152106d3bba0f97481633b2\model.pkl
DEBUG: Params saved: cache\models\svm\numeric_dataset_StandardScaler\c583dba7b20fff6e580535de53acca23a835791cb152106d3bba0f97481633b2\params.json
DEBUG: Metrics saved: cache\models\svm\numeric_dataset_StandardScaler\c583dba7b20fff6e580535de53acca23a835791cb152106d3bba0f97481633b2\metrics.json
DEBUG: Config saved: cache\models\svm\numeric_dataset_StandardScaler\c583dba7b20fff6e580535de53acca23a835791cb152106d3bba0f97481633b2\config.json
INFO:cache_manager:Cache saved for svm at cache\models\svm\numeric_dataset_StandardScaler\c583dba7b20fff6e580535de53acca23a835791cb152106d3bba0f97481633b2
DEBUG: Garbage collection completed for svm
DEBUG: Garbage collection completed for svm
[I 2025-10-01 09:56:44,857] A new study created in memory with name: knn_optimization
INFO:optuna_optimizer:Created Optuna study: knn_optimization
INFO:optuna_optimizer:Starting optimization for knn...
🖥️ Using FAISS CPU-accelerated KNN for embeddings
✅ FAISS CPU index created with 820 vectors, dimension 13
🚀 Using euclidean metric on CPU (optimized)
[I 2025-10-01 09:56:44,861] Trial 0 finished with value: 0.8921568627450981 and parameters: {}. Best is trial 0 with value: 0.8921568627450981.
🖥️ Using FAISS CPU-accelerated KNN for embeddings
✅ FAISS CPU index created with 820 vectors, dimension 13
🚀 Using euclidean metric on CPU (optimized)
[I 2025-10-01 09:56:44,866] Trial 1 finished with value: 0.8921568627450981 and parameters: {}. Best is trial 0 with value: 0.8921568627450981.
🖥️ Using FAISS CPU-accelerated KNN for embeddings
✅ FAISS CPU index created with 820 vectors, dimension 13
🚀 Using euclidean metric on CPU (optimized)
[I 2025-10-01 09:56:44,869] Trial 2 finished with value: 0.8921568627450981 and parameters: {}. Best is trial 0 with value: 0.8921568627450981.
🖥️ Using FAISS CPU-accelerated KNN for embeddings
✅ FAISS CPU index created with 820 vectors, dimension 13
🚀 Using euclidean metric on CPU (optimized)
[I 2025-10-01 09:56:44,872] Trial 3 finished with value: 0.8921568627450981 and parameters: {}. Best is trial 0 with value: 0.8921568627450981.
🖥️ Using FAISS CPU-accelerated KNN for embeddings
✅ FAISS CPU index created with 820 vectors, dimension 13
🚀 Using euclidean metric on CPU (optimized)
[I 2025-10-01 09:56:44,876] Trial 4 finished with value: 0.8921568627450981 and parameters: {}. Best is trial 0 with value: 0.8921568627450981.
🖥️ Using FAISS CPU-accelerated KNN for embeddings
✅ FAISS CPU index created with 820 vectors, dimension 13
🚀 Using euclidean metric on CPU (optimized)
[I 2025-10-01 09:56:44,879] Trial 5 finished with value: 0.8921568627450981 and parameters: {}. Best is trial 0 with value: 0.8921568627450981.
🖥️ Using FAISS CPU-accelerated KNN for embeddings
✅ FAISS CPU index created with 820 vectors, dimension 13
🚀 Using euclidean metric on CPU (optimized)
[I 2025-10-01 09:56:44,882] Trial 6 finished with value: 0.8921568627450981 and parameters: {}. Best is trial 0 with value: 0.8921568627450981.
🖥️ Using FAISS CPU-accelerated KNN for embeddings
✅ FAISS CPU index created with 820 vectors, dimension 13
🚀 Using euclidean metric on CPU (optimized)
[I 2025-10-01 09:56:44,886] Trial 7 finished with value: 0.8921568627450981 and parameters: {}. Best is trial 0 with value: 0.8921568627450981.
🖥️ Using FAISS CPU-accelerated KNN for embeddings
✅ FAISS CPU index created with 820 vectors, dimension 13
🚀 Using euclidean metric on CPU (optimized)
[I 2025-10-01 09:56:44,888] Trial 8 finished with value: 0.8921568627450981 and parameters: {}. Best is trial 0 with value: 0.8921568627450981.
🖥️ Using FAISS CPU-accelerated KNN for embeddings
✅ FAISS CPU index created with 820 vectors, dimension 13
🚀 Using euclidean metric on CPU (optimized)
[I 2025-10-01 09:56:44,892] Trial 9 finished with value: 0.8921568627450981 and parameters: {}. Best is trial 0 with value: 0.8921568627450981.
INFO:optuna_optimizer:Optimization completed for knn
INFO:optuna_optimizer:Best score: 0.8922
INFO:optuna_optimizer:Best params: {}
🖥️ Using FAISS CPU-accelerated KNN for embeddings
✅ FAISS CPU index created with 820 vectors, dimension 13
🚀 Using euclidean metric on CPU (optimized)
DEBUG: Starting cache save for knn
DEBUG: Cache directory created: cache\models\knn\numeric_dataset_StandardScaler\ef090393cb101054454ff482587c4a18dcf33c1514424c71e2add78b1657a68f
DEBUG: Model artifact saved: cache\models\knn\numeric_dataset_StandardScaler\ef090393cb101054454ff482587c4a18dcf33c1514424c71e2add78b1657a68f\model.pkl
DEBUG: Params saved: cache\models\knn\numeric_dataset_StandardScaler\ef090393cb101054454ff482587c4a18dcf33c1514424c71e2add78b1657a68f\params.json
DEBUG: Metrics saved: cache\models\knn\numeric_dataset_StandardScaler\ef090393cb101054454ff482587c4a18dcf33c1514424c71e2add78b1657a68f\metrics.json
DEBUG: Config saved: cache\models\knn\numeric_dataset_StandardScaler\ef090393cb101054454ff482587c4a18dcf33c1514424c71e2add78b1657a68f\config.json
INFO:cache_manager:Cache saved for knn at cache\models\knn\numeric_dataset_StandardScaler\ef090393cb101054454ff482587c4a18dcf33c1514424c71e2add78b1657a68f
DEBUG: Garbage collection completed for knn
DEBUG: Garbage collection completed for knn
[I 2025-10-01 09:56:45,176] A new study created in memory with name: naive_bayes_optimization
INFO:optuna_optimizer:Created Optuna study: naive_bayes_optimization
INFO:optuna_optimizer:Starting optimization for naive_bayes...
📊 Using GaussianNB for dense features
🔄 CPU multithreading: Using all available cores
[I 2025-10-01 09:56:45,178] Trial 0 finished with value: 0.8333333333333334 and parameters: {}. Best is trial 0 with value: 0.8333333333333334.
📊 Using GaussianNB for dense features
🔄 CPU multithreading: Using all available cores
[I 2025-10-01 09:56:45,180] Trial 1 finished with value: 0.8333333333333334 and parameters: {}. Best is trial 0 with value: 0.8333333333333334.
📊 Using GaussianNB for dense features
🔄 CPU multithreading: Using all available cores
[I 2025-10-01 09:56:45,182] Trial 2 finished with value: 0.8333333333333334 and parameters: {}. Best is trial 0 with value: 0.8333333333333334.
📊 Using GaussianNB for dense features
🔄 CPU multithreading: Using all available cores
[I 2025-10-01 09:56:45,183] Trial 3 finished with value: 0.8333333333333334 and parameters: {}. Best is trial 0 with value: 0.8333333333333334.
📊 Using GaussianNB for dense features
🔄 CPU multithreading: Using all available cores
[I 2025-10-01 09:56:45,184] Trial 4 finished with value: 0.8333333333333334 and parameters: {}. Best is trial 0 with value: 0.8333333333333334.
📊 Using GaussianNB for dense features
🔄 CPU multithreading: Using all available cores
[I 2025-10-01 09:56:45,186] Trial 5 finished with value: 0.8333333333333334 and parameters: {}. Best is trial 0 with value: 0.8333333333333334.
📊 Using GaussianNB for dense features
🔄 CPU multithreading: Using all available cores
[I 2025-10-01 09:56:45,186] Trial 6 finished with value: 0.8333333333333334 and parameters: {}. Best is trial 0 with value: 0.8333333333333334.
📊 Using GaussianNB for dense features
🔄 CPU multithreading: Using all available cores
[I 2025-10-01 09:56:45,187] Trial 7 finished with value: 0.8333333333333334 and parameters: {}. Best is trial 0 with value: 0.8333333333333334.
📊 Using GaussianNB for dense features
🔄 CPU multithreading: Using all available cores
[I 2025-10-01 09:56:45,188] Trial 8 finished with value: 0.8333333333333334 and parameters: {}. Best is trial 0 with value: 0.8333333333333334.
📊 Using GaussianNB for dense features
🔄 CPU multithreading: Using all available cores
[I 2025-10-01 09:56:45,189] Trial 9 finished with value: 0.8333333333333334 and parameters: {}. Best is trial 0 with value: 0.8333333333333334.
INFO:optuna_optimizer:Optimization completed for naive_bayes
INFO:optuna_optimizer:Best score: 0.8333
INFO:optuna_optimizer:Best params: {}
📊 Using GaussianNB for dense features
🔄 CPU multithreading: Using all available cores
DEBUG: Starting cache save for naive_bayes
DEBUG: Cache directory created: cache\models\naive_bayes\numeric_dataset_StandardScaler\ec515b709a2bbd975d54ac6ce9ed074cc6e6a54268af8258314572dc6cb4f2af
DEBUG: Model artifact saved: cache\models\naive_bayes\numeric_dataset_StandardScaler\ec515b709a2bbd975d54ac6ce9ed074cc6e6a54268af8258314572dc6cb4f2af\model.pkl
DEBUG: Params saved: cache\models\naive_bayes\numeric_dataset_StandardScaler\ec515b709a2bbd975d54ac6ce9ed074cc6e6a54268af8258314572dc6cb4f2af\params.json
DEBUG: Metrics saved: cache\models\naive_bayes\numeric_dataset_StandardScaler\ec515b709a2bbd975d54ac6ce9ed074cc6e6a54268af8258314572dc6cb4f2af\metrics.json
DEBUG: Config saved: cache\models\naive_bayes\numeric_dataset_StandardScaler\ec515b709a2bbd975d54ac6ce9ed074cc6e6a54268af8258314572dc6cb4f2af\config.json
INFO:cache_manager:Cache saved for naive_bayes at cache\models\naive_bayes\numeric_dataset_StandardScaler\ec515b709a2bbd975d54ac6ce9ed074cc6e6a54268af8258314572dc6cb4f2af
DEBUG: Garbage collection completed for naive_bayes
DEBUG: Garbage collection completed for naive_bayes
[I 2025-10-01 09:56:45,479] A new study created in memory with name: random_forest_optimization
INFO:optuna_optimizer:Created Optuna study: random_forest_optimization
INFO:optuna_optimizer:Starting optimization for random_forest...
CPU multithreading: Using all 12 available cores
[I 2025-10-01 09:56:45,792] Trial 0 finished with value: 1.0 and parameters: {'n_estimators': 218, 'max_depth': 20, 'max_features': 'sqrt', 'min_samples_split': 4, 'min_samples_leaf': 1}. Best is trial 0 with value: 1.0.
CPU multithreading: Using all 12 available cores
[I 2025-10-01 09:56:46,787] Trial 1 finished with value: 0.9215686274509803 and parameters: {'n_estimators': 440, 'max_depth': 13, 'max_features': None, 'min_samples_split': 17, 'min_samples_leaf': 3}. Best is trial 0 with value: 1.0.
CPU multithreading: Using all 12 available cores
[I 2025-10-01 09:56:46,939] Trial 2 finished with value: 0.9215686274509803 and parameters: {'n_estimators': 132, 'max_depth': 6, 'max_features': 'log2', 'min_samples_split': 7, 'min_samples_leaf': 7}. Best is trial 0 with value: 1.0.
CPU multithreading: Using all 12 available cores
[I 2025-10-01 09:56:47,188] Trial 3 finished with value: 0.9313725490196079 and parameters: {'n_estimators': 112, 'max_depth': 8, 'max_features': None, 'min_samples_split': 5, 'min_samples_leaf': 6}. Best is trial 0 with value: 1.0.
CPU multithreading: Using all 12 available cores
[I 2025-10-01 09:56:47,476] Trial 4 finished with value: 0.8725490196078431 and parameters: {'n_estimators': 317, 'max_depth': 3, 'max_features': 'sqrt', 'min_samples_split': 20, 'min_samples_leaf': 10}. Best is trial 0 with value: 1.0.
CPU multithreading: Using all 12 available cores
[I 2025-10-01 09:56:48,001] Trial 5 finished with value: 0.9803921568627451 and parameters: {'n_estimators': 414, 'max_depth': 8, 'max_features': 'log2', 'min_samples_split': 4, 'min_samples_leaf': 5}. Best is trial 0 with value: 1.0.
CPU multithreading: Using all 12 available cores
[I 2025-10-01 09:56:48,084] Trial 6 finished with value: 0.9509803921568627 and parameters: {'n_estimators': 65, 'max_depth': 19, 'max_features': 'log2', 'min_samples_split': 11, 'min_samples_leaf': 6}. Best is trial 0 with value: 1.0.
CPU multithreading: Using all 12 available cores
[I 2025-10-01 09:56:48,240] Trial 7 finished with value: 0.9019607843137255 and parameters: {'n_estimators': 133, 'max_depth': 20, 'max_features': 'log2', 'min_samples_split': 13, 'min_samples_leaf': 10}. Best is trial 0 with value: 1.0.
CPU multithreading: Using all 12 available cores
[I 2025-10-01 09:56:48,428] Trial 8 finished with value: 0.9215686274509803 and parameters: {'n_estimators': 89, 'max_depth': 6, 'max_features': None, 'min_samples_split': 7, 'min_samples_leaf': 9}. Best is trial 0 with value: 1.0.
CPU multithreading: Using all 12 available cores
[I 2025-10-01 09:56:48,823] Trial 9 finished with value: 0.9117647058823529 and parameters: {'n_estimators': 210, 'max_depth': 8, 'max_features': None, 'min_samples_split': 3, 'min_samples_leaf': 10}. Best is trial 0 with value: 1.0.
INFO:optuna_optimizer:Optimization completed for random_forest
INFO:optuna_optimizer:Best score: 1.0000
INFO:optuna_optimizer:Best params: {'n_estimators': 218, 'max_depth': 20, 'max_features': 'sqrt', 'min_samples_split': 4, 'min_samples_leaf': 1}
CPU multithreading: Using all 12 available cores
DEBUG: Starting cache save for random_forest
DEBUG: Cache directory created: cache\models\random_forest\numeric_dataset_MinMaxScaler\97962d01c39a25785e8930354e36813ccbdc182812c2b6434aae5b1812fd249a
DEBUG: Model artifact saved: cache\models\random_forest\numeric_dataset_MinMaxScaler\97962d01c39a25785e8930354e36813ccbdc182812c2b6434aae5b1812fd249a\model.pkl
DEBUG: Params saved: cache\models\random_forest\numeric_dataset_MinMaxScaler\97962d01c39a25785e8930354e36813ccbdc182812c2b6434aae5b1812fd249a\params.json
DEBUG: Metrics saved: cache\models\random_forest\numeric_dataset_MinMaxScaler\97962d01c39a25785e8930354e36813ccbdc182812c2b6434aae5b1812fd249a\metrics.json
DEBUG: Config saved: cache\models\random_forest\numeric_dataset_MinMaxScaler\97962d01c39a25785e8930354e36813ccbdc182812c2b6434aae5b1812fd249a\config.json
INFO:cache_manager:Cache saved for random_forest at cache\models\random_forest\numeric_dataset_MinMaxScaler\97962d01c39a25785e8930354e36813ccbdc182812c2b6434aae5b1812fd249a
DEBUG: Garbage collection completed for random_forest
DEBUG: Garbage collection completed for random_forest
INFO:gpu_config_manager:GPU mode enabled for xgboost: GPU: NVIDIA GeForce RTX 3060 (1 devices, 12.0GB)
🚀 XGBoost configured for GPU: GPU: NVIDIA GeForce RTX 3060 (1 devices, 12.0GB)
[I 2025-10-01 09:56:49,387] A new study created in memory with name: xgboost_optimization
INFO:optuna_optimizer:Created Optuna study: xgboost_optimization
INFO:optuna_optimizer:Starting optimization for xgboost...
INFO:gpu_config_manager:GPU mode enabled for xgboost: GPU: NVIDIA GeForce RTX 3060 (1 devices, 12.0GB)
🚀 XGBoost configured for GPU: GPU: NVIDIA GeForce RTX 3060 (1 devices, 12.0GB)
[I 2025-10-01 09:56:50,130] Trial 0 finished with value: 1.0 and parameters: {'n_estimators': 218, 'max_depth': 10, 'eta': 0.1205712628744377, 'subsample': 0.8394633936788146, 'colsample_bytree': 0.6624074561769746, 'min_child_weight': 2, 'reg_lambda': 0.0017073967431528124, 'reg_alpha': 2.9154431891537547}. Best is trial 0 with value: 1.0.
INFO:gpu_config_manager:GPU mode enabled for xgboost: GPU: NVIDIA GeForce RTX 3060 (1 devices, 12.0GB)
🚀 XGBoost configured for GPU: GPU: NVIDIA GeForce RTX 3060 (1 devices, 12.0GB)
[I 2025-10-01 09:56:51,129] Trial 1 finished with value: 0.9803921568627451 and parameters: {'n_estimators': 321, 'max_depth': 8, 'eta': 0.010725209743171996, 'subsample': 0.9879639408647978, 'colsample_bytree': 0.9329770563201687, 'min_child_weight': 3, 'reg_lambda': 0.005337032762603957, 'reg_alpha': 0.00541524411940254}. Best is trial 0 with value: 1.0.
INFO:gpu_config_manager:GPU mode enabled for xgboost: GPU: NVIDIA GeForce RTX 3060 (1 devices, 12.0GB)
🚀 XGBoost configured for GPU: GPU: NVIDIA GeForce RTX 3060 (1 devices, 12.0GB)
[I 2025-10-01 09:56:51,611] Trial 2 finished with value: 1.0 and parameters: {'n_estimators': 187, 'max_depth': 7, 'eta': 0.04345454109729477, 'subsample': 0.7164916560792167, 'colsample_bytree': 0.8447411578889518, 'min_child_weight': 2, 'reg_lambda': 0.01474275315991467, 'reg_alpha': 0.029204338471814112}. Best is trial 0 with value: 1.0.
INFO:gpu_config_manager:GPU mode enabled for xgboost: GPU: NVIDIA GeForce RTX 3060 (1 devices, 12.0GB)
🚀 XGBoost configured for GPU: GPU: NVIDIA GeForce RTX 3060 (1 devices, 12.0GB)
