[I 2025-10-01 09:57:24,756] Trial 9 finished with value: 0.5098039215686274 and parameters: {}. Best is trial 0 with value: 0.5098039215686274.
INFO:optuna_optimizer:Optimization completed for svm
INFO:optuna_optimizer:Best score: 0.5098
INFO:optuna_optimizer:Best params: {}
⚡ Using SGDClassifier (fastest overall)
INFO:SVM_Training:🚀 Starting SVM training at 2025-10-01 09:57:24
INFO:SVM_Training:📊 Data: 820 samples, 13 features, 1 classes
INFO:SVM_Training:⚙️  Parameters: {'C': 1.0, 'kernel': 'rbf', 'gamma': 'scale', 'random_state': 42, 'max_iter': 1000, 'tol': 0.001, 'auto_fast': True}
INFO:SVM_Training:💾 Estimated memory: 0.08 MB
INFO:SVM_Training:💻 Using CPU (scikit-learn) - Fast and reliable
📊 Using dense array for SVM training: (820, 13)
INFO:SVM_Training:🔧 Data preparation: dense_array
INFO:SVM_Training:✅ Training completed on CPU in 0.0010s
INFO:SVM_Training:🎯 Total support vectors: 0
INFO:SVM_Training:🔮 Prediction on 103 samples using CPU in 0.0000s
DEBUG: Starting cache save for svm
DEBUG: Cache directory created: cache\models\svm\numeric_dataset_MinMaxScaler\315fc9e1a10c4af2b2642ff1606b072d7dcaa2ed33ef8eba7febea01fdbba4c5
DEBUG: Model artifact saved: cache\models\svm\numeric_dataset_MinMaxScaler\315fc9e1a10c4af2b2642ff1606b072d7dcaa2ed33ef8eba7febea01fdbba4c5\model.pkl
DEBUG: Params saved: cache\models\svm\numeric_dataset_MinMaxScaler\315fc9e1a10c4af2b2642ff1606b072d7dcaa2ed33ef8eba7febea01fdbba4c5\params.json
DEBUG: Metrics saved: cache\models\svm\numeric_dataset_MinMaxScaler\315fc9e1a10c4af2b2642ff1606b072d7dcaa2ed33ef8eba7febea01fdbba4c5\metrics.json
DEBUG: Config saved: cache\models\svm\numeric_dataset_MinMaxScaler\315fc9e1a10c4af2b2642ff1606b072d7dcaa2ed33ef8eba7febea01fdbba4c5\config.json
INFO:cache_manager:Cache saved for svm at cache\models\svm\numeric_dataset_MinMaxScaler\315fc9e1a10c4af2b2642ff1606b072d7dcaa2ed33ef8eba7febea01fdbba4c5
DEBUG: Garbage collection completed for svm
DEBUG: Garbage collection completed for svm
[I 2025-10-01 09:57:25,042] A new study created in memory with name: knn_optimization
INFO:optuna_optimizer:Created Optuna study: knn_optimization
INFO:optuna_optimizer:Starting optimization for knn...
🖥️ Using FAISS CPU-accelerated KNN for embeddings
✅ FAISS CPU index created with 820 vectors, dimension 13
🚀 Using euclidean metric on CPU (optimized)
[I 2025-10-01 09:57:25,047] Trial 0 finished with value: 0.8823529411764706 and parameters: {}. Best is trial 0 with value: 0.8823529411764706.
🖥️ Using FAISS CPU-accelerated KNN for embeddings
✅ FAISS CPU index created with 820 vectors, dimension 13
🚀 Using euclidean metric on CPU (optimized)
[I 2025-10-01 09:57:25,050] Trial 1 finished with value: 0.8823529411764706 and parameters: {}. Best is trial 0 with value: 0.8823529411764706.
🖥️ Using FAISS CPU-accelerated KNN for embeddings
✅ FAISS CPU index created with 820 vectors, dimension 13
🚀 Using euclidean metric on CPU (optimized)
[I 2025-10-01 09:57:25,053] Trial 2 finished with value: 0.8823529411764706 and parameters: {}. Best is trial 0 with value: 0.8823529411764706.
🖥️ Using FAISS CPU-accelerated KNN for embeddings
✅ FAISS CPU index created with 820 vectors, dimension 13
🚀 Using euclidean metric on CPU (optimized)
[I 2025-10-01 09:57:25,057] Trial 3 finished with value: 0.8823529411764706 and parameters: {}. Best is trial 0 with value: 0.8823529411764706.
🖥️ Using FAISS CPU-accelerated KNN for embeddings
✅ FAISS CPU index created with 820 vectors, dimension 13
🚀 Using euclidean metric on CPU (optimized)
[I 2025-10-01 09:57:25,061] Trial 4 finished with value: 0.8823529411764706 and parameters: {}. Best is trial 0 with value: 0.8823529411764706.
🖥️ Using FAISS CPU-accelerated KNN for embeddings
✅ FAISS CPU index created with 820 vectors, dimension 13
🚀 Using euclidean metric on CPU (optimized)
[I 2025-10-01 09:57:25,064] Trial 5 finished with value: 0.8823529411764706 and parameters: {}. Best is trial 0 with value: 0.8823529411764706.
🖥️ Using FAISS CPU-accelerated KNN for embeddings
✅ FAISS CPU index created with 820 vectors, dimension 13
🚀 Using euclidean metric on CPU (optimized)
[I 2025-10-01 09:57:25,067] Trial 6 finished with value: 0.8823529411764706 and parameters: {}. Best is trial 0 with value: 0.8823529411764706.
🖥️ Using FAISS CPU-accelerated KNN for embeddings
✅ FAISS CPU index created with 820 vectors, dimension 13
🚀 Using euclidean metric on CPU (optimized)
[I 2025-10-01 09:57:25,069] Trial 7 finished with value: 0.8823529411764706 and parameters: {}. Best is trial 0 with value: 0.8823529411764706.
🖥️ Using FAISS CPU-accelerated KNN for embeddings
✅ FAISS CPU index created with 820 vectors, dimension 13
🚀 Using euclidean metric on CPU (optimized)
[I 2025-10-01 09:57:25,072] Trial 8 finished with value: 0.8823529411764706 and parameters: {}. Best is trial 0 with value: 0.8823529411764706.
🖥️ Using FAISS CPU-accelerated KNN for embeddings
✅ FAISS CPU index created with 820 vectors, dimension 13
🚀 Using euclidean metric on CPU (optimized)
[I 2025-10-01 09:57:25,075] Trial 9 finished with value: 0.8823529411764706 and parameters: {}. Best is trial 0 with value: 0.8823529411764706.
INFO:optuna_optimizer:Optimization completed for knn
INFO:optuna_optimizer:Best score: 0.8824
INFO:optuna_optimizer:Best params: {}
🖥️ Using FAISS CPU-accelerated KNN for embeddings
✅ FAISS CPU index created with 820 vectors, dimension 13
🚀 Using euclidean metric on CPU (optimized)
DEBUG: Starting cache save for knn
DEBUG: Cache directory created: cache\models\knn\numeric_dataset_MinMaxScaler\13365b4345511435657f8dedb4926b582c76be86c5711720ab91421781fcc97f
DEBUG: Model artifact saved: cache\models\knn\numeric_dataset_MinMaxScaler\13365b4345511435657f8dedb4926b582c76be86c5711720ab91421781fcc97f\model.pkl
DEBUG: Params saved: cache\models\knn\numeric_dataset_MinMaxScaler\13365b4345511435657f8dedb4926b582c76be86c5711720ab91421781fcc97f\params.json
DEBUG: Metrics saved: cache\models\knn\numeric_dataset_MinMaxScaler\13365b4345511435657f8dedb4926b582c76be86c5711720ab91421781fcc97f\metrics.json
DEBUG: Config saved: cache\models\knn\numeric_dataset_MinMaxScaler\13365b4345511435657f8dedb4926b582c76be86c5711720ab91421781fcc97f\config.json
INFO:cache_manager:Cache saved for knn at cache\models\knn\numeric_dataset_MinMaxScaler\13365b4345511435657f8dedb4926b582c76be86c5711720ab91421781fcc97f
DEBUG: Garbage collection completed for knn
DEBUG: Garbage collection completed for knn
[I 2025-10-01 09:57:25,371] A new study created in memory with name: naive_bayes_optimization
INFO:optuna_optimizer:Created Optuna study: naive_bayes_optimization
INFO:optuna_optimizer:Starting optimization for naive_bayes...
📊 Using GaussianNB for dense features
🔄 CPU multithreading: Using all available cores
[I 2025-10-01 09:57:25,373] Trial 0 finished with value: 0.8333333333333334 and parameters: {}. Best is trial 0 with value: 0.8333333333333334.
📊 Using GaussianNB for dense features
🔄 CPU multithreading: Using all available cores
[I 2025-10-01 09:57:25,374] Trial 1 finished with value: 0.8333333333333334 and parameters: {}. Best is trial 0 with value: 0.8333333333333334.
📊 Using GaussianNB for dense features
🔄 CPU multithreading: Using all available cores
[I 2025-10-01 09:57:25,376] Trial 2 finished with value: 0.8333333333333334 and parameters: {}. Best is trial 0 with value: 0.8333333333333334.
📊 Using GaussianNB for dense features
🔄 CPU multithreading: Using all available cores
[I 2025-10-01 09:57:25,377] Trial 3 finished with value: 0.8333333333333334 and parameters: {}. Best is trial 0 with value: 0.8333333333333334.
📊 Using GaussianNB for dense features
🔄 CPU multithreading: Using all available cores
[I 2025-10-01 09:57:25,378] Trial 4 finished with value: 0.8333333333333334 and parameters: {}. Best is trial 0 with value: 0.8333333333333334.
📊 Using GaussianNB for dense features
🔄 CPU multithreading: Using all available cores
[I 2025-10-01 09:57:25,379] Trial 5 finished with value: 0.8333333333333334 and parameters: {}. Best is trial 0 with value: 0.8333333333333334.
📊 Using GaussianNB for dense features
🔄 CPU multithreading: Using all available cores
[I 2025-10-01 09:57:25,380] Trial 6 finished with value: 0.8333333333333334 and parameters: {}. Best is trial 0 with value: 0.8333333333333334.
📊 Using GaussianNB for dense features
🔄 CPU multithreading: Using all available cores
[I 2025-10-01 09:57:25,381] Trial 7 finished with value: 0.8333333333333334 and parameters: {}. Best is trial 0 with value: 0.8333333333333334.
📊 Using GaussianNB for dense features
🔄 CPU multithreading: Using all available cores
[I 2025-10-01 09:57:25,382] Trial 8 finished with value: 0.8333333333333334 and parameters: {}. Best is trial 0 with value: 0.8333333333333334.
📊 Using GaussianNB for dense features
🔄 CPU multithreading: Using all available cores
[I 2025-10-01 09:57:25,384] Trial 9 finished with value: 0.8333333333333334 and parameters: {}. Best is trial 0 with value: 0.8333333333333334.
INFO:optuna_optimizer:Optimization completed for naive_bayes
INFO:optuna_optimizer:Best score: 0.8333
INFO:optuna_optimizer:Best params: {}
📊 Using GaussianNB for dense features
🔄 CPU multithreading: Using all available cores
DEBUG: Starting cache save for naive_bayes
DEBUG: Cache directory created: cache\models\naive_bayes\numeric_dataset_MinMaxScaler\9724ae1744059f3cc983bfa4b372df0cb7912420c30e027a6c60f612ac710cc2
DEBUG: Model artifact saved: cache\models\naive_bayes\numeric_dataset_MinMaxScaler\9724ae1744059f3cc983bfa4b372df0cb7912420c30e027a6c60f612ac710cc2\model.pkl
DEBUG: Params saved: cache\models\naive_bayes\numeric_dataset_MinMaxScaler\9724ae1744059f3cc983bfa4b372df0cb7912420c30e027a6c60f612ac710cc2\params.json
DEBUG: Metrics saved: cache\models\naive_bayes\numeric_dataset_MinMaxScaler\9724ae1744059f3cc983bfa4b372df0cb7912420c30e027a6c60f612ac710cc2\metrics.json
DEBUG: Config saved: cache\models\naive_bayes\numeric_dataset_MinMaxScaler\9724ae1744059f3cc983bfa4b372df0cb7912420c30e027a6c60f612ac710cc2\config.json
INFO:cache_manager:Cache saved for naive_bayes at cache\models\naive_bayes\numeric_dataset_MinMaxScaler\9724ae1744059f3cc983bfa4b372df0cb7912420c30e027a6c60f612ac710cc2
DEBUG: Garbage collection completed for naive_bayes
DEBUG: Garbage collection completed for naive_bayes
[I 2025-10-01 09:57:25,666] A new study created in memory with name: random_forest_optimization
INFO:optuna_optimizer:Created Optuna study: random_forest_optimization
INFO:optuna_optimizer:Starting optimization for random_forest...
CPU multithreading: Using all 12 available cores
[I 2025-10-01 09:57:25,948] Trial 0 finished with value: 1.0 and parameters: {'n_estimators': 218, 'max_depth': 20, 'max_features': 'sqrt', 'min_samples_split': 4, 'min_samples_leaf': 1}. Best is trial 0 with value: 1.0.
CPU multithreading: Using all 12 available cores
[I 2025-10-01 09:57:26,975] Trial 1 finished with value: 0.9215686274509803 and parameters: {'n_estimators': 440, 'max_depth': 13, 'max_features': None, 'min_samples_split': 17, 'min_samples_leaf': 3}. Best is trial 0 with value: 1.0.
CPU multithreading: Using all 12 available cores
[I 2025-10-01 09:57:27,138] Trial 2 finished with value: 0.9215686274509803 and parameters: {'n_estimators': 132, 'max_depth': 6, 'max_features': 'log2', 'min_samples_split': 7, 'min_samples_leaf': 7}. Best is trial 0 with value: 1.0.
CPU multithreading: Using all 12 available cores
[I 2025-10-01 09:57:27,445] Trial 3 finished with value: 0.9313725490196079 and parameters: {'n_estimators': 112, 'max_depth': 8, 'max_features': None, 'min_samples_split': 5, 'min_samples_leaf': 6}. Best is trial 0 with value: 1.0.
CPU multithreading: Using all 12 available cores
[I 2025-10-01 09:57:27,783] Trial 4 finished with value: 0.8725490196078431 and parameters: {'n_estimators': 317, 'max_depth': 3, 'max_features': 'sqrt', 'min_samples_split': 20, 'min_samples_leaf': 10}. Best is trial 0 with value: 1.0.
CPU multithreading: Using all 12 available cores
[I 2025-10-01 09:57:28,266] Trial 5 finished with value: 0.9705882352941176 and parameters: {'n_estimators': 414, 'max_depth': 8, 'max_features': 'log2', 'min_samples_split': 4, 'min_samples_leaf': 5}. Best is trial 0 with value: 1.0.
CPU multithreading: Using all 12 available cores
[I 2025-10-01 09:57:28,351] Trial 6 finished with value: 0.9509803921568627 and parameters: {'n_estimators': 65, 'max_depth': 19, 'max_features': 'log2', 'min_samples_split': 11, 'min_samples_leaf': 6}. Best is trial 0 with value: 1.0.
CPU multithreading: Using all 12 available cores
[I 2025-10-01 09:57:28,514] Trial 7 finished with value: 0.9019607843137255 and parameters: {'n_estimators': 133, 'max_depth': 20, 'max_features': 'log2', 'min_samples_split': 13, 'min_samples_leaf': 10}. Best is trial 0 with value: 1.0.
CPU multithreading: Using all 12 available cores
[I 2025-10-01 09:57:28,682] Trial 8 finished with value: 0.9215686274509803 and parameters: {'n_estimators': 89, 'max_depth': 6, 'max_features': None, 'min_samples_split': 7, 'min_samples_leaf': 9}. Best is trial 0 with value: 1.0.
CPU multithreading: Using all 12 available cores
[I 2025-10-01 09:57:29,065] Trial 9 finished with value: 0.9117647058823529 and parameters: {'n_estimators': 210, 'max_depth': 8, 'max_features': None, 'min_samples_split': 3, 'min_samples_leaf': 10}. Best is trial 0 with value: 1.0.
INFO:optuna_optimizer:Optimization completed for random_forest
INFO:optuna_optimizer:Best score: 1.0000
INFO:optuna_optimizer:Best params: {'n_estimators': 218, 'max_depth': 20, 'max_features': 'sqrt', 'min_samples_split': 4, 'min_samples_leaf': 1}
CPU multithreading: Using all 12 available cores
DEBUG: Starting cache save for random_forest
DEBUG: Cache directory created: cache\models\random_forest\numeric_dataset_RobustScaler\58f1c5753095665e2c68a783ecbf3b345400d05661f6f8af45b7f9bfaa524927
DEBUG: Model artifact saved: cache\models\random_forest\numeric_dataset_RobustScaler\58f1c5753095665e2c68a783ecbf3b345400d05661f6f8af45b7f9bfaa524927\model.pkl
DEBUG: Params saved: cache\models\random_forest\numeric_dataset_RobustScaler\58f1c5753095665e2c68a783ecbf3b345400d05661f6f8af45b7f9bfaa524927\params.json
DEBUG: Metrics saved: cache\models\random_forest\numeric_dataset_RobustScaler\58f1c5753095665e2c68a783ecbf3b345400d05661f6f8af45b7f9bfaa524927\metrics.json
DEBUG: Config saved: cache\models\random_forest\numeric_dataset_RobustScaler\58f1c5753095665e2c68a783ecbf3b345400d05661f6f8af45b7f9bfaa524927\config.json
INFO:cache_manager:Cache saved for random_forest at cache\models\random_forest\numeric_dataset_RobustScaler\58f1c5753095665e2c68a783ecbf3b345400d05661f6f8af45b7f9bfaa524927
DEBUG: Garbage collection completed for random_forest
DEBUG: Garbage collection completed for random_forest
INFO:gpu_config_manager:GPU mode enabled for xgboost: GPU: NVIDIA GeForce RTX 3060 (1 devices, 12.0GB)
🚀 XGBoost configured for GPU: GPU: NVIDIA GeForce RTX 3060 (1 devices, 12.0GB)
[I 2025-10-01 09:57:29,626] A new study created in memory with name: xgboost_optimization
INFO:optuna_optimizer:Created Optuna study: xgboost_optimization
INFO:optuna_optimizer:Starting optimization for xgboost...
INFO:gpu_config_manager:GPU mode enabled for xgboost: GPU: NVIDIA GeForce RTX 3060 (1 devices, 12.0GB)
🚀 XGBoost configured for GPU: GPU: NVIDIA GeForce RTX 3060 (1 devices, 12.0GB)
[I 2025-10-01 09:57:30,435] Trial 0 finished with value: 1.0 and parameters: {'n_estimators': 218, 'max_depth': 10, 'eta': 0.1205712628744377, 'subsample': 0.8394633936788146, 'colsample_bytree': 0.6624074561769746, 'min_child_weight': 2, 'reg_lambda': 0.0017073967431528124, 'reg_alpha': 2.9154431891537547}. Best is trial 0 with value: 1.0.
INFO:gpu_config_manager:GPU mode enabled for xgboost: GPU: NVIDIA GeForce RTX 3060 (1 devices, 12.0GB)
🚀 XGBoost configured for GPU: GPU: NVIDIA GeForce RTX 3060 (1 devices, 12.0GB)
[I 2025-10-01 09:57:31,659] Trial 1 finished with value: 0.9803921568627451 and parameters: {'n_estimators': 321, 'max_depth': 8, 'eta': 0.010725209743171996, 'subsample': 0.9879639408647978, 'colsample_bytree': 0.9329770563201687, 'min_child_weight': 3, 'reg_lambda': 0.005337032762603957, 'reg_alpha': 0.00541524411940254}. Best is trial 0 with value: 1.0.
INFO:gpu_config_manager:GPU mode enabled for xgboost: GPU: NVIDIA GeForce RTX 3060 (1 devices, 12.0GB)
🚀 XGBoost configured for GPU: GPU: NVIDIA GeForce RTX 3060 (1 devices, 12.0GB)
[I 2025-10-01 09:57:32,137] Trial 2 finished with value: 1.0 and parameters: {'n_estimators': 187, 'max_depth': 7, 'eta': 0.04345454109729477, 'subsample': 0.7164916560792167, 'colsample_bytree': 0.8447411578889518, 'min_child_weight': 2, 'reg_lambda': 0.01474275315991467, 'reg_alpha': 0.029204338471814112}. Best is trial 0 with value: 1.0.
INFO:gpu_config_manager:GPU mode enabled for xgboost: GPU: NVIDIA GeForce RTX 3060 (1 devices, 12.0GB)
🚀 XGBoost configured for GPU: GPU: NVIDIA GeForce RTX 3060 (1 devices, 12.0GB)
[I 2025-10-01 09:57:32,929] Trial 3 finished with value: 1.0 and parameters: {'n_estimators': 255, 'max_depth': 9, 'eta': 0.019721610970574007, 'subsample': 0.8056937753654446, 'colsample_bytree': 0.836965827544817, 'min_child_weight': 1, 'reg_lambda': 0.26926469100861794, 'reg_alpha': 0.004809461967501573}. Best is trial 0 with value: 1.0.
INFO:gpu_config_manager:GPU mode enabled for xgboost: GPU: NVIDIA GeForce RTX 3060 (1 devices, 12.0GB)
🚀 XGBoost configured for GPU: GPU: NVIDIA GeForce RTX 3060 (1 devices, 12.0GB)
[I 2025-10-01 09:57:33,127] Trial 4 finished with value: 1.0 and parameters: {'n_estimators': 79, 'max_depth': 10, 'eta': 0.26690431824362526, 'subsample': 0.9233589392465844, 'colsample_bytree': 0.7218455076693483, 'min_child_weight': 1, 'reg_lambda': 0.5456725485601477, 'reg_alpha': 0.057624872164786026}. Best is trial 0 with value: 1.0.
INFO:gpu_config_manager:GPU mode enabled for xgboost: GPU: NVIDIA GeForce RTX 3060 (1 devices, 12.0GB)
🚀 XGBoost configured for GPU: GPU: NVIDIA GeForce RTX 3060 (1 devices, 12.0GB)
[I 2025-10-01 09:57:33,376] Trial 5 finished with value: 0.9117647058823529 and parameters: {'n_estimators': 105, 'max_depth': 6, 'eta': 0.011240768803005551, 'subsample': 0.9637281608315128, 'colsample_bytree': 0.7035119926400067, 'min_child_weight': 7, 'reg_lambda': 0.017654048052495083, 'reg_alpha': 0.12030178871154672}. Best is trial 0 with value: 1.0.
INFO:gpu_config_manager:GPU mode enabled for xgboost: GPU: NVIDIA GeForce RTX 3060 (1 devices, 12.0GB)
🚀 XGBoost configured for GPU: GPU: NVIDIA GeForce RTX 3060 (1 devices, 12.0GB)
[I 2025-10-01 09:57:33,690] Trial 6 finished with value: 0.9117647058823529 and parameters: {'n_estimators': 296, 'max_depth': 4, 'eta': 0.27051668818999286, 'subsample': 0.9100531293444458, 'colsample_bytree': 0.9757995766256756, 'min_child_weight': 9, 'reg_lambda': 0.24637685958997463, 'reg_alpha': 4.869640941520899}. Best is trial 0 with value: 1.0.
INFO:gpu_config_manager:GPU mode enabled for xgboost: GPU: NVIDIA GeForce RTX 3060 (1 devices, 12.0GB)
🚀 XGBoost configured for GPU: GPU: NVIDIA GeForce RTX 3060 (1 devices, 12.0GB)
[I 2025-10-01 09:57:33,838] Trial 7 finished with value: 0.8921568627450981 and parameters: {'n_estimators': 89, 'max_depth': 4, 'eta': 0.011662890273931383, 'subsample': 0.7301321323053057, 'colsample_bytree': 0.7554709158757928, 'min_child_weight': 3, 'reg_lambda': 2.0651425578959257, 'reg_alpha': 0.026730883107816707}. Best is trial 0 with value: 1.0.
INFO:gpu_config_manager:GPU mode enabled for xgboost: GPU: NVIDIA GeForce RTX 3060 (1 devices, 12.0GB)
🚀 XGBoost configured for GPU: GPU: NVIDIA GeForce RTX 3060 (1 devices, 12.0GB)
[I 2025-10-01 09:57:34,231] Trial 8 finished with value: 0.8921568627450981 and parameters: {'n_estimators': 176, 'max_depth': 7, 'eta': 0.016149614799999188, 'subsample': 0.9208787923016158, 'colsample_bytree': 0.6298202574719083, 'min_child_weight': 10, 'reg_lambda': 1.2273800987852967, 'reg_alpha': 0.0062353771356731605}. Best is trial 0 with value: 1.0.
INFO:gpu_config_manager:GPU mode enabled for xgboost: GPU: NVIDIA GeForce RTX 3060 (1 devices, 12.0GB)
🚀 XGBoost configured for GPU: GPU: NVIDIA GeForce RTX 3060 (1 devices, 12.0GB)
