[I 2025-10-01 09:57:19,306] Trial 9 finished with value: 0.8725490196078431 and parameters: {'n_estimators': 98, 'learning_rate': 0.04678719265016203}. Best is trial 0 with value: 0.9117647058823529.
INFO:optuna_optimizer:Optimization completed for adaboost
INFO:optuna_optimizer:Best score: 0.9118
INFO:optuna_optimizer:Best params: {'n_estimators': 87, 'learning_rate': 1.5403596595019242}
DEBUG: Starting cache save for adaboost
DEBUG: Cache directory created: cache\models\adaboost\numeric_dataset_MinMaxScaler\bcdc0d12e39efb2f88fab82409c90175e93956988991359032d4c0d6729636e2
DEBUG: Model artifact saved: cache\models\adaboost\numeric_dataset_MinMaxScaler\bcdc0d12e39efb2f88fab82409c90175e93956988991359032d4c0d6729636e2\model.pkl
DEBUG: Params saved: cache\models\adaboost\numeric_dataset_MinMaxScaler\bcdc0d12e39efb2f88fab82409c90175e93956988991359032d4c0d6729636e2\params.json
DEBUG: Metrics saved: cache\models\adaboost\numeric_dataset_MinMaxScaler\bcdc0d12e39efb2f88fab82409c90175e93956988991359032d4c0d6729636e2\metrics.json
DEBUG: Config saved: cache\models\adaboost\numeric_dataset_MinMaxScaler\bcdc0d12e39efb2f88fab82409c90175e93956988991359032d4c0d6729636e2\config.json
INFO:cache_manager:Cache saved for adaboost at cache\models\adaboost\numeric_dataset_MinMaxScaler\bcdc0d12e39efb2f88fab82409c90175e93956988991359032d4c0d6729636e2
DEBUG: Garbage collection completed for adaboost
DEBUG: Garbage collection completed for adaboost
[I 2025-10-01 09:57:19,710] A new study created in memory with name: gradient_boosting_optimization
INFO:optuna_optimizer:Created Optuna study: gradient_boosting_optimization
INFO:optuna_optimizer:Starting optimization for gradient_boosting...
[I 2025-10-01 09:57:20,115] Trial 0 finished with value: 1.0 and parameters: {'n_estimators': 144, 'learning_rate': 0.2536999076681772, 'max_depth': 8, 'subsample': 0.8394633936788146}. Best is trial 0 with value: 1.0.
[I 2025-10-01 09:57:20,237] Trial 1 finished with value: 0.8431372549019608 and parameters: {'n_estimators': 89, 'learning_rate': 0.01699897838270077, 'max_depth': 3, 'subsample': 0.9464704583099741}. Best is trial 0 with value: 1.0.
[I 2025-10-01 09:57:20,492] Trial 2 finished with value: 1.0 and parameters: {'n_estimators': 200, 'learning_rate': 0.11114989443094977, 'max_depth': 3, 'subsample': 0.9879639408647978}. Best is trial 0 with value: 1.0.
[I 2025-10-01 09:57:20,924] Trial 3 finished with value: 1.0 and parameters: {'n_estimators': 258, 'learning_rate': 0.020589728197687916, 'max_depth': 4, 'subsample': 0.6733618039413735}. Best is trial 0 with value: 1.0.
[I 2025-10-01 09:57:21,272] Trial 4 finished with value: 1.0 and parameters: {'n_estimators': 126, 'learning_rate': 0.05958389350068958, 'max_depth': 6, 'subsample': 0.7164916560792167}. Best is trial 0 with value: 1.0.
[I 2025-10-01 09:57:21,704] Trial 5 finished with value: 1.0 and parameters: {'n_estimators': 203, 'learning_rate': 0.01607123851203988, 'max_depth': 5, 'subsample': 0.7465447373174767}. Best is trial 0 with value: 1.0.
[I 2025-10-01 09:57:21,976] Trial 6 finished with value: 1.0 and parameters: {'n_estimators': 164, 'learning_rate': 0.14447746112718687, 'max_depth': 4, 'subsample': 0.8056937753654446}. Best is trial 0 with value: 1.0.
[I 2025-10-01 09:57:22,731] Trial 7 finished with value: 1.0 and parameters: {'n_estimators': 198, 'learning_rate': 0.011711509955524094, 'max_depth': 7, 'subsample': 0.6682096494749166}. Best is trial 0 with value: 1.0.
[I 2025-10-01 09:57:22,946] Trial 8 finished with value: 0.9803921568627451 and parameters: {'n_estimators': 66, 'learning_rate': 0.2521267904777921, 'max_depth': 10, 'subsample': 0.9233589392465844}. Best is trial 0 with value: 1.0.
[I 2025-10-01 09:57:23,421] Trial 9 finished with value: 0.9803921568627451 and parameters: {'n_estimators': 126, 'learning_rate': 0.013940346079873234, 'max_depth': 8, 'subsample': 0.7760609974958406}. Best is trial 0 with value: 1.0.
INFO:optuna_optimizer:Optimization completed for gradient_boosting
INFO:optuna_optimizer:Best score: 1.0000
INFO:optuna_optimizer:Best params: {'n_estimators': 144, 'learning_rate': 0.2536999076681772, 'max_depth': 8, 'subsample': 0.8394633936788146}
DEBUG: Starting cache save for gradient_boosting
DEBUG: Cache directory created: cache\models\gradient_boosting\numeric_dataset_MinMaxScaler\bd1ad21c0a30e849371923cf8205b06c3534f4287726b65950f7b3173adc8d47
DEBUG: Model artifact saved: cache\models\gradient_boosting\numeric_dataset_MinMaxScaler\bd1ad21c0a30e849371923cf8205b06c3534f4287726b65950f7b3173adc8d47\model.pkl
DEBUG: Params saved: cache\models\gradient_boosting\numeric_dataset_MinMaxScaler\bd1ad21c0a30e849371923cf8205b06c3534f4287726b65950f7b3173adc8d47\params.json
DEBUG: Metrics saved: cache\models\gradient_boosting\numeric_dataset_MinMaxScaler\bd1ad21c0a30e849371923cf8205b06c3534f4287726b65950f7b3173adc8d47\metrics.json
DEBUG: Config saved: cache\models\gradient_boosting\numeric_dataset_MinMaxScaler\bd1ad21c0a30e849371923cf8205b06c3534f4287726b65950f7b3173adc8d47\config.json
INFO:cache_manager:Cache saved for gradient_boosting at cache\models\gradient_boosting\numeric_dataset_MinMaxScaler\bd1ad21c0a30e849371923cf8205b06c3534f4287726b65950f7b3173adc8d47
DEBUG: Garbage collection completed for gradient_boosting
DEBUG: Garbage collection completed for gradient_boosting
[I 2025-10-01 09:57:24,042] A new study created in memory with name: decision_tree_optimization
INFO:optuna_optimizer:Created Optuna study: decision_tree_optimization
INFO:optuna_optimizer:Starting optimization for decision_tree...
🖥️ Using CPU without pruning (CCP disabled on Windows)
[I 2025-10-01 09:57:24,047] Trial 0 finished with value: 0.9803921568627451 and parameters: {}. Best is trial 0 with value: 0.9803921568627451.
🖥️ Using CPU without pruning (CCP disabled on Windows)
[I 2025-10-01 09:57:24,050] Trial 1 finished with value: 0.9803921568627451 and parameters: {}. Best is trial 0 with value: 0.9803921568627451.
🖥️ Using CPU without pruning (CCP disabled on Windows)
[I 2025-10-01 09:57:24,054] Trial 2 finished with value: 0.9803921568627451 and parameters: {}. Best is trial 0 with value: 0.9803921568627451.
🖥️ Using CPU without pruning (CCP disabled on Windows)
[I 2025-10-01 09:57:24,057] Trial 3 finished with value: 0.9803921568627451 and parameters: {}. Best is trial 0 with value: 0.9803921568627451.
🖥️ Using CPU without pruning (CCP disabled on Windows)
[I 2025-10-01 09:57:24,064] Trial 4 finished with value: 0.9803921568627451 and parameters: {}. Best is trial 0 with value: 0.9803921568627451.
🖥️ Using CPU without pruning (CCP disabled on Windows)
[I 2025-10-01 09:57:24,067] Trial 5 finished with value: 0.9803921568627451 and parameters: {}. Best is trial 0 with value: 0.9803921568627451.
🖥️ Using CPU without pruning (CCP disabled on Windows)
[I 2025-10-01 09:57:24,072] Trial 6 finished with value: 0.9803921568627451 and parameters: {}. Best is trial 0 with value: 0.9803921568627451.
🖥️ Using CPU without pruning (CCP disabled on Windows)
[I 2025-10-01 09:57:24,075] Trial 7 finished with value: 0.9803921568627451 and parameters: {}. Best is trial 0 with value: 0.9803921568627451.
🖥️ Using CPU without pruning (CCP disabled on Windows)
[I 2025-10-01 09:57:24,078] Trial 8 finished with value: 0.9803921568627451 and parameters: {}. Best is trial 0 with value: 0.9803921568627451.
🖥️ Using CPU without pruning (CCP disabled on Windows)
[I 2025-10-01 09:57:24,082] Trial 9 finished with value: 0.9803921568627451 and parameters: {}. Best is trial 0 with value: 0.9803921568627451.
INFO:optuna_optimizer:Optimization completed for decision_tree
INFO:optuna_optimizer:Best score: 0.9804
INFO:optuna_optimizer:Best params: {}
🖥️ Using CPU without pruning (CCP disabled on Windows)
DEBUG: Starting cache save for decision_tree
DEBUG: Cache directory created: cache\models\decision_tree\numeric_dataset_MinMaxScaler\79e43c22c8cbe65a1214a0f088e2eaf69a02d4bf31e0a2284074d2092774d501
DEBUG: Model artifact saved: cache\models\decision_tree\numeric_dataset_MinMaxScaler\79e43c22c8cbe65a1214a0f088e2eaf69a02d4bf31e0a2284074d2092774d501\model.pkl
DEBUG: Params saved: cache\models\decision_tree\numeric_dataset_MinMaxScaler\79e43c22c8cbe65a1214a0f088e2eaf69a02d4bf31e0a2284074d2092774d501\params.json
DEBUG: Metrics saved: cache\models\decision_tree\numeric_dataset_MinMaxScaler\79e43c22c8cbe65a1214a0f088e2eaf69a02d4bf31e0a2284074d2092774d501\metrics.json
DEBUG: Config saved: cache\models\decision_tree\numeric_dataset_MinMaxScaler\79e43c22c8cbe65a1214a0f088e2eaf69a02d4bf31e0a2284074d2092774d501\config.json
INFO:cache_manager:Cache saved for decision_tree at cache\models\decision_tree\numeric_dataset_MinMaxScaler\79e43c22c8cbe65a1214a0f088e2eaf69a02d4bf31e0a2284074d2092774d501
DEBUG: Garbage collection completed for decision_tree
DEBUG: Garbage collection completed for decision_tree
[I 2025-10-01 09:57:24,389] A new study created in memory with name: logistic_regression_optimization
INFO:optuna_optimizer:Created Optuna study: logistic_regression_optimization
INFO:optuna_optimizer:Starting optimization for logistic_regression...
🔄 CPU multithreading: Using all 12 available cores
[I 2025-10-01 09:57:24,397] Trial 0 finished with value: 0.803921568627451 and parameters: {}. Best is trial 0 with value: 0.803921568627451.
🔄 CPU multithreading: Using all 12 available cores
[I 2025-10-01 09:57:24,402] Trial 1 finished with value: 0.803921568627451 and parameters: {}. Best is trial 0 with value: 0.803921568627451.
🔄 CPU multithreading: Using all 12 available cores
[I 2025-10-01 09:57:24,408] Trial 2 finished with value: 0.803921568627451 and parameters: {}. Best is trial 0 with value: 0.803921568627451.
🔄 CPU multithreading: Using all 12 available cores
[I 2025-10-01 09:57:24,415] Trial 3 finished with value: 0.803921568627451 and parameters: {}. Best is trial 0 with value: 0.803921568627451.
🔄 CPU multithreading: Using all 12 available cores
[I 2025-10-01 09:57:24,419] Trial 4 finished with value: 0.803921568627451 and parameters: {}. Best is trial 0 with value: 0.803921568627451.
🔄 CPU multithreading: Using all 12 available cores
[I 2025-10-01 09:57:24,424] Trial 5 finished with value: 0.803921568627451 and parameters: {}. Best is trial 0 with value: 0.803921568627451.
🔄 CPU multithreading: Using all 12 available cores
[I 2025-10-01 09:57:24,430] Trial 6 finished with value: 0.803921568627451 and parameters: {}. Best is trial 0 with value: 0.803921568627451.
🔄 CPU multithreading: Using all 12 available cores
[I 2025-10-01 09:57:24,434] Trial 7 finished with value: 0.803921568627451 and parameters: {}. Best is trial 0 with value: 0.803921568627451.
🔄 CPU multithreading: Using all 12 available cores
[I 2025-10-01 09:57:24,441] Trial 8 finished with value: 0.803921568627451 and parameters: {}. Best is trial 0 with value: 0.803921568627451.
🔄 CPU multithreading: Using all 12 available cores
[I 2025-10-01 09:57:24,448] Trial 9 finished with value: 0.803921568627451 and parameters: {}. Best is trial 0 with value: 0.803921568627451.
INFO:optuna_optimizer:Optimization completed for logistic_regression
INFO:optuna_optimizer:Best score: 0.8039
INFO:optuna_optimizer:Best params: {}
🔄 CPU multithreading: Using all 12 available cores
DEBUG: Starting cache save for logistic_regression
DEBUG: Cache directory created: cache\models\logistic_regression\numeric_dataset_MinMaxScaler\fedcb625d839c14b500b96f6cd808bfbbd2b02455ddcde06cbc5cbd27519815a
DEBUG: Model artifact saved: cache\models\logistic_regression\numeric_dataset_MinMaxScaler\fedcb625d839c14b500b96f6cd808bfbbd2b02455ddcde06cbc5cbd27519815a\model.pkl
DEBUG: Params saved: cache\models\logistic_regression\numeric_dataset_MinMaxScaler\fedcb625d839c14b500b96f6cd808bfbbd2b02455ddcde06cbc5cbd27519815a\params.json
DEBUG: Metrics saved: cache\models\logistic_regression\numeric_dataset_MinMaxScaler\fedcb625d839c14b500b96f6cd808bfbbd2b02455ddcde06cbc5cbd27519815a\metrics.json
DEBUG: Config saved: cache\models\logistic_regression\numeric_dataset_MinMaxScaler\fedcb625d839c14b500b96f6cd808bfbbd2b02455ddcde06cbc5cbd27519815a\config.json
INFO:cache_manager:Cache saved for logistic_regression at cache\models\logistic_regression\numeric_dataset_MinMaxScaler\fedcb625d839c14b500b96f6cd808bfbbd2b02455ddcde06cbc5cbd27519815a
DEBUG: Garbage collection completed for logistic_regression
DEBUG: Garbage collection completed for logistic_regression
⚡ Using SGDClassifier (fastest overall)
[I 2025-10-01 09:57:24,727] A new study created in memory with name: svm_optimization
INFO:optuna_optimizer:Created Optuna study: svm_optimization
INFO:optuna_optimizer:Starting optimization for svm...
⚡ Using SGDClassifier (fastest overall)
INFO:SVM_Training:🚀 Starting SVM training at 2025-10-01 09:57:24
INFO:SVM_Training:📊 Data: 820 samples, 13 features, 1 classes
INFO:SVM_Training:⚙️  Parameters: {'C': 1.0, 'kernel': 'rbf', 'gamma': 'scale', 'random_state': 42, 'max_iter': 1000, 'tol': 0.001, 'auto_fast': True}
INFO:SVM_Training:💾 Estimated memory: 0.08 MB
INFO:SVM_Training:💻 Using CPU (scikit-learn) - Fast and reliable
📊 Using dense array for SVM training: (820, 13)
INFO:SVM_Training:🔧 Data preparation: dense_array
INFO:SVM_Training:✅ Training completed on CPU in 0.0015s
INFO:SVM_Training:🎯 Total support vectors: 0
INFO:SVM_Training:🔮 Prediction on 102 samples using CPU in 0.0000s
[I 2025-10-01 09:57:24,731] Trial 0 finished with value: 0.5098039215686274 and parameters: {}. Best is trial 0 with value: 0.5098039215686274.
⚡ Using SGDClassifier (fastest overall)
INFO:SVM_Training:🚀 Starting SVM training at 2025-10-01 09:57:24
INFO:SVM_Training:📊 Data: 820 samples, 13 features, 1 classes
INFO:SVM_Training:⚙️  Parameters: {'C': 1.0, 'kernel': 'rbf', 'gamma': 'scale', 'random_state': 42, 'max_iter': 1000, 'tol': 0.001, 'auto_fast': True}
INFO:SVM_Training:💾 Estimated memory: 0.08 MB
INFO:SVM_Training:💻 Using CPU (scikit-learn) - Fast and reliable
📊 Using dense array for SVM training: (820, 13)
INFO:SVM_Training:🔧 Data preparation: dense_array
INFO:SVM_Training:✅ Training completed on CPU in 0.0010s
INFO:SVM_Training:🎯 Total support vectors: 0
INFO:SVM_Training:🔮 Prediction on 102 samples using CPU in 0.0010s
[I 2025-10-01 09:57:24,734] Trial 1 finished with value: 0.5098039215686274 and parameters: {}. Best is trial 0 with value: 0.5098039215686274.
⚡ Using SGDClassifier (fastest overall)
INFO:SVM_Training:🚀 Starting SVM training at 2025-10-01 09:57:24
INFO:SVM_Training:📊 Data: 820 samples, 13 features, 1 classes
INFO:SVM_Training:⚙️  Parameters: {'C': 1.0, 'kernel': 'rbf', 'gamma': 'scale', 'random_state': 42, 'max_iter': 1000, 'tol': 0.001, 'auto_fast': True}
INFO:SVM_Training:💾 Estimated memory: 0.08 MB
INFO:SVM_Training:💻 Using CPU (scikit-learn) - Fast and reliable
📊 Using dense array for SVM training: (820, 13)
INFO:SVM_Training:🔧 Data preparation: dense_array
INFO:SVM_Training:✅ Training completed on CPU in 0.0010s
INFO:SVM_Training:🎯 Total support vectors: 0
INFO:SVM_Training:🔮 Prediction on 102 samples using CPU in 0.0000s
[I 2025-10-01 09:57:24,735] Trial 2 finished with value: 0.5098039215686274 and parameters: {}. Best is trial 0 with value: 0.5098039215686274.
⚡ Using SGDClassifier (fastest overall)
INFO:SVM_Training:🚀 Starting SVM training at 2025-10-01 09:57:24
INFO:SVM_Training:📊 Data: 820 samples, 13 features, 1 classes
INFO:SVM_Training:⚙️  Parameters: {'C': 1.0, 'kernel': 'rbf', 'gamma': 'scale', 'random_state': 42, 'max_iter': 1000, 'tol': 0.001, 'auto_fast': True}
INFO:SVM_Training:💾 Estimated memory: 0.08 MB
INFO:SVM_Training:💻 Using CPU (scikit-learn) - Fast and reliable
📊 Using dense array for SVM training: (820, 13)
INFO:SVM_Training:🔧 Data preparation: dense_array
INFO:SVM_Training:✅ Training completed on CPU in 0.0009s
INFO:SVM_Training:🎯 Total support vectors: 0
INFO:SVM_Training:🔮 Prediction on 102 samples using CPU in 0.0012s
[I 2025-10-01 09:57:24,739] Trial 3 finished with value: 0.5098039215686274 and parameters: {}. Best is trial 0 with value: 0.5098039215686274.
⚡ Using SGDClassifier (fastest overall)
INFO:SVM_Training:🚀 Starting SVM training at 2025-10-01 09:57:24
INFO:SVM_Training:📊 Data: 820 samples, 13 features, 1 classes
INFO:SVM_Training:⚙️  Parameters: {'C': 1.0, 'kernel': 'rbf', 'gamma': 'scale', 'random_state': 42, 'max_iter': 1000, 'tol': 0.001, 'auto_fast': True}
INFO:SVM_Training:💾 Estimated memory: 0.08 MB
INFO:SVM_Training:💻 Using CPU (scikit-learn) - Fast and reliable
📊 Using dense array for SVM training: (820, 13)
INFO:SVM_Training:🔧 Data preparation: dense_array
INFO:SVM_Training:✅ Training completed on CPU in 0.0010s
INFO:SVM_Training:🎯 Total support vectors: 0
INFO:SVM_Training:🔮 Prediction on 102 samples using CPU in 0.0000s
[I 2025-10-01 09:57:24,741] Trial 4 finished with value: 0.5098039215686274 and parameters: {}. Best is trial 0 with value: 0.5098039215686274.
⚡ Using SGDClassifier (fastest overall)
INFO:SVM_Training:🚀 Starting SVM training at 2025-10-01 09:57:24
INFO:SVM_Training:📊 Data: 820 samples, 13 features, 1 classes
INFO:SVM_Training:⚙️  Parameters: {'C': 1.0, 'kernel': 'rbf', 'gamma': 'scale', 'random_state': 42, 'max_iter': 1000, 'tol': 0.001, 'auto_fast': True}
INFO:SVM_Training:💾 Estimated memory: 0.08 MB
INFO:SVM_Training:💻 Using CPU (scikit-learn) - Fast and reliable
📊 Using dense array for SVM training: (820, 13)
INFO:SVM_Training:🔧 Data preparation: dense_array
INFO:SVM_Training:✅ Training completed on CPU in 0.0020s
INFO:SVM_Training:🎯 Total support vectors: 0
INFO:SVM_Training:🔮 Prediction on 102 samples using CPU in 0.0000s
[I 2025-10-01 09:57:24,744] Trial 5 finished with value: 0.5098039215686274 and parameters: {}. Best is trial 0 with value: 0.5098039215686274.
⚡ Using SGDClassifier (fastest overall)
INFO:SVM_Training:🚀 Starting SVM training at 2025-10-01 09:57:24
INFO:SVM_Training:📊 Data: 820 samples, 13 features, 1 classes
INFO:SVM_Training:⚙️  Parameters: {'C': 1.0, 'kernel': 'rbf', 'gamma': 'scale', 'random_state': 42, 'max_iter': 1000, 'tol': 0.001, 'auto_fast': True}
INFO:SVM_Training:💾 Estimated memory: 0.08 MB
INFO:SVM_Training:💻 Using CPU (scikit-learn) - Fast and reliable
📊 Using dense array for SVM training: (820, 13)
INFO:SVM_Training:🔧 Data preparation: dense_array
INFO:SVM_Training:✅ Training completed on CPU in 0.0015s
INFO:SVM_Training:🎯 Total support vectors: 0
INFO:SVM_Training:🔮 Prediction on 102 samples using CPU in 0.0000s
[I 2025-10-01 09:57:24,747] Trial 6 finished with value: 0.5098039215686274 and parameters: {}. Best is trial 0 with value: 0.5098039215686274.
⚡ Using SGDClassifier (fastest overall)
INFO:SVM_Training:🚀 Starting SVM training at 2025-10-01 09:57:24
INFO:SVM_Training:📊 Data: 820 samples, 13 features, 1 classes
INFO:SVM_Training:⚙️  Parameters: {'C': 1.0, 'kernel': 'rbf', 'gamma': 'scale', 'random_state': 42, 'max_iter': 1000, 'tol': 0.001, 'auto_fast': True}
INFO:SVM_Training:💾 Estimated memory: 0.08 MB
INFO:SVM_Training:💻 Using CPU (scikit-learn) - Fast and reliable
📊 Using dense array for SVM training: (820, 13)
INFO:SVM_Training:🔧 Data preparation: dense_array
INFO:SVM_Training:✅ Training completed on CPU in 0.0010s
INFO:SVM_Training:🎯 Total support vectors: 0
INFO:SVM_Training:🔮 Prediction on 102 samples using CPU in 0.0000s
[I 2025-10-01 09:57:24,750] Trial 7 finished with value: 0.5098039215686274 and parameters: {}. Best is trial 0 with value: 0.5098039215686274.
⚡ Using SGDClassifier (fastest overall)
INFO:SVM_Training:🚀 Starting SVM training at 2025-10-01 09:57:24
INFO:SVM_Training:📊 Data: 820 samples, 13 features, 1 classes
INFO:SVM_Training:⚙️  Parameters: {'C': 1.0, 'kernel': 'rbf', 'gamma': 'scale', 'random_state': 42, 'max_iter': 1000, 'tol': 0.001, 'auto_fast': True}
INFO:SVM_Training:💾 Estimated memory: 0.08 MB
INFO:SVM_Training:💻 Using CPU (scikit-learn) - Fast and reliable
📊 Using dense array for SVM training: (820, 13)
INFO:SVM_Training:🔧 Data preparation: dense_array
INFO:SVM_Training:✅ Training completed on CPU in 0.0022s
INFO:SVM_Training:🎯 Total support vectors: 0
INFO:SVM_Training:🔮 Prediction on 102 samples using CPU in 0.0000s
[I 2025-10-01 09:57:24,753] Trial 8 finished with value: 0.5098039215686274 and parameters: {}. Best is trial 0 with value: 0.5098039215686274.
⚡ Using SGDClassifier (fastest overall)
INFO:SVM_Training:🚀 Starting SVM training at 2025-10-01 09:57:24
INFO:SVM_Training:📊 Data: 820 samples, 13 features, 1 classes
INFO:SVM_Training:⚙️  Parameters: {'C': 1.0, 'kernel': 'rbf', 'gamma': 'scale', 'random_state': 42, 'max_iter': 1000, 'tol': 0.001, 'auto_fast': True}
INFO:SVM_Training:💾 Estimated memory: 0.08 MB
INFO:SVM_Training:💻 Using CPU (scikit-learn) - Fast and reliable
📊 Using dense array for SVM training: (820, 13)
INFO:SVM_Training:🔧 Data preparation: dense_array
INFO:SVM_Training:✅ Training completed on CPU in 0.0010s
INFO:SVM_Training:🎯 Total support vectors: 0
INFO:SVM_Training:🔮 Prediction on 102 samples using CPU in 0.0010s
