[I 2025-10-01 09:56:03,838] Trial 0 finished with value: 1.0 and parameters: {'n_estimators': 218, 'max_depth': 20, 'max_features': 'sqrt', 'min_samples_split': 4, 'min_samples_leaf': 1}. Best is trial 0 with value: 1.0.
CPU multithreading: Using all 12 available cores
[I 2025-10-01 09:56:04,821] Trial 1 finished with value: 0.9215686274509803 and parameters: {'n_estimators': 440, 'max_depth': 13, 'max_features': None, 'min_samples_split': 17, 'min_samples_leaf': 3}. Best is trial 0 with value: 1.0.
CPU multithreading: Using all 12 available cores
[I 2025-10-01 09:56:04,977] Trial 2 finished with value: 0.9215686274509803 and parameters: {'n_estimators': 132, 'max_depth': 6, 'max_features': 'log2', 'min_samples_split': 7, 'min_samples_leaf': 7}. Best is trial 0 with value: 1.0.
CPU multithreading: Using all 12 available cores
[I 2025-10-01 09:56:05,233] Trial 3 finished with value: 0.9313725490196079 and parameters: {'n_estimators': 112, 'max_depth': 8, 'max_features': None, 'min_samples_split': 5, 'min_samples_leaf': 6}. Best is trial 0 with value: 1.0.
CPU multithreading: Using all 12 available cores
[I 2025-10-01 09:56:05,559] Trial 4 finished with value: 0.8725490196078431 and parameters: {'n_estimators': 317, 'max_depth': 3, 'max_features': 'sqrt', 'min_samples_split': 20, 'min_samples_leaf': 10}. Best is trial 0 with value: 1.0.
CPU multithreading: Using all 12 available cores
[I 2025-10-01 09:56:06,073] Trial 5 finished with value: 0.9803921568627451 and parameters: {'n_estimators': 414, 'max_depth': 8, 'max_features': 'log2', 'min_samples_split': 4, 'min_samples_leaf': 5}. Best is trial 0 with value: 1.0.
CPU multithreading: Using all 12 available cores
[I 2025-10-01 09:56:06,159] Trial 6 finished with value: 0.9509803921568627 and parameters: {'n_estimators': 65, 'max_depth': 19, 'max_features': 'log2', 'min_samples_split': 11, 'min_samples_leaf': 6}. Best is trial 0 with value: 1.0.
CPU multithreading: Using all 12 available cores
[I 2025-10-01 09:56:06,315] Trial 7 finished with value: 0.9019607843137255 and parameters: {'n_estimators': 133, 'max_depth': 20, 'max_features': 'log2', 'min_samples_split': 13, 'min_samples_leaf': 10}. Best is trial 0 with value: 1.0.
CPU multithreading: Using all 12 available cores
[I 2025-10-01 09:56:06,490] Trial 8 finished with value: 0.9215686274509803 and parameters: {'n_estimators': 89, 'max_depth': 6, 'max_features': None, 'min_samples_split': 7, 'min_samples_leaf': 9}. Best is trial 0 with value: 1.0.
CPU multithreading: Using all 12 available cores
[I 2025-10-01 09:56:06,888] Trial 9 finished with value: 0.9117647058823529 and parameters: {'n_estimators': 210, 'max_depth': 8, 'max_features': None, 'min_samples_split': 3, 'min_samples_leaf': 10}. Best is trial 0 with value: 1.0.
INFO:optuna_optimizer:Optimization completed for random_forest
INFO:optuna_optimizer:Best score: 1.0000
INFO:optuna_optimizer:Best params: {'n_estimators': 218, 'max_depth': 20, 'max_features': 'sqrt', 'min_samples_split': 4, 'min_samples_leaf': 1}
CPU multithreading: Using all 12 available cores
DEBUG: Starting cache save for random_forest
DEBUG: Cache directory created: cache\models\random_forest\numeric_dataset_StandardScaler\63169c8e32b5aeae31343f88aa6a0de72b90899b7dd1bbc8464560ab6cfe3f07
DEBUG: Model artifact saved: cache\models\random_forest\numeric_dataset_StandardScaler\63169c8e32b5aeae31343f88aa6a0de72b90899b7dd1bbc8464560ab6cfe3f07\model.pkl
DEBUG: Params saved: cache\models\random_forest\numeric_dataset_StandardScaler\63169c8e32b5aeae31343f88aa6a0de72b90899b7dd1bbc8464560ab6cfe3f07\params.json
DEBUG: Metrics saved: cache\models\random_forest\numeric_dataset_StandardScaler\63169c8e32b5aeae31343f88aa6a0de72b90899b7dd1bbc8464560ab6cfe3f07\metrics.json
DEBUG: Config saved: cache\models\random_forest\numeric_dataset_StandardScaler\63169c8e32b5aeae31343f88aa6a0de72b90899b7dd1bbc8464560ab6cfe3f07\config.json
INFO:cache_manager:Cache saved for random_forest at cache\models\random_forest\numeric_dataset_StandardScaler\63169c8e32b5aeae31343f88aa6a0de72b90899b7dd1bbc8464560ab6cfe3f07
DEBUG: Garbage collection completed for random_forest
DEBUG: Garbage collection completed for random_forest
INFO:gpu_config_manager:GPU mode enabled for xgboost: GPU: NVIDIA GeForce RTX 3060 (1 devices, 12.0GB)
🚀 XGBoost configured for GPU: GPU: NVIDIA GeForce RTX 3060 (1 devices, 12.0GB)
[I 2025-10-01 09:56:08,099] A new study created in memory with name: xgboost_optimization
INFO:optuna_optimizer:Created Optuna study: xgboost_optimization
INFO:optuna_optimizer:Starting optimization for xgboost...
INFO:gpu_config_manager:GPU mode enabled for xgboost: GPU: NVIDIA GeForce RTX 3060 (1 devices, 12.0GB)
🚀 XGBoost configured for GPU: GPU: NVIDIA GeForce RTX 3060 (1 devices, 12.0GB)
[I 2025-10-01 09:56:08,568] Trial 0 finished with value: 1.0 and parameters: {'n_estimators': 218, 'max_depth': 10, 'eta': 0.1205712628744377, 'subsample': 0.8394633936788146, 'colsample_bytree': 0.6624074561769746, 'min_child_weight': 2, 'reg_lambda': 0.0017073967431528124, 'reg_alpha': 2.9154431891537547}. Best is trial 0 with value: 1.0.
INFO:gpu_config_manager:GPU mode enabled for xgboost: GPU: NVIDIA GeForce RTX 3060 (1 devices, 12.0GB)
🚀 XGBoost configured for GPU: GPU: NVIDIA GeForce RTX 3060 (1 devices, 12.0GB)
[I 2025-10-01 09:56:09,300] Trial 1 finished with value: 0.9803921568627451 and parameters: {'n_estimators': 321, 'max_depth': 8, 'eta': 0.010725209743171996, 'subsample': 0.9879639408647978, 'colsample_bytree': 0.9329770563201687, 'min_child_weight': 3, 'reg_lambda': 0.005337032762603957, 'reg_alpha': 0.00541524411940254}. Best is trial 0 with value: 1.0.
INFO:gpu_config_manager:GPU mode enabled for xgboost: GPU: NVIDIA GeForce RTX 3060 (1 devices, 12.0GB)
🚀 XGBoost configured for GPU: GPU: NVIDIA GeForce RTX 3060 (1 devices, 12.0GB)
[I 2025-10-01 09:56:09,672] Trial 2 finished with value: 1.0 and parameters: {'n_estimators': 187, 'max_depth': 7, 'eta': 0.04345454109729477, 'subsample': 0.7164916560792167, 'colsample_bytree': 0.8447411578889518, 'min_child_weight': 2, 'reg_lambda': 0.01474275315991467, 'reg_alpha': 0.029204338471814112}. Best is trial 0 with value: 1.0.
INFO:gpu_config_manager:GPU mode enabled for xgboost: GPU: NVIDIA GeForce RTX 3060 (1 devices, 12.0GB)
🚀 XGBoost configured for GPU: GPU: NVIDIA GeForce RTX 3060 (1 devices, 12.0GB)
[I 2025-10-01 09:56:10,312] Trial 3 finished with value: 1.0 and parameters: {'n_estimators': 255, 'max_depth': 9, 'eta': 0.019721610970574007, 'subsample': 0.8056937753654446, 'colsample_bytree': 0.836965827544817, 'min_child_weight': 1, 'reg_lambda': 0.26926469100861794, 'reg_alpha': 0.004809461967501573}. Best is trial 0 with value: 1.0.
INFO:gpu_config_manager:GPU mode enabled for xgboost: GPU: NVIDIA GeForce RTX 3060 (1 devices, 12.0GB)
🚀 XGBoost configured for GPU: GPU: NVIDIA GeForce RTX 3060 (1 devices, 12.0GB)
[I 2025-10-01 09:56:10,471] Trial 4 finished with value: 1.0 and parameters: {'n_estimators': 79, 'max_depth': 10, 'eta': 0.26690431824362526, 'subsample': 0.9233589392465844, 'colsample_bytree': 0.7218455076693483, 'min_child_weight': 1, 'reg_lambda': 0.5456725485601477, 'reg_alpha': 0.057624872164786026}. Best is trial 0 with value: 1.0.
INFO:gpu_config_manager:GPU mode enabled for xgboost: GPU: NVIDIA GeForce RTX 3060 (1 devices, 12.0GB)
🚀 XGBoost configured for GPU: GPU: NVIDIA GeForce RTX 3060 (1 devices, 12.0GB)
[I 2025-10-01 09:56:10,670] Trial 5 finished with value: 0.9117647058823529 and parameters: {'n_estimators': 105, 'max_depth': 6, 'eta': 0.011240768803005551, 'subsample': 0.9637281608315128, 'colsample_bytree': 0.7035119926400067, 'min_child_weight': 7, 'reg_lambda': 0.017654048052495083, 'reg_alpha': 0.12030178871154672}. Best is trial 0 with value: 1.0.
INFO:gpu_config_manager:GPU mode enabled for xgboost: GPU: NVIDIA GeForce RTX 3060 (1 devices, 12.0GB)
🚀 XGBoost configured for GPU: GPU: NVIDIA GeForce RTX 3060 (1 devices, 12.0GB)
[I 2025-10-01 09:56:10,935] Trial 6 finished with value: 0.9117647058823529 and parameters: {'n_estimators': 296, 'max_depth': 4, 'eta': 0.27051668818999286, 'subsample': 0.9100531293444458, 'colsample_bytree': 0.9757995766256756, 'min_child_weight': 9, 'reg_lambda': 0.24637685958997463, 'reg_alpha': 4.869640941520899}. Best is trial 0 with value: 1.0.
INFO:gpu_config_manager:GPU mode enabled for xgboost: GPU: NVIDIA GeForce RTX 3060 (1 devices, 12.0GB)
🚀 XGBoost configured for GPU: GPU: NVIDIA GeForce RTX 3060 (1 devices, 12.0GB)
[I 2025-10-01 09:56:11,072] Trial 7 finished with value: 0.8921568627450981 and parameters: {'n_estimators': 89, 'max_depth': 4, 'eta': 0.011662890273931383, 'subsample': 0.7301321323053057, 'colsample_bytree': 0.7554709158757928, 'min_child_weight': 3, 'reg_lambda': 2.0651425578959257, 'reg_alpha': 0.026730883107816707}. Best is trial 0 with value: 1.0.
INFO:gpu_config_manager:GPU mode enabled for xgboost: GPU: NVIDIA GeForce RTX 3060 (1 devices, 12.0GB)
🚀 XGBoost configured for GPU: GPU: NVIDIA GeForce RTX 3060 (1 devices, 12.0GB)
[I 2025-10-01 09:56:11,346] Trial 8 finished with value: 0.8921568627450981 and parameters: {'n_estimators': 176, 'max_depth': 7, 'eta': 0.016149614799999188, 'subsample': 0.9208787923016158, 'colsample_bytree': 0.6298202574719083, 'min_child_weight': 10, 'reg_lambda': 1.2273800987852967, 'reg_alpha': 0.0062353771356731605}. Best is trial 0 with value: 1.0.
INFO:gpu_config_manager:GPU mode enabled for xgboost: GPU: NVIDIA GeForce RTX 3060 (1 devices, 12.0GB)
🚀 XGBoost configured for GPU: GPU: NVIDIA GeForce RTX 3060 (1 devices, 12.0GB)
[I 2025-10-01 09:56:11,486] Trial 9 finished with value: 1.0 and parameters: {'n_estimators': 52, 'max_depth': 9, 'eta': 0.11069143219393454, 'subsample': 0.8916028672163949, 'colsample_bytree': 0.9085081386743783, 'min_child_weight': 1, 'reg_lambda': 0.02715581955282941, 'reg_alpha': 0.0029072088906598446}. Best is trial 0 with value: 1.0.
INFO:optuna_optimizer:Optimization completed for xgboost
INFO:optuna_optimizer:Best score: 1.0000
INFO:optuna_optimizer:Best params: {'n_estimators': 218, 'max_depth': 10, 'eta': 0.1205712628744377, 'subsample': 0.8394633936788146, 'colsample_bytree': 0.6624074561769746, 'min_child_weight': 2, 'reg_lambda': 0.0017073967431528124, 'reg_alpha': 2.9154431891537547}
INFO:gpu_config_manager:GPU mode enabled for xgboost: GPU: NVIDIA GeForce RTX 3060 (1 devices, 12.0GB)
🚀 XGBoost configured for GPU: GPU: NVIDIA GeForce RTX 3060 (1 devices, 12.0GB)
DEBUG: Starting cache save for xgboost
DEBUG: Cache directory created: cache\models\xgboost\numeric_dataset_StandardScaler\34f28e807b84cfe3d20fbf875aaab181677084229685009d074b93d56c03efdd
DEBUG: Model artifact saved: cache\models\xgboost\numeric_dataset_StandardScaler\34f28e807b84cfe3d20fbf875aaab181677084229685009d074b93d56c03efdd\model.json
DEBUG: Params saved: cache\models\xgboost\numeric_dataset_StandardScaler\34f28e807b84cfe3d20fbf875aaab181677084229685009d074b93d56c03efdd\params.json
DEBUG: Metrics saved: cache\models\xgboost\numeric_dataset_StandardScaler\34f28e807b84cfe3d20fbf875aaab181677084229685009d074b93d56c03efdd\metrics.json
DEBUG: Config saved: cache\models\xgboost\numeric_dataset_StandardScaler\34f28e807b84cfe3d20fbf875aaab181677084229685009d074b93d56c03efdd\config.json
INFO:cache_manager:Cache saved for xgboost at cache\models\xgboost\numeric_dataset_StandardScaler\34f28e807b84cfe3d20fbf875aaab181677084229685009d074b93d56c03efdd
DEBUG: Garbage collection completed for xgboost
DEBUG: Garbage collection completed for xgboost
INFO:gpu_config_manager:GPU mode enabled for lightgbm: GPU: NVIDIA GeForce RTX 3060 (1 devices, 12.0GB)
🚀 LightGBM configured for GPU: GPU: NVIDIA GeForce RTX 3060 (1 devices, 12.0GB)
[I 2025-10-01 09:56:12,120] A new study created in memory with name: lightgbm_optimization
INFO:optuna_optimizer:Created Optuna study: lightgbm_optimization
INFO:optuna_optimizer:Starting optimization for lightgbm...
INFO:gpu_config_manager:GPU mode enabled for lightgbm: GPU: NVIDIA GeForce RTX 3060 (1 devices, 12.0GB)
🚀 LightGBM configured for GPU: GPU: NVIDIA GeForce RTX 3060 (1 devices, 12.0GB)
[I 2025-10-01 09:56:12,820] Trial 0 finished with value: 1.0 and parameters: {'n_estimators': 218, 'num_leaves': 96, 'learning_rate': 0.1205712628744377, 'feature_fraction': 0.8394633936788146, 'bagging_fraction': 0.6624074561769746, 'min_child_samples': 12, 'lambda_l1': 0.0017073967431528124, 'lambda_l2': 2.9154431891537547}. Best is trial 0 with value: 1.0.
INFO:gpu_config_manager:GPU mode enabled for lightgbm: GPU: NVIDIA GeForce RTX 3060 (1 devices, 12.0GB)
🚀 LightGBM configured for GPU: GPU: NVIDIA GeForce RTX 3060 (1 devices, 12.0GB)
[I 2025-10-01 09:56:13,877] Trial 1 finished with value: 1.0 and parameters: {'n_estimators': 321, 'num_leaves': 74, 'learning_rate': 0.010725209743171996, 'feature_fraction': 0.9879639408647978, 'bagging_fraction': 0.9329770563201687, 'min_child_samples': 14, 'lambda_l1': 0.005337032762603957, 'lambda_l2': 0.00541524411940254}. Best is trial 0 with value: 1.0.
INFO:gpu_config_manager:GPU mode enabled for lightgbm: GPU: NVIDIA GeForce RTX 3060 (1 devices, 12.0GB)
🚀 LightGBM configured for GPU: GPU: NVIDIA GeForce RTX 3060 (1 devices, 12.0GB)
[I 2025-10-01 09:56:14,612] Trial 2 finished with value: 1.0 and parameters: {'n_estimators': 187, 'num_leaves': 57, 'learning_rate': 0.04345454109729477, 'feature_fraction': 0.7164916560792167, 'bagging_fraction': 0.8447411578889518, 'min_child_samples': 11, 'lambda_l1': 0.01474275315991467, 'lambda_l2': 0.029204338471814112}. Best is trial 0 with value: 1.0.
INFO:gpu_config_manager:GPU mode enabled for lightgbm: GPU: NVIDIA GeForce RTX 3060 (1 devices, 12.0GB)
🚀 LightGBM configured for GPU: GPU: NVIDIA GeForce RTX 3060 (1 devices, 12.0GB)
[I 2025-10-01 09:56:15,697] Trial 3 finished with value: 1.0 and parameters: {'n_estimators': 255, 'num_leaves': 81, 'learning_rate': 0.019721610970574007, 'feature_fraction': 0.8056937753654446, 'bagging_fraction': 0.836965827544817, 'min_child_samples': 7, 'lambda_l1': 0.26926469100861794, 'lambda_l2': 0.004809461967501573}. Best is trial 0 with value: 1.0.
INFO:gpu_config_manager:GPU mode enabled for lightgbm: GPU: NVIDIA GeForce RTX 3060 (1 devices, 12.0GB)
🚀 LightGBM configured for GPU: GPU: NVIDIA GeForce RTX 3060 (1 devices, 12.0GB)
[I 2025-10-01 09:56:15,904] Trial 4 finished with value: 1.0 and parameters: {'n_estimators': 79, 'num_leaves': 96, 'learning_rate': 0.26690431824362526, 'feature_fraction': 0.9233589392465844, 'bagging_fraction': 0.7218455076693483, 'min_child_samples': 9, 'lambda_l1': 0.5456725485601477, 'lambda_l2': 0.057624872164786026}. Best is trial 0 with value: 1.0.
INFO:gpu_config_manager:GPU mode enabled for lightgbm: GPU: NVIDIA GeForce RTX 3060 (1 devices, 12.0GB)
🚀 LightGBM configured for GPU: GPU: NVIDIA GeForce RTX 3060 (1 devices, 12.0GB)
[I 2025-10-01 09:56:16,157] Trial 5 finished with value: 0.8627450980392157 and parameters: {'n_estimators': 105, 'num_leaves': 55, 'learning_rate': 0.011240768803005551, 'feature_fraction': 0.9637281608315128, 'bagging_fraction': 0.7035119926400067, 'min_child_samples': 35, 'lambda_l1': 0.017654048052495083, 'lambda_l2': 0.12030178871154672}. Best is trial 0 with value: 1.0.
INFO:gpu_config_manager:GPU mode enabled for lightgbm: GPU: NVIDIA GeForce RTX 3060 (1 devices, 12.0GB)
🚀 LightGBM configured for GPU: GPU: NVIDIA GeForce RTX 3060 (1 devices, 12.0GB)
[I 2025-10-01 09:56:16,601] Trial 6 finished with value: 1.0 and parameters: {'n_estimators': 296, 'num_leaves': 26, 'learning_rate': 0.27051668818999286, 'feature_fraction': 0.9100531293444458, 'bagging_fraction': 0.9757995766256756, 'min_child_samples': 46, 'lambda_l1': 0.24637685958997463, 'lambda_l2': 4.869640941520899}. Best is trial 0 with value: 1.0.
INFO:gpu_config_manager:GPU mode enabled for lightgbm: GPU: NVIDIA GeForce RTX 3060 (1 devices, 12.0GB)
🚀 LightGBM configured for GPU: GPU: NVIDIA GeForce RTX 3060 (1 devices, 12.0GB)
[I 2025-10-01 09:56:16,845] Trial 7 finished with value: 0.9019607843137255 and parameters: {'n_estimators': 89, 'num_leaves': 27, 'learning_rate': 0.011662890273931383, 'feature_fraction': 0.7301321323053057, 'bagging_fraction': 0.7554709158757928, 'min_child_samples': 17, 'lambda_l1': 2.0651425578959257, 'lambda_l2': 0.026730883107816707}. Best is trial 0 with value: 1.0.
INFO:gpu_config_manager:GPU mode enabled for lightgbm: GPU: NVIDIA GeForce RTX 3060 (1 devices, 12.0GB)
🚀 LightGBM configured for GPU: GPU: NVIDIA GeForce RTX 3060 (1 devices, 12.0GB)
[I 2025-10-01 09:56:17,146] Trial 8 finished with value: 0.9019607843137255 and parameters: {'n_estimators': 176, 'num_leaves': 59, 'learning_rate': 0.016149614799999188, 'feature_fraction': 0.9208787923016158, 'bagging_fraction': 0.6298202574719083, 'min_child_samples': 50, 'lambda_l1': 1.2273800987852967, 'lambda_l2': 0.0062353771356731605}. Best is trial 0 with value: 1.0.
INFO:gpu_config_manager:GPU mode enabled for lightgbm: GPU: NVIDIA GeForce RTX 3060 (1 devices, 12.0GB)
🚀 LightGBM configured for GPU: GPU: NVIDIA GeForce RTX 3060 (1 devices, 12.0GB)
[I 2025-10-01 09:56:17,442] Trial 9 finished with value: 1.0 and parameters: {'n_estimators': 52, 'num_leaves': 84, 'learning_rate': 0.11069143219393454, 'feature_fraction': 0.8916028672163949, 'bagging_fraction': 0.9085081386743783, 'min_child_samples': 8, 'lambda_l1': 0.02715581955282941, 'lambda_l2': 0.0029072088906598446}. Best is trial 0 with value: 1.0.
INFO:optuna_optimizer:Optimization completed for lightgbm
INFO:optuna_optimizer:Best score: 1.0000
INFO:optuna_optimizer:Best params: {'n_estimators': 218, 'num_leaves': 96, 'learning_rate': 0.1205712628744377, 'feature_fraction': 0.8394633936788146, 'bagging_fraction': 0.6624074561769746, 'min_child_samples': 12, 'lambda_l1': 0.0017073967431528124, 'lambda_l2': 2.9154431891537547}
INFO:gpu_config_manager:GPU mode enabled for lightgbm: GPU: NVIDIA GeForce RTX 3060 (1 devices, 12.0GB)
🚀 LightGBM configured for GPU: GPU: NVIDIA GeForce RTX 3060 (1 devices, 12.0GB)
DEBUG: Starting cache save for lightgbm
DEBUG: Cache directory created: cache\models\lightgbm\numeric_dataset_StandardScaler\b86851ac3074763d1c0cba4eef50ce76570705b2b9030fcfa678f0c8f76494ce
DEBUG: Model artifact saved: cache\models\lightgbm\numeric_dataset_StandardScaler\b86851ac3074763d1c0cba4eef50ce76570705b2b9030fcfa678f0c8f76494ce\model.txt
DEBUG: Params saved: cache\models\lightgbm\numeric_dataset_StandardScaler\b86851ac3074763d1c0cba4eef50ce76570705b2b9030fcfa678f0c8f76494ce\params.json
DEBUG: Metrics saved: cache\models\lightgbm\numeric_dataset_StandardScaler\b86851ac3074763d1c0cba4eef50ce76570705b2b9030fcfa678f0c8f76494ce\metrics.json
DEBUG: Config saved: cache\models\lightgbm\numeric_dataset_StandardScaler\b86851ac3074763d1c0cba4eef50ce76570705b2b9030fcfa678f0c8f76494ce\config.json
INFO:cache_manager:Cache saved for lightgbm at cache\models\lightgbm\numeric_dataset_StandardScaler\b86851ac3074763d1c0cba4eef50ce76570705b2b9030fcfa678f0c8f76494ce
DEBUG: Garbage collection completed for lightgbm
DEBUG: Garbage collection completed for lightgbm
INFO:gpu_config_manager:GPU mode enabled for catboost: GPU: NVIDIA GeForce RTX 3060 (1 devices, 12.0GB)
🚀 CatBoost configured for GPU: GPU: NVIDIA GeForce RTX 3060 (1 devices, 12.0GB)
[I 2025-10-01 09:56:18,441] A new study created in memory with name: catboost_optimization
INFO:optuna_optimizer:Created Optuna study: catboost_optimization
INFO:optuna_optimizer:Starting optimization for catboost...
INFO:gpu_config_manager:GPU mode enabled for catboost: GPU: NVIDIA GeForce RTX 3060 (1 devices, 12.0GB)
🚀 CatBoost configured for GPU: GPU: NVIDIA GeForce RTX 3060 (1 devices, 12.0GB)
[I 2025-10-01 09:56:22,349] Trial 0 finished with value: 1.0 and parameters: {'iterations': 218, 'depth': 10, 'learning_rate': 0.1205712628744377, 'l2_leaf_reg': 3.968793330444372, 'border_count': 66}. Best is trial 0 with value: 1.0.
INFO:gpu_config_manager:GPU mode enabled for catboost: GPU: NVIDIA GeForce RTX 3060 (1 devices, 12.0GB)
🚀 CatBoost configured for GPU: GPU: NVIDIA GeForce RTX 3060 (1 devices, 12.0GB)
[I 2025-10-01 09:56:22,963] Trial 1 finished with value: 0.9215686274509803 and parameters: {'iterations': 120, 'depth': 3, 'learning_rate': 0.19030368381735815, 'l2_leaf_reg': 3.9913058785616786, 'border_count': 190}. Best is trial 0 with value: 1.0.
INFO:gpu_config_manager:GPU mode enabled for catboost: GPU: NVIDIA GeForce RTX 3060 (1 devices, 12.0GB)
🚀 CatBoost configured for GPU: GPU: NVIDIA GeForce RTX 3060 (1 devices, 12.0GB)
[I 2025-10-01 09:56:23,701] Trial 2 finished with value: 1.0 and parameters: {'iterations': 59, 'depth': 10, 'learning_rate': 0.16967533607196555, 'l2_leaf_reg': 1.6305687346221471, 'border_count': 72}. Best is trial 0 with value: 1.0.
INFO:gpu_config_manager:GPU mode enabled for catboost: GPU: NVIDIA GeForce RTX 3060 (1 devices, 12.0GB)
🚀 CatBoost configured for GPU: GPU: NVIDIA GeForce RTX 3060 (1 devices, 12.0GB)
[I 2025-10-01 09:56:24,367] Trial 3 finished with value: 0.9705882352941176 and parameters: {'iterations': 132, 'depth': 5, 'learning_rate': 0.05958389350068958, 'l2_leaf_reg': 2.7036160666620015, 'border_count': 97}. Best is trial 0 with value: 1.0.
INFO:gpu_config_manager:GPU mode enabled for catboost: GPU: NVIDIA GeForce RTX 3060 (1 devices, 12.0GB)
🚀 CatBoost configured for GPU: GPU: NVIDIA GeForce RTX 3060 (1 devices, 12.0GB)
[I 2025-10-01 09:56:25,904] Trial 4 finished with value: 1.0 and parameters: {'iterations': 325, 'depth': 4, 'learning_rate': 0.027010527749605478, 'l2_leaf_reg': 2.324672848950434, 'border_count': 134}. Best is trial 0 with value: 1.0.
INFO:gpu_config_manager:GPU mode enabled for catboost: GPU: NVIDIA GeForce RTX 3060 (1 devices, 12.0GB)
🚀 CatBoost configured for GPU: GPU: NVIDIA GeForce RTX 3060 (1 devices, 12.0GB)
