[I 2025-10-01 09:56:52,312] Trial 3 finished with value: 1.0 and parameters: {'n_estimators': 255, 'max_depth': 9, 'eta': 0.019721610970574007, 'subsample': 0.8056937753654446, 'colsample_bytree': 0.836965827544817, 'min_child_weight': 1, 'reg_lambda': 0.26926469100861794, 'reg_alpha': 0.004809461967501573}. Best is trial 0 with value: 1.0.
INFO:gpu_config_manager:GPU mode enabled for xgboost: GPU: NVIDIA GeForce RTX 3060 (1 devices, 12.0GB)
🚀 XGBoost configured for GPU: GPU: NVIDIA GeForce RTX 3060 (1 devices, 12.0GB)
[I 2025-10-01 09:56:52,462] Trial 4 finished with value: 1.0 and parameters: {'n_estimators': 79, 'max_depth': 10, 'eta': 0.26690431824362526, 'subsample': 0.9233589392465844, 'colsample_bytree': 0.7218455076693483, 'min_child_weight': 1, 'reg_lambda': 0.5456725485601477, 'reg_alpha': 0.057624872164786026}. Best is trial 0 with value: 1.0.
INFO:gpu_config_manager:GPU mode enabled for xgboost: GPU: NVIDIA GeForce RTX 3060 (1 devices, 12.0GB)
🚀 XGBoost configured for GPU: GPU: NVIDIA GeForce RTX 3060 (1 devices, 12.0GB)
[I 2025-10-01 09:56:52,652] Trial 5 finished with value: 0.9117647058823529 and parameters: {'n_estimators': 105, 'max_depth': 6, 'eta': 0.011240768803005551, 'subsample': 0.9637281608315128, 'colsample_bytree': 0.7035119926400067, 'min_child_weight': 7, 'reg_lambda': 0.017654048052495083, 'reg_alpha': 0.12030178871154672}. Best is trial 0 with value: 1.0.
INFO:gpu_config_manager:GPU mode enabled for xgboost: GPU: NVIDIA GeForce RTX 3060 (1 devices, 12.0GB)
🚀 XGBoost configured for GPU: GPU: NVIDIA GeForce RTX 3060 (1 devices, 12.0GB)
[I 2025-10-01 09:56:52,908] Trial 6 finished with value: 0.9117647058823529 and parameters: {'n_estimators': 296, 'max_depth': 4, 'eta': 0.27051668818999286, 'subsample': 0.9100531293444458, 'colsample_bytree': 0.9757995766256756, 'min_child_weight': 9, 'reg_lambda': 0.24637685958997463, 'reg_alpha': 4.869640941520899}. Best is trial 0 with value: 1.0.
INFO:gpu_config_manager:GPU mode enabled for xgboost: GPU: NVIDIA GeForce RTX 3060 (1 devices, 12.0GB)
🚀 XGBoost configured for GPU: GPU: NVIDIA GeForce RTX 3060 (1 devices, 12.0GB)
[I 2025-10-01 09:56:53,024] Trial 7 finished with value: 0.8921568627450981 and parameters: {'n_estimators': 89, 'max_depth': 4, 'eta': 0.011662890273931383, 'subsample': 0.7301321323053057, 'colsample_bytree': 0.7554709158757928, 'min_child_weight': 3, 'reg_lambda': 2.0651425578959257, 'reg_alpha': 0.026730883107816707}. Best is trial 0 with value: 1.0.
INFO:gpu_config_manager:GPU mode enabled for xgboost: GPU: NVIDIA GeForce RTX 3060 (1 devices, 12.0GB)
🚀 XGBoost configured for GPU: GPU: NVIDIA GeForce RTX 3060 (1 devices, 12.0GB)
[I 2025-10-01 09:56:53,283] Trial 8 finished with value: 0.8921568627450981 and parameters: {'n_estimators': 176, 'max_depth': 7, 'eta': 0.016149614799999188, 'subsample': 0.9208787923016158, 'colsample_bytree': 0.6298202574719083, 'min_child_weight': 10, 'reg_lambda': 1.2273800987852967, 'reg_alpha': 0.0062353771356731605}. Best is trial 0 with value: 1.0.
INFO:gpu_config_manager:GPU mode enabled for xgboost: GPU: NVIDIA GeForce RTX 3060 (1 devices, 12.0GB)
🚀 XGBoost configured for GPU: GPU: NVIDIA GeForce RTX 3060 (1 devices, 12.0GB)
[I 2025-10-01 09:56:53,415] Trial 9 finished with value: 1.0 and parameters: {'n_estimators': 52, 'max_depth': 9, 'eta': 0.11069143219393454, 'subsample': 0.8916028672163949, 'colsample_bytree': 0.9085081386743783, 'min_child_weight': 1, 'reg_lambda': 0.02715581955282941, 'reg_alpha': 0.0029072088906598446}. Best is trial 0 with value: 1.0.
INFO:optuna_optimizer:Optimization completed for xgboost
INFO:optuna_optimizer:Best score: 1.0000
INFO:optuna_optimizer:Best params: {'n_estimators': 218, 'max_depth': 10, 'eta': 0.1205712628744377, 'subsample': 0.8394633936788146, 'colsample_bytree': 0.6624074561769746, 'min_child_weight': 2, 'reg_lambda': 0.0017073967431528124, 'reg_alpha': 2.9154431891537547}
INFO:gpu_config_manager:GPU mode enabled for xgboost: GPU: NVIDIA GeForce RTX 3060 (1 devices, 12.0GB)
🚀 XGBoost configured for GPU: GPU: NVIDIA GeForce RTX 3060 (1 devices, 12.0GB)
DEBUG: Starting cache save for xgboost
DEBUG: Cache directory created: cache\models\xgboost\numeric_dataset_MinMaxScaler\fb759ef3d3c5d040c4ab2f7d5f83a7fa05364cd52b376b35d9b0e5c4d539f06a
DEBUG: Model artifact saved: cache\models\xgboost\numeric_dataset_MinMaxScaler\fb759ef3d3c5d040c4ab2f7d5f83a7fa05364cd52b376b35d9b0e5c4d539f06a\model.json
DEBUG: Params saved: cache\models\xgboost\numeric_dataset_MinMaxScaler\fb759ef3d3c5d040c4ab2f7d5f83a7fa05364cd52b376b35d9b0e5c4d539f06a\params.json
DEBUG: Metrics saved: cache\models\xgboost\numeric_dataset_MinMaxScaler\fb759ef3d3c5d040c4ab2f7d5f83a7fa05364cd52b376b35d9b0e5c4d539f06a\metrics.json
DEBUG: Config saved: cache\models\xgboost\numeric_dataset_MinMaxScaler\fb759ef3d3c5d040c4ab2f7d5f83a7fa05364cd52b376b35d9b0e5c4d539f06a\config.json
INFO:cache_manager:Cache saved for xgboost at cache\models\xgboost\numeric_dataset_MinMaxScaler\fb759ef3d3c5d040c4ab2f7d5f83a7fa05364cd52b376b35d9b0e5c4d539f06a
DEBUG: Garbage collection completed for xgboost
DEBUG: Garbage collection completed for xgboost
INFO:gpu_config_manager:GPU mode enabled for lightgbm: GPU: NVIDIA GeForce RTX 3060 (1 devices, 12.0GB)
🚀 LightGBM configured for GPU: GPU: NVIDIA GeForce RTX 3060 (1 devices, 12.0GB)
[I 2025-10-01 09:56:54,012] A new study created in memory with name: lightgbm_optimization
INFO:optuna_optimizer:Created Optuna study: lightgbm_optimization
INFO:optuna_optimizer:Starting optimization for lightgbm...
INFO:gpu_config_manager:GPU mode enabled for lightgbm: GPU: NVIDIA GeForce RTX 3060 (1 devices, 12.0GB)
🚀 LightGBM configured for GPU: GPU: NVIDIA GeForce RTX 3060 (1 devices, 12.0GB)
[I 2025-10-01 09:56:54,649] Trial 0 finished with value: 1.0 and parameters: {'n_estimators': 218, 'num_leaves': 96, 'learning_rate': 0.1205712628744377, 'feature_fraction': 0.8394633936788146, 'bagging_fraction': 0.6624074561769746, 'min_child_samples': 12, 'lambda_l1': 0.0017073967431528124, 'lambda_l2': 2.9154431891537547}. Best is trial 0 with value: 1.0.
INFO:gpu_config_manager:GPU mode enabled for lightgbm: GPU: NVIDIA GeForce RTX 3060 (1 devices, 12.0GB)
🚀 LightGBM configured for GPU: GPU: NVIDIA GeForce RTX 3060 (1 devices, 12.0GB)
[I 2025-10-01 09:56:55,648] Trial 1 finished with value: 1.0 and parameters: {'n_estimators': 321, 'num_leaves': 74, 'learning_rate': 0.010725209743171996, 'feature_fraction': 0.9879639408647978, 'bagging_fraction': 0.9329770563201687, 'min_child_samples': 14, 'lambda_l1': 0.005337032762603957, 'lambda_l2': 0.00541524411940254}. Best is trial 0 with value: 1.0.
INFO:gpu_config_manager:GPU mode enabled for lightgbm: GPU: NVIDIA GeForce RTX 3060 (1 devices, 12.0GB)
🚀 LightGBM configured for GPU: GPU: NVIDIA GeForce RTX 3060 (1 devices, 12.0GB)
[I 2025-10-01 09:56:56,334] Trial 2 finished with value: 1.0 and parameters: {'n_estimators': 187, 'num_leaves': 57, 'learning_rate': 0.04345454109729477, 'feature_fraction': 0.7164916560792167, 'bagging_fraction': 0.8447411578889518, 'min_child_samples': 11, 'lambda_l1': 0.01474275315991467, 'lambda_l2': 0.029204338471814112}. Best is trial 0 with value: 1.0.
INFO:gpu_config_manager:GPU mode enabled for lightgbm: GPU: NVIDIA GeForce RTX 3060 (1 devices, 12.0GB)
🚀 LightGBM configured for GPU: GPU: NVIDIA GeForce RTX 3060 (1 devices, 12.0GB)
[I 2025-10-01 09:56:57,336] Trial 3 finished with value: 1.0 and parameters: {'n_estimators': 255, 'num_leaves': 81, 'learning_rate': 0.019721610970574007, 'feature_fraction': 0.8056937753654446, 'bagging_fraction': 0.836965827544817, 'min_child_samples': 7, 'lambda_l1': 0.26926469100861794, 'lambda_l2': 0.004809461967501573}. Best is trial 0 with value: 1.0.
INFO:gpu_config_manager:GPU mode enabled for lightgbm: GPU: NVIDIA GeForce RTX 3060 (1 devices, 12.0GB)
🚀 LightGBM configured for GPU: GPU: NVIDIA GeForce RTX 3060 (1 devices, 12.0GB)
[I 2025-10-01 09:56:57,537] Trial 4 finished with value: 1.0 and parameters: {'n_estimators': 79, 'num_leaves': 96, 'learning_rate': 0.26690431824362526, 'feature_fraction': 0.9233589392465844, 'bagging_fraction': 0.7218455076693483, 'min_child_samples': 9, 'lambda_l1': 0.5456725485601477, 'lambda_l2': 0.057624872164786026}. Best is trial 0 with value: 1.0.
INFO:gpu_config_manager:GPU mode enabled for lightgbm: GPU: NVIDIA GeForce RTX 3060 (1 devices, 12.0GB)
🚀 LightGBM configured for GPU: GPU: NVIDIA GeForce RTX 3060 (1 devices, 12.0GB)
[I 2025-10-01 09:56:57,777] Trial 5 finished with value: 0.8627450980392157 and parameters: {'n_estimators': 105, 'num_leaves': 55, 'learning_rate': 0.011240768803005551, 'feature_fraction': 0.9637281608315128, 'bagging_fraction': 0.7035119926400067, 'min_child_samples': 35, 'lambda_l1': 0.017654048052495083, 'lambda_l2': 0.12030178871154672}. Best is trial 0 with value: 1.0.
INFO:gpu_config_manager:GPU mode enabled for lightgbm: GPU: NVIDIA GeForce RTX 3060 (1 devices, 12.0GB)
🚀 LightGBM configured for GPU: GPU: NVIDIA GeForce RTX 3060 (1 devices, 12.0GB)
[I 2025-10-01 09:56:58,196] Trial 6 finished with value: 1.0 and parameters: {'n_estimators': 296, 'num_leaves': 26, 'learning_rate': 0.27051668818999286, 'feature_fraction': 0.9100531293444458, 'bagging_fraction': 0.9757995766256756, 'min_child_samples': 46, 'lambda_l1': 0.24637685958997463, 'lambda_l2': 4.869640941520899}. Best is trial 0 with value: 1.0.
INFO:gpu_config_manager:GPU mode enabled for lightgbm: GPU: NVIDIA GeForce RTX 3060 (1 devices, 12.0GB)
🚀 LightGBM configured for GPU: GPU: NVIDIA GeForce RTX 3060 (1 devices, 12.0GB)
[I 2025-10-01 09:56:58,459] Trial 7 finished with value: 0.9019607843137255 and parameters: {'n_estimators': 89, 'num_leaves': 27, 'learning_rate': 0.011662890273931383, 'feature_fraction': 0.7301321323053057, 'bagging_fraction': 0.7554709158757928, 'min_child_samples': 17, 'lambda_l1': 2.0651425578959257, 'lambda_l2': 0.026730883107816707}. Best is trial 0 with value: 1.0.
INFO:gpu_config_manager:GPU mode enabled for lightgbm: GPU: NVIDIA GeForce RTX 3060 (1 devices, 12.0GB)
🚀 LightGBM configured for GPU: GPU: NVIDIA GeForce RTX 3060 (1 devices, 12.0GB)
[I 2025-10-01 09:56:58,718] Trial 8 finished with value: 0.9019607843137255 and parameters: {'n_estimators': 176, 'num_leaves': 59, 'learning_rate': 0.016149614799999188, 'feature_fraction': 0.9208787923016158, 'bagging_fraction': 0.6298202574719083, 'min_child_samples': 50, 'lambda_l1': 1.2273800987852967, 'lambda_l2': 0.0062353771356731605}. Best is trial 0 with value: 1.0.
INFO:gpu_config_manager:GPU mode enabled for lightgbm: GPU: NVIDIA GeForce RTX 3060 (1 devices, 12.0GB)
🚀 LightGBM configured for GPU: GPU: NVIDIA GeForce RTX 3060 (1 devices, 12.0GB)
[I 2025-10-01 09:56:59,013] Trial 9 finished with value: 1.0 and parameters: {'n_estimators': 52, 'num_leaves': 84, 'learning_rate': 0.11069143219393454, 'feature_fraction': 0.8916028672163949, 'bagging_fraction': 0.9085081386743783, 'min_child_samples': 8, 'lambda_l1': 0.02715581955282941, 'lambda_l2': 0.0029072088906598446}. Best is trial 0 with value: 1.0.
INFO:optuna_optimizer:Optimization completed for lightgbm
INFO:optuna_optimizer:Best score: 1.0000
INFO:optuna_optimizer:Best params: {'n_estimators': 218, 'num_leaves': 96, 'learning_rate': 0.1205712628744377, 'feature_fraction': 0.8394633936788146, 'bagging_fraction': 0.6624074561769746, 'min_child_samples': 12, 'lambda_l1': 0.0017073967431528124, 'lambda_l2': 2.9154431891537547}
INFO:gpu_config_manager:GPU mode enabled for lightgbm: GPU: NVIDIA GeForce RTX 3060 (1 devices, 12.0GB)
🚀 LightGBM configured for GPU: GPU: NVIDIA GeForce RTX 3060 (1 devices, 12.0GB)
DEBUG: Starting cache save for lightgbm
DEBUG: Cache directory created: cache\models\lightgbm\numeric_dataset_MinMaxScaler\80f0b2e1ebf94ab0a1b51985f9c99d5546af55a4a1b78ef95d6e9b58153ccbb0
DEBUG: Model artifact saved: cache\models\lightgbm\numeric_dataset_MinMaxScaler\80f0b2e1ebf94ab0a1b51985f9c99d5546af55a4a1b78ef95d6e9b58153ccbb0\model.txt
DEBUG: Params saved: cache\models\lightgbm\numeric_dataset_MinMaxScaler\80f0b2e1ebf94ab0a1b51985f9c99d5546af55a4a1b78ef95d6e9b58153ccbb0\params.json
DEBUG: Metrics saved: cache\models\lightgbm\numeric_dataset_MinMaxScaler\80f0b2e1ebf94ab0a1b51985f9c99d5546af55a4a1b78ef95d6e9b58153ccbb0\metrics.json
DEBUG: Config saved: cache\models\lightgbm\numeric_dataset_MinMaxScaler\80f0b2e1ebf94ab0a1b51985f9c99d5546af55a4a1b78ef95d6e9b58153ccbb0\config.json
INFO:cache_manager:Cache saved for lightgbm at cache\models\lightgbm\numeric_dataset_MinMaxScaler\80f0b2e1ebf94ab0a1b51985f9c99d5546af55a4a1b78ef95d6e9b58153ccbb0
DEBUG: Garbage collection completed for lightgbm
DEBUG: Garbage collection completed for lightgbm
INFO:gpu_config_manager:GPU mode enabled for catboost: GPU: NVIDIA GeForce RTX 3060 (1 devices, 12.0GB)
🚀 CatBoost configured for GPU: GPU: NVIDIA GeForce RTX 3060 (1 devices, 12.0GB)
[I 2025-10-01 09:56:59,938] A new study created in memory with name: catboost_optimization
INFO:optuna_optimizer:Created Optuna study: catboost_optimization
INFO:optuna_optimizer:Starting optimization for catboost...
INFO:gpu_config_manager:GPU mode enabled for catboost: GPU: NVIDIA GeForce RTX 3060 (1 devices, 12.0GB)
🚀 CatBoost configured for GPU: GPU: NVIDIA GeForce RTX 3060 (1 devices, 12.0GB)
[I 2025-10-01 09:57:03,562] Trial 0 finished with value: 1.0 and parameters: {'iterations': 218, 'depth': 10, 'learning_rate': 0.1205712628744377, 'l2_leaf_reg': 3.968793330444372, 'border_count': 66}. Best is trial 0 with value: 1.0.
INFO:gpu_config_manager:GPU mode enabled for catboost: GPU: NVIDIA GeForce RTX 3060 (1 devices, 12.0GB)
🚀 CatBoost configured for GPU: GPU: NVIDIA GeForce RTX 3060 (1 devices, 12.0GB)
[I 2025-10-01 09:57:04,118] Trial 1 finished with value: 0.9215686274509803 and parameters: {'iterations': 120, 'depth': 3, 'learning_rate': 0.19030368381735815, 'l2_leaf_reg': 3.9913058785616786, 'border_count': 190}. Best is trial 0 with value: 1.0.
INFO:gpu_config_manager:GPU mode enabled for catboost: GPU: NVIDIA GeForce RTX 3060 (1 devices, 12.0GB)
🚀 CatBoost configured for GPU: GPU: NVIDIA GeForce RTX 3060 (1 devices, 12.0GB)
[I 2025-10-01 09:57:04,837] Trial 2 finished with value: 1.0 and parameters: {'iterations': 59, 'depth': 10, 'learning_rate': 0.16967533607196555, 'l2_leaf_reg': 1.6305687346221471, 'border_count': 72}. Best is trial 0 with value: 1.0.
INFO:gpu_config_manager:GPU mode enabled for catboost: GPU: NVIDIA GeForce RTX 3060 (1 devices, 12.0GB)
🚀 CatBoost configured for GPU: GPU: NVIDIA GeForce RTX 3060 (1 devices, 12.0GB)
[I 2025-10-01 09:57:05,508] Trial 3 finished with value: 0.9705882352941176 and parameters: {'iterations': 132, 'depth': 5, 'learning_rate': 0.05958389350068958, 'l2_leaf_reg': 2.7036160666620015, 'border_count': 97}. Best is trial 0 with value: 1.0.
INFO:gpu_config_manager:GPU mode enabled for catboost: GPU: NVIDIA GeForce RTX 3060 (1 devices, 12.0GB)
🚀 CatBoost configured for GPU: GPU: NVIDIA GeForce RTX 3060 (1 devices, 12.0GB)
[I 2025-10-01 09:57:06,934] Trial 4 finished with value: 1.0 and parameters: {'iterations': 325, 'depth': 4, 'learning_rate': 0.027010527749605478, 'l2_leaf_reg': 2.324672848950434, 'border_count': 134}. Best is trial 0 with value: 1.0.
INFO:gpu_config_manager:GPU mode enabled for catboost: GPU: NVIDIA GeForce RTX 3060 (1 devices, 12.0GB)
🚀 CatBoost configured for GPU: GPU: NVIDIA GeForce RTX 3060 (1 devices, 12.0GB)
[I 2025-10-01 09:57:08,582] Trial 5 finished with value: 1.0 and parameters: {'iterations': 404, 'depth': 4, 'learning_rate': 0.05748924681991978, 'l2_leaf_reg': 3.9121416285496955, 'border_count': 42}. Best is trial 0 with value: 1.0.
INFO:gpu_config_manager:GPU mode enabled for catboost: GPU: NVIDIA GeForce RTX 3060 (1 devices, 12.0GB)
🚀 CatBoost configured for GPU: GPU: NVIDIA GeForce RTX 3060 (1 devices, 12.0GB)
[I 2025-10-01 09:57:09,964] Trial 6 finished with value: 0.9313725490196079 and parameters: {'iterations': 324, 'depth': 4, 'learning_rate': 0.012476394272569451, 'l2_leaf_reg': 8.88966790701893, 'border_count': 248}. Best is trial 0 with value: 1.0.
INFO:gpu_config_manager:GPU mode enabled for catboost: GPU: NVIDIA GeForce RTX 3060 (1 devices, 12.0GB)
🚀 CatBoost configured for GPU: GPU: NVIDIA GeForce RTX 3060 (1 devices, 12.0GB)
[I 2025-10-01 09:57:11,789] Trial 7 finished with value: 1.0 and parameters: {'iterations': 414, 'depth': 5, 'learning_rate': 0.013940346079873234, 'l2_leaf_reg': 4.833180632488465, 'border_count': 130}. Best is trial 0 with value: 1.0.
INFO:gpu_config_manager:GPU mode enabled for catboost: GPU: NVIDIA GeForce RTX 3060 (1 devices, 12.0GB)
🚀 CatBoost configured for GPU: GPU: NVIDIA GeForce RTX 3060 (1 devices, 12.0GB)
[I 2025-10-01 09:57:12,423] Trial 8 finished with value: 0.9215686274509803 and parameters: {'iterations': 105, 'depth': 6, 'learning_rate': 0.011240768803005551, 'l2_leaf_reg': 8.115595675970502, 'border_count': 89}. Best is trial 0 with value: 1.0.
INFO:gpu_config_manager:GPU mode enabled for catboost: GPU: NVIDIA GeForce RTX 3060 (1 devices, 12.0GB)
🚀 CatBoost configured for GPU: GPU: NVIDIA GeForce RTX 3060 (1 devices, 12.0GB)
[I 2025-10-01 09:57:14,157] Trial 9 finished with value: 1.0 and parameters: {'iterations': 348, 'depth': 5, 'learning_rate': 0.05864129169696527, 'l2_leaf_reg': 3.521358805467868, 'border_count': 73}. Best is trial 0 with value: 1.0.
INFO:optuna_optimizer:Optimization completed for catboost
INFO:optuna_optimizer:Best score: 1.0000
INFO:optuna_optimizer:Best params: {'iterations': 218, 'depth': 10, 'learning_rate': 0.1205712628744377, 'l2_leaf_reg': 3.968793330444372, 'border_count': 66}
INFO:gpu_config_manager:GPU mode enabled for catboost: GPU: NVIDIA GeForce RTX 3060 (1 devices, 12.0GB)
🚀 CatBoost configured for GPU: GPU: NVIDIA GeForce RTX 3060 (1 devices, 12.0GB)
DEBUG: Starting cache save for catboost
DEBUG: Cache directory created: cache\models\catboost\numeric_dataset_MinMaxScaler\84c3ffc02ed1ac794c42a2e82d06ded540633abe22415a9bb7644385000f877a
DEBUG: Model artifact saved: cache\models\catboost\numeric_dataset_MinMaxScaler\84c3ffc02ed1ac794c42a2e82d06ded540633abe22415a9bb7644385000f877a\model.cbm
DEBUG: Params saved: cache\models\catboost\numeric_dataset_MinMaxScaler\84c3ffc02ed1ac794c42a2e82d06ded540633abe22415a9bb7644385000f877a\params.json
DEBUG: Metrics saved: cache\models\catboost\numeric_dataset_MinMaxScaler\84c3ffc02ed1ac794c42a2e82d06ded540633abe22415a9bb7644385000f877a\metrics.json
DEBUG: Config saved: cache\models\catboost\numeric_dataset_MinMaxScaler\84c3ffc02ed1ac794c42a2e82d06ded540633abe22415a9bb7644385000f877a\config.json
INFO:cache_manager:Cache saved for catboost at cache\models\catboost\numeric_dataset_MinMaxScaler\84c3ffc02ed1ac794c42a2e82d06ded540633abe22415a9bb7644385000f877a
DEBUG: Garbage collection completed for catboost
DEBUG: Garbage collection completed for catboost
[I 2025-10-01 09:57:18,104] A new study created in memory with name: adaboost_optimization
INFO:optuna_optimizer:Created Optuna study: adaboost_optimization
INFO:optuna_optimizer:Starting optimization for adaboost...
[I 2025-10-01 09:57:18,235] Trial 0 finished with value: 0.9117647058823529 and parameters: {'n_estimators': 87, 'learning_rate': 1.5403596595019242}. Best is trial 0 with value: 0.9117647058823529.
[I 2025-10-01 09:57:18,441] Trial 1 finished with value: 0.8823529411764706 and parameters: {'n_estimators': 152, 'learning_rate': 0.23852347578447078}. Best is trial 0 with value: 0.9117647058823529.
[I 2025-10-01 09:57:18,503] Trial 2 finished with value: 0.8529411764705882 and parameters: {'n_estimators': 48, 'learning_rate': 0.022853255256339213}. Best is trial 0 with value: 0.9117647058823529.
[I 2025-10-01 09:57:18,543] Trial 3 finished with value: 0.8431372549019608 and parameters: {'n_estimators': 30, 'learning_rate': 0.98423157385026}. Best is trial 0 with value: 0.9117647058823529.
[I 2025-10-01 09:57:18,711] Trial 4 finished with value: 0.9019607843137255 and parameters: {'n_estimators': 128, 'learning_rate': 0.4258888210290082}. Best is trial 0 with value: 0.9117647058823529.
[I 2025-10-01 09:57:18,746] Trial 5 finished with value: 0.8725490196078431 and parameters: {'n_estimators': 23, 'learning_rate': 1.7052641538983098}. Best is trial 0 with value: 0.9117647058823529.
[I 2025-10-01 09:57:18,979] Trial 6 finished with value: 0.8823529411764706 and parameters: {'n_estimators': 170, 'learning_rate': 0.030803400529839688}. Best is trial 0 with value: 0.9117647058823529.
[I 2025-10-01 09:57:19,066] Trial 7 finished with value: 0.8823529411764706 and parameters: {'n_estimators': 52, 'learning_rate': 0.02642526057549918}. Best is trial 0 with value: 0.9117647058823529.
[I 2025-10-01 09:57:19,167] Trial 8 finished with value: 0.8627450980392157 and parameters: {'n_estimators': 75, 'learning_rate': 0.16124278458562616}. Best is trial 0 with value: 0.9117647058823529.
