[I 2025-10-01 09:58:05,141] Trial 9 finished with value: 0.9803921568627451 and parameters: {'n_estimators': 126, 'learning_rate': 0.013940346079873234, 'max_depth': 8, 'subsample': 0.7760609974958406}. Best is trial 0 with value: 1.0.
INFO:optuna_optimizer:Optimization completed for gradient_boosting
INFO:optuna_optimizer:Best score: 1.0000
INFO:optuna_optimizer:Best params: {'n_estimators': 144, 'learning_rate': 0.2536999076681772, 'max_depth': 8, 'subsample': 0.8394633936788146}
DEBUG: Starting cache save for gradient_boosting
DEBUG: Cache directory created: cache\models\gradient_boosting\numeric_dataset_RobustScaler\7c761199eec68874ab3d1b3d6b39507849f2139dfa0baaaeba30b816a598f1d9
DEBUG: Model artifact saved: cache\models\gradient_boosting\numeric_dataset_RobustScaler\7c761199eec68874ab3d1b3d6b39507849f2139dfa0baaaeba30b816a598f1d9\model.pkl
DEBUG: Params saved: cache\models\gradient_boosting\numeric_dataset_RobustScaler\7c761199eec68874ab3d1b3d6b39507849f2139dfa0baaaeba30b816a598f1d9\params.json
DEBUG: Metrics saved: cache\models\gradient_boosting\numeric_dataset_RobustScaler\7c761199eec68874ab3d1b3d6b39507849f2139dfa0baaaeba30b816a598f1d9\metrics.json
DEBUG: Config saved: cache\models\gradient_boosting\numeric_dataset_RobustScaler\7c761199eec68874ab3d1b3d6b39507849f2139dfa0baaaeba30b816a598f1d9\config.json
INFO:cache_manager:Cache saved for gradient_boosting at cache\models\gradient_boosting\numeric_dataset_RobustScaler\7c761199eec68874ab3d1b3d6b39507849f2139dfa0baaaeba30b816a598f1d9
DEBUG: Garbage collection completed for gradient_boosting
DEBUG: Garbage collection completed for gradient_boosting
[I 2025-10-01 09:58:05,796] A new study created in memory with name: decision_tree_optimization
INFO:optuna_optimizer:Created Optuna study: decision_tree_optimization
INFO:optuna_optimizer:Starting optimization for decision_tree...
🖥️ Using CPU without pruning (CCP disabled on Windows)
[I 2025-10-01 09:58:05,799] Trial 0 finished with value: 0.9803921568627451 and parameters: {}. Best is trial 0 with value: 0.9803921568627451.
🖥️ Using CPU without pruning (CCP disabled on Windows)
[I 2025-10-01 09:58:05,802] Trial 1 finished with value: 0.9803921568627451 and parameters: {}. Best is trial 0 with value: 0.9803921568627451.
🖥️ Using CPU without pruning (CCP disabled on Windows)
[I 2025-10-01 09:58:05,805] Trial 2 finished with value: 0.9803921568627451 and parameters: {}. Best is trial 0 with value: 0.9803921568627451.
🖥️ Using CPU without pruning (CCP disabled on Windows)
[I 2025-10-01 09:58:05,809] Trial 3 finished with value: 0.9803921568627451 and parameters: {}. Best is trial 0 with value: 0.9803921568627451.
🖥️ Using CPU without pruning (CCP disabled on Windows)
[I 2025-10-01 09:58:05,812] Trial 4 finished with value: 0.9803921568627451 and parameters: {}. Best is trial 0 with value: 0.9803921568627451.
🖥️ Using CPU without pruning (CCP disabled on Windows)
[I 2025-10-01 09:58:05,815] Trial 5 finished with value: 0.9803921568627451 and parameters: {}. Best is trial 0 with value: 0.9803921568627451.
🖥️ Using CPU without pruning (CCP disabled on Windows)
[I 2025-10-01 09:58:05,819] Trial 6 finished with value: 0.9803921568627451 and parameters: {}. Best is trial 0 with value: 0.9803921568627451.
🖥️ Using CPU without pruning (CCP disabled on Windows)
[I 2025-10-01 09:58:05,822] Trial 7 finished with value: 0.9803921568627451 and parameters: {}. Best is trial 0 with value: 0.9803921568627451.
🖥️ Using CPU without pruning (CCP disabled on Windows)
[I 2025-10-01 09:58:05,825] Trial 8 finished with value: 0.9803921568627451 and parameters: {}. Best is trial 0 with value: 0.9803921568627451.
🖥️ Using CPU without pruning (CCP disabled on Windows)
[I 2025-10-01 09:58:05,829] Trial 9 finished with value: 0.9803921568627451 and parameters: {}. Best is trial 0 with value: 0.9803921568627451.
INFO:optuna_optimizer:Optimization completed for decision_tree
INFO:optuna_optimizer:Best score: 0.9804
INFO:optuna_optimizer:Best params: {}
🖥️ Using CPU without pruning (CCP disabled on Windows)
DEBUG: Starting cache save for decision_tree
DEBUG: Cache directory created: cache\models\decision_tree\numeric_dataset_RobustScaler\f7264d2aa3f72632c3feda7bd88165678dd202fd2d1ece10a52cb6bc9a430d62
DEBUG: Model artifact saved: cache\models\decision_tree\numeric_dataset_RobustScaler\f7264d2aa3f72632c3feda7bd88165678dd202fd2d1ece10a52cb6bc9a430d62\model.pkl
DEBUG: Params saved: cache\models\decision_tree\numeric_dataset_RobustScaler\f7264d2aa3f72632c3feda7bd88165678dd202fd2d1ece10a52cb6bc9a430d62\params.json
DEBUG: Metrics saved: cache\models\decision_tree\numeric_dataset_RobustScaler\f7264d2aa3f72632c3feda7bd88165678dd202fd2d1ece10a52cb6bc9a430d62\metrics.json
DEBUG: Config saved: cache\models\decision_tree\numeric_dataset_RobustScaler\f7264d2aa3f72632c3feda7bd88165678dd202fd2d1ece10a52cb6bc9a430d62\config.json
INFO:cache_manager:Cache saved for decision_tree at cache\models\decision_tree\numeric_dataset_RobustScaler\f7264d2aa3f72632c3feda7bd88165678dd202fd2d1ece10a52cb6bc9a430d62
DEBUG: Garbage collection completed for decision_tree
DEBUG: Garbage collection completed for decision_tree
[I 2025-10-01 09:58:06,129] A new study created in memory with name: logistic_regression_optimization
INFO:optuna_optimizer:Created Optuna study: logistic_regression_optimization
INFO:optuna_optimizer:Starting optimization for logistic_regression...
🔄 CPU multithreading: Using all 12 available cores
[I 2025-10-01 09:58:06,133] Trial 0 finished with value: 0.8137254901960784 and parameters: {}. Best is trial 0 with value: 0.8137254901960784.
🔄 CPU multithreading: Using all 12 available cores
[I 2025-10-01 09:58:06,138] Trial 1 finished with value: 0.8137254901960784 and parameters: {}. Best is trial 0 with value: 0.8137254901960784.
🔄 CPU multithreading: Using all 12 available cores
[I 2025-10-01 09:58:06,142] Trial 2 finished with value: 0.8137254901960784 and parameters: {}. Best is trial 0 with value: 0.8137254901960784.
🔄 CPU multithreading: Using all 12 available cores
[I 2025-10-01 09:58:06,146] Trial 3 finished with value: 0.8137254901960784 and parameters: {}. Best is trial 0 with value: 0.8137254901960784.
🔄 CPU multithreading: Using all 12 available cores
[I 2025-10-01 09:58:06,149] Trial 4 finished with value: 0.8137254901960784 and parameters: {}. Best is trial 0 with value: 0.8137254901960784.
🔄 CPU multithreading: Using all 12 available cores
[I 2025-10-01 09:58:06,152] Trial 5 finished with value: 0.8137254901960784 and parameters: {}. Best is trial 0 with value: 0.8137254901960784.
🔄 CPU multithreading: Using all 12 available cores
[I 2025-10-01 09:58:06,155] Trial 6 finished with value: 0.8137254901960784 and parameters: {}. Best is trial 0 with value: 0.8137254901960784.
🔄 CPU multithreading: Using all 12 available cores
[I 2025-10-01 09:58:06,159] Trial 7 finished with value: 0.8137254901960784 and parameters: {}. Best is trial 0 with value: 0.8137254901960784.
🔄 CPU multithreading: Using all 12 available cores
[I 2025-10-01 09:58:06,164] Trial 8 finished with value: 0.8137254901960784 and parameters: {}. Best is trial 0 with value: 0.8137254901960784.
🔄 CPU multithreading: Using all 12 available cores
[I 2025-10-01 09:58:06,167] Trial 9 finished with value: 0.8137254901960784 and parameters: {}. Best is trial 0 with value: 0.8137254901960784.
INFO:optuna_optimizer:Optimization completed for logistic_regression
INFO:optuna_optimizer:Best score: 0.8137
INFO:optuna_optimizer:Best params: {}
🔄 CPU multithreading: Using all 12 available cores
DEBUG: Starting cache save for logistic_regression
DEBUG: Cache directory created: cache\models\logistic_regression\numeric_dataset_RobustScaler\cb175f63c7000164aaf9381efa06905b441de85037086dac1874e89069efe083
DEBUG: Model artifact saved: cache\models\logistic_regression\numeric_dataset_RobustScaler\cb175f63c7000164aaf9381efa06905b441de85037086dac1874e89069efe083\model.pkl
DEBUG: Params saved: cache\models\logistic_regression\numeric_dataset_RobustScaler\cb175f63c7000164aaf9381efa06905b441de85037086dac1874e89069efe083\params.json
DEBUG: Metrics saved: cache\models\logistic_regression\numeric_dataset_RobustScaler\cb175f63c7000164aaf9381efa06905b441de85037086dac1874e89069efe083\metrics.json
DEBUG: Config saved: cache\models\logistic_regression\numeric_dataset_RobustScaler\cb175f63c7000164aaf9381efa06905b441de85037086dac1874e89069efe083\config.json
INFO:cache_manager:Cache saved for logistic_regression at cache\models\logistic_regression\numeric_dataset_RobustScaler\cb175f63c7000164aaf9381efa06905b441de85037086dac1874e89069efe083
DEBUG: Garbage collection completed for logistic_regression
DEBUG: Garbage collection completed for logistic_regression
⚡ Using SGDClassifier (fastest overall)
[I 2025-10-01 09:58:06,448] A new study created in memory with name: svm_optimization
INFO:optuna_optimizer:Created Optuna study: svm_optimization
INFO:optuna_optimizer:Starting optimization for svm...
⚡ Using SGDClassifier (fastest overall)
INFO:SVM_Training:🚀 Starting SVM training at 2025-10-01 09:58:06
INFO:SVM_Training:📊 Data: 820 samples, 13 features, 1 classes
INFO:SVM_Training:⚙️  Parameters: {'C': 1.0, 'kernel': 'rbf', 'gamma': 'scale', 'random_state': 42, 'max_iter': 1000, 'tol': 0.001, 'auto_fast': True}
INFO:SVM_Training:💾 Estimated memory: 0.08 MB
INFO:SVM_Training:💻 Using CPU (scikit-learn) - Fast and reliable
📊 Using dense array for SVM training: (820, 13)
INFO:SVM_Training:🔧 Data preparation: dense_array
INFO:SVM_Training:✅ Training completed on CPU in 0.0010s
INFO:SVM_Training:🎯 Total support vectors: 0
INFO:SVM_Training:🔮 Prediction on 102 samples using CPU in 0.0000s
[I 2025-10-01 09:58:06,451] Trial 0 finished with value: 0.7549019607843137 and parameters: {}. Best is trial 0 with value: 0.7549019607843137.
⚡ Using SGDClassifier (fastest overall)
INFO:SVM_Training:🚀 Starting SVM training at 2025-10-01 09:58:06
INFO:SVM_Training:📊 Data: 820 samples, 13 features, 1 classes
INFO:SVM_Training:⚙️  Parameters: {'C': 1.0, 'kernel': 'rbf', 'gamma': 'scale', 'random_state': 42, 'max_iter': 1000, 'tol': 0.001, 'auto_fast': True}
INFO:SVM_Training:💾 Estimated memory: 0.08 MB
INFO:SVM_Training:💻 Using CPU (scikit-learn) - Fast and reliable
📊 Using dense array for SVM training: (820, 13)
INFO:SVM_Training:🔧 Data preparation: dense_array
INFO:SVM_Training:✅ Training completed on CPU in 0.0020s
INFO:SVM_Training:🎯 Total support vectors: 0
INFO:SVM_Training:🔮 Prediction on 102 samples using CPU in 0.0000s
[I 2025-10-01 09:58:06,453] Trial 1 finished with value: 0.7549019607843137 and parameters: {}. Best is trial 0 with value: 0.7549019607843137.
⚡ Using SGDClassifier (fastest overall)
INFO:SVM_Training:🚀 Starting SVM training at 2025-10-01 09:58:06
INFO:SVM_Training:📊 Data: 820 samples, 13 features, 1 classes
INFO:SVM_Training:⚙️  Parameters: {'C': 1.0, 'kernel': 'rbf', 'gamma': 'scale', 'random_state': 42, 'max_iter': 1000, 'tol': 0.001, 'auto_fast': True}
INFO:SVM_Training:💾 Estimated memory: 0.08 MB
INFO:SVM_Training:💻 Using CPU (scikit-learn) - Fast and reliable
📊 Using dense array for SVM training: (820, 13)
INFO:SVM_Training:🔧 Data preparation: dense_array
INFO:SVM_Training:✅ Training completed on CPU in 0.0010s
INFO:SVM_Training:🎯 Total support vectors: 0
INFO:SVM_Training:🔮 Prediction on 102 samples using CPU in 0.0000s
[I 2025-10-01 09:58:06,455] Trial 2 finished with value: 0.7549019607843137 and parameters: {}. Best is trial 0 with value: 0.7549019607843137.
⚡ Using SGDClassifier (fastest overall)
INFO:SVM_Training:🚀 Starting SVM training at 2025-10-01 09:58:06
INFO:SVM_Training:📊 Data: 820 samples, 13 features, 1 classes
INFO:SVM_Training:⚙️  Parameters: {'C': 1.0, 'kernel': 'rbf', 'gamma': 'scale', 'random_state': 42, 'max_iter': 1000, 'tol': 0.001, 'auto_fast': True}
INFO:SVM_Training:💾 Estimated memory: 0.08 MB
INFO:SVM_Training:💻 Using CPU (scikit-learn) - Fast and reliable
📊 Using dense array for SVM training: (820, 13)
INFO:SVM_Training:🔧 Data preparation: dense_array
INFO:SVM_Training:✅ Training completed on CPU in 0.0015s
INFO:SVM_Training:🎯 Total support vectors: 0
INFO:SVM_Training:🔮 Prediction on 102 samples using CPU in 0.0000s
[I 2025-10-01 09:58:06,458] Trial 3 finished with value: 0.7549019607843137 and parameters: {}. Best is trial 0 with value: 0.7549019607843137.
⚡ Using SGDClassifier (fastest overall)
INFO:SVM_Training:🚀 Starting SVM training at 2025-10-01 09:58:06
INFO:SVM_Training:📊 Data: 820 samples, 13 features, 1 classes
INFO:SVM_Training:⚙️  Parameters: {'C': 1.0, 'kernel': 'rbf', 'gamma': 'scale', 'random_state': 42, 'max_iter': 1000, 'tol': 0.001, 'auto_fast': True}
INFO:SVM_Training:💾 Estimated memory: 0.08 MB
INFO:SVM_Training:💻 Using CPU (scikit-learn) - Fast and reliable
📊 Using dense array for SVM training: (820, 13)
INFO:SVM_Training:🔧 Data preparation: dense_array
INFO:SVM_Training:✅ Training completed on CPU in 0.0017s
INFO:SVM_Training:🎯 Total support vectors: 0
INFO:SVM_Training:🔮 Prediction on 102 samples using CPU in 0.0010s
[I 2025-10-01 09:58:06,462] Trial 4 finished with value: 0.7549019607843137 and parameters: {}. Best is trial 0 with value: 0.7549019607843137.
⚡ Using SGDClassifier (fastest overall)
INFO:SVM_Training:🚀 Starting SVM training at 2025-10-01 09:58:06
INFO:SVM_Training:📊 Data: 820 samples, 13 features, 1 classes
INFO:SVM_Training:⚙️  Parameters: {'C': 1.0, 'kernel': 'rbf', 'gamma': 'scale', 'random_state': 42, 'max_iter': 1000, 'tol': 0.001, 'auto_fast': True}
INFO:SVM_Training:💾 Estimated memory: 0.08 MB
INFO:SVM_Training:💻 Using CPU (scikit-learn) - Fast and reliable
📊 Using dense array for SVM training: (820, 13)
INFO:SVM_Training:🔧 Data preparation: dense_array
INFO:SVM_Training:✅ Training completed on CPU in 0.0020s
INFO:SVM_Training:🎯 Total support vectors: 0
INFO:SVM_Training:🔮 Prediction on 102 samples using CPU in 0.0000s
[I 2025-10-01 09:58:06,464] Trial 5 finished with value: 0.7549019607843137 and parameters: {}. Best is trial 0 with value: 0.7549019607843137.
⚡ Using SGDClassifier (fastest overall)
INFO:SVM_Training:🚀 Starting SVM training at 2025-10-01 09:58:06
INFO:SVM_Training:📊 Data: 820 samples, 13 features, 1 classes
INFO:SVM_Training:⚙️  Parameters: {'C': 1.0, 'kernel': 'rbf', 'gamma': 'scale', 'random_state': 42, 'max_iter': 1000, 'tol': 0.001, 'auto_fast': True}
INFO:SVM_Training:💾 Estimated memory: 0.08 MB
INFO:SVM_Training:💻 Using CPU (scikit-learn) - Fast and reliable
📊 Using dense array for SVM training: (820, 13)
INFO:SVM_Training:🔧 Data preparation: dense_array
INFO:SVM_Training:✅ Training completed on CPU in 0.0010s
INFO:SVM_Training:🎯 Total support vectors: 0
INFO:SVM_Training:🔮 Prediction on 102 samples using CPU in 0.0000s
[I 2025-10-01 09:58:06,466] Trial 6 finished with value: 0.7549019607843137 and parameters: {}. Best is trial 0 with value: 0.7549019607843137.
⚡ Using SGDClassifier (fastest overall)
INFO:SVM_Training:🚀 Starting SVM training at 2025-10-01 09:58:06
INFO:SVM_Training:📊 Data: 820 samples, 13 features, 1 classes
INFO:SVM_Training:⚙️  Parameters: {'C': 1.0, 'kernel': 'rbf', 'gamma': 'scale', 'random_state': 42, 'max_iter': 1000, 'tol': 0.001, 'auto_fast': True}
INFO:SVM_Training:💾 Estimated memory: 0.08 MB
INFO:SVM_Training:💻 Using CPU (scikit-learn) - Fast and reliable
📊 Using dense array for SVM training: (820, 13)
INFO:SVM_Training:🔧 Data preparation: dense_array
INFO:SVM_Training:✅ Training completed on CPU in 0.0010s
INFO:SVM_Training:🎯 Total support vectors: 0
INFO:SVM_Training:🔮 Prediction on 102 samples using CPU in 0.0000s
[I 2025-10-01 09:58:06,469] Trial 7 finished with value: 0.7549019607843137 and parameters: {}. Best is trial 0 with value: 0.7549019607843137.
⚡ Using SGDClassifier (fastest overall)
INFO:SVM_Training:🚀 Starting SVM training at 2025-10-01 09:58:06
INFO:SVM_Training:📊 Data: 820 samples, 13 features, 1 classes
INFO:SVM_Training:⚙️  Parameters: {'C': 1.0, 'kernel': 'rbf', 'gamma': 'scale', 'random_state': 42, 'max_iter': 1000, 'tol': 0.001, 'auto_fast': True}
INFO:SVM_Training:💾 Estimated memory: 0.08 MB
INFO:SVM_Training:💻 Using CPU (scikit-learn) - Fast and reliable
📊 Using dense array for SVM training: (820, 13)
INFO:SVM_Training:🔧 Data preparation: dense_array
INFO:SVM_Training:✅ Training completed on CPU in 0.0010s
INFO:SVM_Training:🎯 Total support vectors: 0
INFO:SVM_Training:🔮 Prediction on 102 samples using CPU in 0.0010s
[I 2025-10-01 09:58:06,472] Trial 8 finished with value: 0.7549019607843137 and parameters: {}. Best is trial 0 with value: 0.7549019607843137.
⚡ Using SGDClassifier (fastest overall)
INFO:SVM_Training:🚀 Starting SVM training at 2025-10-01 09:58:06
INFO:SVM_Training:📊 Data: 820 samples, 13 features, 1 classes
INFO:SVM_Training:⚙️  Parameters: {'C': 1.0, 'kernel': 'rbf', 'gamma': 'scale', 'random_state': 42, 'max_iter': 1000, 'tol': 0.001, 'auto_fast': True}
INFO:SVM_Training:💾 Estimated memory: 0.08 MB
INFO:SVM_Training:💻 Using CPU (scikit-learn) - Fast and reliable
📊 Using dense array for SVM training: (820, 13)
INFO:SVM_Training:🔧 Data preparation: dense_array
INFO:SVM_Training:✅ Training completed on CPU in 0.0020s
INFO:SVM_Training:🎯 Total support vectors: 0
INFO:SVM_Training:🔮 Prediction on 102 samples using CPU in 0.0000s
[I 2025-10-01 09:58:06,476] Trial 9 finished with value: 0.7549019607843137 and parameters: {}. Best is trial 0 with value: 0.7549019607843137.
INFO:optuna_optimizer:Optimization completed for svm
INFO:optuna_optimizer:Best score: 0.7549
INFO:optuna_optimizer:Best params: {}
⚡ Using SGDClassifier (fastest overall)
INFO:SVM_Training:🚀 Starting SVM training at 2025-10-01 09:58:06
INFO:SVM_Training:📊 Data: 820 samples, 13 features, 1 classes
INFO:SVM_Training:⚙️  Parameters: {'C': 1.0, 'kernel': 'rbf', 'gamma': 'scale', 'random_state': 42, 'max_iter': 1000, 'tol': 0.001, 'auto_fast': True}
INFO:SVM_Training:💾 Estimated memory: 0.08 MB
INFO:SVM_Training:💻 Using CPU (scikit-learn) - Fast and reliable
📊 Using dense array for SVM training: (820, 13)
INFO:SVM_Training:🔧 Data preparation: dense_array
INFO:SVM_Training:✅ Training completed on CPU in 0.0020s
INFO:SVM_Training:🎯 Total support vectors: 0
INFO:SVM_Training:🔮 Prediction on 103 samples using CPU in 0.0000s
DEBUG: Starting cache save for svm
DEBUG: Cache directory created: cache\models\svm\numeric_dataset_RobustScaler\ab4e7b5ecdc5eff42ab0094f6615d7cf1ac3a37151884d37919b45dbc2cbcf68
DEBUG: Model artifact saved: cache\models\svm\numeric_dataset_RobustScaler\ab4e7b5ecdc5eff42ab0094f6615d7cf1ac3a37151884d37919b45dbc2cbcf68\model.pkl
DEBUG: Params saved: cache\models\svm\numeric_dataset_RobustScaler\ab4e7b5ecdc5eff42ab0094f6615d7cf1ac3a37151884d37919b45dbc2cbcf68\params.json
DEBUG: Metrics saved: cache\models\svm\numeric_dataset_RobustScaler\ab4e7b5ecdc5eff42ab0094f6615d7cf1ac3a37151884d37919b45dbc2cbcf68\metrics.json
DEBUG: Config saved: cache\models\svm\numeric_dataset_RobustScaler\ab4e7b5ecdc5eff42ab0094f6615d7cf1ac3a37151884d37919b45dbc2cbcf68\config.json
INFO:cache_manager:Cache saved for svm at cache\models\svm\numeric_dataset_RobustScaler\ab4e7b5ecdc5eff42ab0094f6615d7cf1ac3a37151884d37919b45dbc2cbcf68
DEBUG: Garbage collection completed for svm
DEBUG: Garbage collection completed for svm
[I 2025-10-01 09:58:06,766] A new study created in memory with name: knn_optimization
INFO:optuna_optimizer:Created Optuna study: knn_optimization
INFO:optuna_optimizer:Starting optimization for knn...
🖥️ Using FAISS CPU-accelerated KNN for embeddings
✅ FAISS CPU index created with 820 vectors, dimension 13
🚀 Using euclidean metric on CPU (optimized)
[I 2025-10-01 09:58:06,772] Trial 0 finished with value: 0.8921568627450981 and parameters: {}. Best is trial 0 with value: 0.8921568627450981.
🖥️ Using FAISS CPU-accelerated KNN for embeddings
✅ FAISS CPU index created with 820 vectors, dimension 13
🚀 Using euclidean metric on CPU (optimized)
[I 2025-10-01 09:58:06,775] Trial 1 finished with value: 0.8921568627450981 and parameters: {}. Best is trial 0 with value: 0.8921568627450981.
🖥️ Using FAISS CPU-accelerated KNN for embeddings
✅ FAISS CPU index created with 820 vectors, dimension 13
🚀 Using euclidean metric on CPU (optimized)
[I 2025-10-01 09:58:06,780] Trial 2 finished with value: 0.8921568627450981 and parameters: {}. Best is trial 0 with value: 0.8921568627450981.
🖥️ Using FAISS CPU-accelerated KNN for embeddings
✅ FAISS CPU index created with 820 vectors, dimension 13
🚀 Using euclidean metric on CPU (optimized)
[I 2025-10-01 09:58:06,784] Trial 3 finished with value: 0.8921568627450981 and parameters: {}. Best is trial 0 with value: 0.8921568627450981.
🖥️ Using FAISS CPU-accelerated KNN for embeddings
✅ FAISS CPU index created with 820 vectors, dimension 13
🚀 Using euclidean metric on CPU (optimized)
[I 2025-10-01 09:58:06,788] Trial 4 finished with value: 0.8921568627450981 and parameters: {}. Best is trial 0 with value: 0.8921568627450981.
🖥️ Using FAISS CPU-accelerated KNN for embeddings
✅ FAISS CPU index created with 820 vectors, dimension 13
🚀 Using euclidean metric on CPU (optimized)
[I 2025-10-01 09:58:06,792] Trial 5 finished with value: 0.8921568627450981 and parameters: {}. Best is trial 0 with value: 0.8921568627450981.
🖥️ Using FAISS CPU-accelerated KNN for embeddings
✅ FAISS CPU index created with 820 vectors, dimension 13
🚀 Using euclidean metric on CPU (optimized)
[I 2025-10-01 09:58:06,795] Trial 6 finished with value: 0.8921568627450981 and parameters: {}. Best is trial 0 with value: 0.8921568627450981.
🖥️ Using FAISS CPU-accelerated KNN for embeddings
✅ FAISS CPU index created with 820 vectors, dimension 13
🚀 Using euclidean metric on CPU (optimized)
[I 2025-10-01 09:58:06,799] Trial 7 finished with value: 0.8921568627450981 and parameters: {}. Best is trial 0 with value: 0.8921568627450981.
🖥️ Using FAISS CPU-accelerated KNN for embeddings
✅ FAISS CPU index created with 820 vectors, dimension 13
🚀 Using euclidean metric on CPU (optimized)
