[I 2025-10-01 09:57:34,417] Trial 9 finished with value: 1.0 and parameters: {'n_estimators': 52, 'max_depth': 9, 'eta': 0.11069143219393454, 'subsample': 0.8916028672163949, 'colsample_bytree': 0.9085081386743783, 'min_child_weight': 1, 'reg_lambda': 0.02715581955282941, 'reg_alpha': 0.0029072088906598446}. Best is trial 0 with value: 1.0.
INFO:optuna_optimizer:Optimization completed for xgboost
INFO:optuna_optimizer:Best score: 1.0000
INFO:optuna_optimizer:Best params: {'n_estimators': 218, 'max_depth': 10, 'eta': 0.1205712628744377, 'subsample': 0.8394633936788146, 'colsample_bytree': 0.6624074561769746, 'min_child_weight': 2, 'reg_lambda': 0.0017073967431528124, 'reg_alpha': 2.9154431891537547}
INFO:gpu_config_manager:GPU mode enabled for xgboost: GPU: NVIDIA GeForce RTX 3060 (1 devices, 12.0GB)
🚀 XGBoost configured for GPU: GPU: NVIDIA GeForce RTX 3060 (1 devices, 12.0GB)
DEBUG: Starting cache save for xgboost
DEBUG: Cache directory created: cache\models\xgboost\numeric_dataset_RobustScaler\62da7e6def7acd7e28c412df23388dc629567e0771da61cf226477499a84f255
DEBUG: Model artifact saved: cache\models\xgboost\numeric_dataset_RobustScaler\62da7e6def7acd7e28c412df23388dc629567e0771da61cf226477499a84f255\model.json
DEBUG: Params saved: cache\models\xgboost\numeric_dataset_RobustScaler\62da7e6def7acd7e28c412df23388dc629567e0771da61cf226477499a84f255\params.json
DEBUG: Metrics saved: cache\models\xgboost\numeric_dataset_RobustScaler\62da7e6def7acd7e28c412df23388dc629567e0771da61cf226477499a84f255\metrics.json
DEBUG: Config saved: cache\models\xgboost\numeric_dataset_RobustScaler\62da7e6def7acd7e28c412df23388dc629567e0771da61cf226477499a84f255\config.json
INFO:cache_manager:Cache saved for xgboost at cache\models\xgboost\numeric_dataset_RobustScaler\62da7e6def7acd7e28c412df23388dc629567e0771da61cf226477499a84f255
DEBUG: Garbage collection completed for xgboost
DEBUG: Garbage collection completed for xgboost
INFO:gpu_config_manager:GPU mode enabled for lightgbm: GPU: NVIDIA GeForce RTX 3060 (1 devices, 12.0GB)
🚀 LightGBM configured for GPU: GPU: NVIDIA GeForce RTX 3060 (1 devices, 12.0GB)
[I 2025-10-01 09:57:35,124] A new study created in memory with name: lightgbm_optimization
INFO:optuna_optimizer:Created Optuna study: lightgbm_optimization
INFO:optuna_optimizer:Starting optimization for lightgbm...
INFO:gpu_config_manager:GPU mode enabled for lightgbm: GPU: NVIDIA GeForce RTX 3060 (1 devices, 12.0GB)
🚀 LightGBM configured for GPU: GPU: NVIDIA GeForce RTX 3060 (1 devices, 12.0GB)
[I 2025-10-01 09:57:35,856] Trial 0 finished with value: 1.0 and parameters: {'n_estimators': 218, 'num_leaves': 96, 'learning_rate': 0.1205712628744377, 'feature_fraction': 0.8394633936788146, 'bagging_fraction': 0.6624074561769746, 'min_child_samples': 12, 'lambda_l1': 0.0017073967431528124, 'lambda_l2': 2.9154431891537547}. Best is trial 0 with value: 1.0.
INFO:gpu_config_manager:GPU mode enabled for lightgbm: GPU: NVIDIA GeForce RTX 3060 (1 devices, 12.0GB)
🚀 LightGBM configured for GPU: GPU: NVIDIA GeForce RTX 3060 (1 devices, 12.0GB)
[I 2025-10-01 09:57:36,876] Trial 1 finished with value: 1.0 and parameters: {'n_estimators': 321, 'num_leaves': 74, 'learning_rate': 0.010725209743171996, 'feature_fraction': 0.9879639408647978, 'bagging_fraction': 0.9329770563201687, 'min_child_samples': 14, 'lambda_l1': 0.005337032762603957, 'lambda_l2': 0.00541524411940254}. Best is trial 0 with value: 1.0.
INFO:gpu_config_manager:GPU mode enabled for lightgbm: GPU: NVIDIA GeForce RTX 3060 (1 devices, 12.0GB)
🚀 LightGBM configured for GPU: GPU: NVIDIA GeForce RTX 3060 (1 devices, 12.0GB)
[I 2025-10-01 09:57:37,599] Trial 2 finished with value: 1.0 and parameters: {'n_estimators': 187, 'num_leaves': 57, 'learning_rate': 0.04345454109729477, 'feature_fraction': 0.7164916560792167, 'bagging_fraction': 0.8447411578889518, 'min_child_samples': 11, 'lambda_l1': 0.01474275315991467, 'lambda_l2': 0.029204338471814112}. Best is trial 0 with value: 1.0.
INFO:gpu_config_manager:GPU mode enabled for lightgbm: GPU: NVIDIA GeForce RTX 3060 (1 devices, 12.0GB)
🚀 LightGBM configured for GPU: GPU: NVIDIA GeForce RTX 3060 (1 devices, 12.0GB)
[I 2025-10-01 09:57:38,613] Trial 3 finished with value: 1.0 and parameters: {'n_estimators': 255, 'num_leaves': 81, 'learning_rate': 0.019721610970574007, 'feature_fraction': 0.8056937753654446, 'bagging_fraction': 0.836965827544817, 'min_child_samples': 7, 'lambda_l1': 0.26926469100861794, 'lambda_l2': 0.004809461967501573}. Best is trial 0 with value: 1.0.
INFO:gpu_config_manager:GPU mode enabled for lightgbm: GPU: NVIDIA GeForce RTX 3060 (1 devices, 12.0GB)
🚀 LightGBM configured for GPU: GPU: NVIDIA GeForce RTX 3060 (1 devices, 12.0GB)
[I 2025-10-01 09:57:38,811] Trial 4 finished with value: 1.0 and parameters: {'n_estimators': 79, 'num_leaves': 96, 'learning_rate': 0.26690431824362526, 'feature_fraction': 0.9233589392465844, 'bagging_fraction': 0.7218455076693483, 'min_child_samples': 9, 'lambda_l1': 0.5456725485601477, 'lambda_l2': 0.057624872164786026}. Best is trial 0 with value: 1.0.
INFO:gpu_config_manager:GPU mode enabled for lightgbm: GPU: NVIDIA GeForce RTX 3060 (1 devices, 12.0GB)
🚀 LightGBM configured for GPU: GPU: NVIDIA GeForce RTX 3060 (1 devices, 12.0GB)
[I 2025-10-01 09:57:39,040] Trial 5 finished with value: 0.8627450980392157 and parameters: {'n_estimators': 105, 'num_leaves': 55, 'learning_rate': 0.011240768803005551, 'feature_fraction': 0.9637281608315128, 'bagging_fraction': 0.7035119926400067, 'min_child_samples': 35, 'lambda_l1': 0.017654048052495083, 'lambda_l2': 0.12030178871154672}. Best is trial 0 with value: 1.0.
INFO:gpu_config_manager:GPU mode enabled for lightgbm: GPU: NVIDIA GeForce RTX 3060 (1 devices, 12.0GB)
🚀 LightGBM configured for GPU: GPU: NVIDIA GeForce RTX 3060 (1 devices, 12.0GB)
[I 2025-10-01 09:57:39,447] Trial 6 finished with value: 1.0 and parameters: {'n_estimators': 296, 'num_leaves': 26, 'learning_rate': 0.27051668818999286, 'feature_fraction': 0.9100531293444458, 'bagging_fraction': 0.9757995766256756, 'min_child_samples': 46, 'lambda_l1': 0.24637685958997463, 'lambda_l2': 4.869640941520899}. Best is trial 0 with value: 1.0.
INFO:gpu_config_manager:GPU mode enabled for lightgbm: GPU: NVIDIA GeForce RTX 3060 (1 devices, 12.0GB)
🚀 LightGBM configured for GPU: GPU: NVIDIA GeForce RTX 3060 (1 devices, 12.0GB)
[I 2025-10-01 09:57:39,687] Trial 7 finished with value: 0.9019607843137255 and parameters: {'n_estimators': 89, 'num_leaves': 27, 'learning_rate': 0.011662890273931383, 'feature_fraction': 0.7301321323053057, 'bagging_fraction': 0.7554709158757928, 'min_child_samples': 17, 'lambda_l1': 2.0651425578959257, 'lambda_l2': 0.026730883107816707}. Best is trial 0 with value: 1.0.
INFO:gpu_config_manager:GPU mode enabled for lightgbm: GPU: NVIDIA GeForce RTX 3060 (1 devices, 12.0GB)
🚀 LightGBM configured for GPU: GPU: NVIDIA GeForce RTX 3060 (1 devices, 12.0GB)
[I 2025-10-01 09:57:39,946] Trial 8 finished with value: 0.9019607843137255 and parameters: {'n_estimators': 176, 'num_leaves': 59, 'learning_rate': 0.016149614799999188, 'feature_fraction': 0.9208787923016158, 'bagging_fraction': 0.6298202574719083, 'min_child_samples': 50, 'lambda_l1': 1.2273800987852967, 'lambda_l2': 0.0062353771356731605}. Best is trial 0 with value: 1.0.
INFO:gpu_config_manager:GPU mode enabled for lightgbm: GPU: NVIDIA GeForce RTX 3060 (1 devices, 12.0GB)
🚀 LightGBM configured for GPU: GPU: NVIDIA GeForce RTX 3060 (1 devices, 12.0GB)
[I 2025-10-01 09:57:40,222] Trial 9 finished with value: 1.0 and parameters: {'n_estimators': 52, 'num_leaves': 84, 'learning_rate': 0.11069143219393454, 'feature_fraction': 0.8916028672163949, 'bagging_fraction': 0.9085081386743783, 'min_child_samples': 8, 'lambda_l1': 0.02715581955282941, 'lambda_l2': 0.0029072088906598446}. Best is trial 0 with value: 1.0.
INFO:optuna_optimizer:Optimization completed for lightgbm
INFO:optuna_optimizer:Best score: 1.0000
INFO:optuna_optimizer:Best params: {'n_estimators': 218, 'num_leaves': 96, 'learning_rate': 0.1205712628744377, 'feature_fraction': 0.8394633936788146, 'bagging_fraction': 0.6624074561769746, 'min_child_samples': 12, 'lambda_l1': 0.0017073967431528124, 'lambda_l2': 2.9154431891537547}
INFO:gpu_config_manager:GPU mode enabled for lightgbm: GPU: NVIDIA GeForce RTX 3060 (1 devices, 12.0GB)
🚀 LightGBM configured for GPU: GPU: NVIDIA GeForce RTX 3060 (1 devices, 12.0GB)
DEBUG: Starting cache save for lightgbm
DEBUG: Cache directory created: cache\models\lightgbm\numeric_dataset_RobustScaler\adf26cc01549f09c6bf1390d44bc2855ac255035bb9752e57359ce3b485f4153
DEBUG: Model artifact saved: cache\models\lightgbm\numeric_dataset_RobustScaler\adf26cc01549f09c6bf1390d44bc2855ac255035bb9752e57359ce3b485f4153\model.txt
DEBUG: Params saved: cache\models\lightgbm\numeric_dataset_RobustScaler\adf26cc01549f09c6bf1390d44bc2855ac255035bb9752e57359ce3b485f4153\params.json
DEBUG: Metrics saved: cache\models\lightgbm\numeric_dataset_RobustScaler\adf26cc01549f09c6bf1390d44bc2855ac255035bb9752e57359ce3b485f4153\metrics.json
DEBUG: Config saved: cache\models\lightgbm\numeric_dataset_RobustScaler\adf26cc01549f09c6bf1390d44bc2855ac255035bb9752e57359ce3b485f4153\config.json
INFO:cache_manager:Cache saved for lightgbm at cache\models\lightgbm\numeric_dataset_RobustScaler\adf26cc01549f09c6bf1390d44bc2855ac255035bb9752e57359ce3b485f4153
DEBUG: Garbage collection completed for lightgbm
DEBUG: Garbage collection completed for lightgbm
INFO:gpu_config_manager:GPU mode enabled for catboost: GPU: NVIDIA GeForce RTX 3060 (1 devices, 12.0GB)
🚀 CatBoost configured for GPU: GPU: NVIDIA GeForce RTX 3060 (1 devices, 12.0GB)
[I 2025-10-01 09:57:41,160] A new study created in memory with name: catboost_optimization
INFO:optuna_optimizer:Created Optuna study: catboost_optimization
INFO:optuna_optimizer:Starting optimization for catboost...
INFO:gpu_config_manager:GPU mode enabled for catboost: GPU: NVIDIA GeForce RTX 3060 (1 devices, 12.0GB)
🚀 CatBoost configured for GPU: GPU: NVIDIA GeForce RTX 3060 (1 devices, 12.0GB)
[I 2025-10-01 09:57:44,770] Trial 0 finished with value: 1.0 and parameters: {'iterations': 218, 'depth': 10, 'learning_rate': 0.1205712628744377, 'l2_leaf_reg': 3.968793330444372, 'border_count': 66}. Best is trial 0 with value: 1.0.
INFO:gpu_config_manager:GPU mode enabled for catboost: GPU: NVIDIA GeForce RTX 3060 (1 devices, 12.0GB)
🚀 CatBoost configured for GPU: GPU: NVIDIA GeForce RTX 3060 (1 devices, 12.0GB)
[I 2025-10-01 09:57:45,331] Trial 1 finished with value: 0.9215686274509803 and parameters: {'iterations': 120, 'depth': 3, 'learning_rate': 0.19030368381735815, 'l2_leaf_reg': 3.9913058785616786, 'border_count': 190}. Best is trial 0 with value: 1.0.
INFO:gpu_config_manager:GPU mode enabled for catboost: GPU: NVIDIA GeForce RTX 3060 (1 devices, 12.0GB)
🚀 CatBoost configured for GPU: GPU: NVIDIA GeForce RTX 3060 (1 devices, 12.0GB)
[I 2025-10-01 09:57:46,053] Trial 2 finished with value: 1.0 and parameters: {'iterations': 59, 'depth': 10, 'learning_rate': 0.16967533607196555, 'l2_leaf_reg': 1.6305687346221471, 'border_count': 72}. Best is trial 0 with value: 1.0.
INFO:gpu_config_manager:GPU mode enabled for catboost: GPU: NVIDIA GeForce RTX 3060 (1 devices, 12.0GB)
🚀 CatBoost configured for GPU: GPU: NVIDIA GeForce RTX 3060 (1 devices, 12.0GB)
[I 2025-10-01 09:57:46,714] Trial 3 finished with value: 0.9705882352941176 and parameters: {'iterations': 132, 'depth': 5, 'learning_rate': 0.05958389350068958, 'l2_leaf_reg': 2.7036160666620015, 'border_count': 97}. Best is trial 0 with value: 1.0.
INFO:gpu_config_manager:GPU mode enabled for catboost: GPU: NVIDIA GeForce RTX 3060 (1 devices, 12.0GB)
🚀 CatBoost configured for GPU: GPU: NVIDIA GeForce RTX 3060 (1 devices, 12.0GB)
[I 2025-10-01 09:57:48,125] Trial 4 finished with value: 1.0 and parameters: {'iterations': 325, 'depth': 4, 'learning_rate': 0.027010527749605478, 'l2_leaf_reg': 2.324672848950434, 'border_count': 134}. Best is trial 0 with value: 1.0.
INFO:gpu_config_manager:GPU mode enabled for catboost: GPU: NVIDIA GeForce RTX 3060 (1 devices, 12.0GB)
🚀 CatBoost configured for GPU: GPU: NVIDIA GeForce RTX 3060 (1 devices, 12.0GB)
[I 2025-10-01 09:57:49,852] Trial 5 finished with value: 1.0 and parameters: {'iterations': 404, 'depth': 4, 'learning_rate': 0.05748924681991978, 'l2_leaf_reg': 3.9121416285496955, 'border_count': 42}. Best is trial 0 with value: 1.0.
INFO:gpu_config_manager:GPU mode enabled for catboost: GPU: NVIDIA GeForce RTX 3060 (1 devices, 12.0GB)
🚀 CatBoost configured for GPU: GPU: NVIDIA GeForce RTX 3060 (1 devices, 12.0GB)
[I 2025-10-01 09:57:51,331] Trial 6 finished with value: 0.9313725490196079 and parameters: {'iterations': 324, 'depth': 4, 'learning_rate': 0.012476394272569451, 'l2_leaf_reg': 8.88966790701893, 'border_count': 248}. Best is trial 0 with value: 1.0.
INFO:gpu_config_manager:GPU mode enabled for catboost: GPU: NVIDIA GeForce RTX 3060 (1 devices, 12.0GB)
🚀 CatBoost configured for GPU: GPU: NVIDIA GeForce RTX 3060 (1 devices, 12.0GB)
[I 2025-10-01 09:57:53,297] Trial 7 finished with value: 1.0 and parameters: {'iterations': 414, 'depth': 5, 'learning_rate': 0.013940346079873234, 'l2_leaf_reg': 4.833180632488465, 'border_count': 130}. Best is trial 0 with value: 1.0.
INFO:gpu_config_manager:GPU mode enabled for catboost: GPU: NVIDIA GeForce RTX 3060 (1 devices, 12.0GB)
🚀 CatBoost configured for GPU: GPU: NVIDIA GeForce RTX 3060 (1 devices, 12.0GB)
[I 2025-10-01 09:57:53,950] Trial 8 finished with value: 0.9215686274509803 and parameters: {'iterations': 105, 'depth': 6, 'learning_rate': 0.011240768803005551, 'l2_leaf_reg': 8.115595675970502, 'border_count': 89}. Best is trial 0 with value: 1.0.
INFO:gpu_config_manager:GPU mode enabled for catboost: GPU: NVIDIA GeForce RTX 3060 (1 devices, 12.0GB)
🚀 CatBoost configured for GPU: GPU: NVIDIA GeForce RTX 3060 (1 devices, 12.0GB)
[I 2025-10-01 09:57:55,723] Trial 9 finished with value: 1.0 and parameters: {'iterations': 348, 'depth': 5, 'learning_rate': 0.05864129169696527, 'l2_leaf_reg': 3.521358805467868, 'border_count': 73}. Best is trial 0 with value: 1.0.
INFO:optuna_optimizer:Optimization completed for catboost
INFO:optuna_optimizer:Best score: 1.0000
INFO:optuna_optimizer:Best params: {'iterations': 218, 'depth': 10, 'learning_rate': 0.1205712628744377, 'l2_leaf_reg': 3.968793330444372, 'border_count': 66}
INFO:gpu_config_manager:GPU mode enabled for catboost: GPU: NVIDIA GeForce RTX 3060 (1 devices, 12.0GB)
🚀 CatBoost configured for GPU: GPU: NVIDIA GeForce RTX 3060 (1 devices, 12.0GB)
DEBUG: Starting cache save for catboost
DEBUG: Cache directory created: cache\models\catboost\numeric_dataset_RobustScaler\6b9dd0deb4907ae8f15ba40992ead51dc7db7d76bf737e1479b3798576be8505
DEBUG: Model artifact saved: cache\models\catboost\numeric_dataset_RobustScaler\6b9dd0deb4907ae8f15ba40992ead51dc7db7d76bf737e1479b3798576be8505\model.cbm
DEBUG: Params saved: cache\models\catboost\numeric_dataset_RobustScaler\6b9dd0deb4907ae8f15ba40992ead51dc7db7d76bf737e1479b3798576be8505\params.json
DEBUG: Metrics saved: cache\models\catboost\numeric_dataset_RobustScaler\6b9dd0deb4907ae8f15ba40992ead51dc7db7d76bf737e1479b3798576be8505\metrics.json
DEBUG: Config saved: cache\models\catboost\numeric_dataset_RobustScaler\6b9dd0deb4907ae8f15ba40992ead51dc7db7d76bf737e1479b3798576be8505\config.json
INFO:cache_manager:Cache saved for catboost at cache\models\catboost\numeric_dataset_RobustScaler\6b9dd0deb4907ae8f15ba40992ead51dc7db7d76bf737e1479b3798576be8505
DEBUG: Garbage collection completed for catboost
DEBUG: Garbage collection completed for catboost
[I 2025-10-01 09:57:59,677] A new study created in memory with name: adaboost_optimization
INFO:optuna_optimizer:Created Optuna study: adaboost_optimization
INFO:optuna_optimizer:Starting optimization for adaboost...
[I 2025-10-01 09:57:59,803] Trial 0 finished with value: 0.9117647058823529 and parameters: {'n_estimators': 87, 'learning_rate': 1.5403596595019242}. Best is trial 0 with value: 0.9117647058823529.
[I 2025-10-01 09:58:00,027] Trial 1 finished with value: 0.8823529411764706 and parameters: {'n_estimators': 152, 'learning_rate': 0.23852347578447078}. Best is trial 0 with value: 0.9117647058823529.
[I 2025-10-01 09:58:00,091] Trial 2 finished with value: 0.8529411764705882 and parameters: {'n_estimators': 48, 'learning_rate': 0.022853255256339213}. Best is trial 0 with value: 0.9117647058823529.
[I 2025-10-01 09:58:00,139] Trial 3 finished with value: 0.8431372549019608 and parameters: {'n_estimators': 30, 'learning_rate': 0.98423157385026}. Best is trial 0 with value: 0.9117647058823529.
[I 2025-10-01 09:58:00,336] Trial 4 finished with value: 0.9019607843137255 and parameters: {'n_estimators': 128, 'learning_rate': 0.4258888210290082}. Best is trial 0 with value: 0.9117647058823529.
[I 2025-10-01 09:58:00,371] Trial 5 finished with value: 0.8725490196078431 and parameters: {'n_estimators': 23, 'learning_rate': 1.7052641538983098}. Best is trial 0 with value: 0.9117647058823529.
[I 2025-10-01 09:58:00,611] Trial 6 finished with value: 0.8823529411764706 and parameters: {'n_estimators': 170, 'learning_rate': 0.030803400529839688}. Best is trial 0 with value: 0.9117647058823529.
[I 2025-10-01 09:58:00,685] Trial 7 finished with value: 0.8823529411764706 and parameters: {'n_estimators': 52, 'learning_rate': 0.02642526057549918}. Best is trial 0 with value: 0.9117647058823529.
[I 2025-10-01 09:58:00,786] Trial 8 finished with value: 0.8627450980392157 and parameters: {'n_estimators': 75, 'learning_rate': 0.16124278458562616}. Best is trial 0 with value: 0.9117647058823529.
[I 2025-10-01 09:58:00,921] Trial 9 finished with value: 0.8725490196078431 and parameters: {'n_estimators': 98, 'learning_rate': 0.04678719265016203}. Best is trial 0 with value: 0.9117647058823529.
INFO:optuna_optimizer:Optimization completed for adaboost
INFO:optuna_optimizer:Best score: 0.9118
INFO:optuna_optimizer:Best params: {'n_estimators': 87, 'learning_rate': 1.5403596595019242}
DEBUG: Starting cache save for adaboost
DEBUG: Cache directory created: cache\models\adaboost\numeric_dataset_RobustScaler\a4cf24b8ab01c94de30d6ee9f77a14a556d507b19acd1261a666635bda1a2823
DEBUG: Model artifact saved: cache\models\adaboost\numeric_dataset_RobustScaler\a4cf24b8ab01c94de30d6ee9f77a14a556d507b19acd1261a666635bda1a2823\model.pkl
DEBUG: Params saved: cache\models\adaboost\numeric_dataset_RobustScaler\a4cf24b8ab01c94de30d6ee9f77a14a556d507b19acd1261a666635bda1a2823\params.json
DEBUG: Metrics saved: cache\models\adaboost\numeric_dataset_RobustScaler\a4cf24b8ab01c94de30d6ee9f77a14a556d507b19acd1261a666635bda1a2823\metrics.json
DEBUG: Config saved: cache\models\adaboost\numeric_dataset_RobustScaler\a4cf24b8ab01c94de30d6ee9f77a14a556d507b19acd1261a666635bda1a2823\config.json
INFO:cache_manager:Cache saved for adaboost at cache\models\adaboost\numeric_dataset_RobustScaler\a4cf24b8ab01c94de30d6ee9f77a14a556d507b19acd1261a666635bda1a2823
DEBUG: Garbage collection completed for adaboost
DEBUG: Garbage collection completed for adaboost
[I 2025-10-01 09:58:01,335] A new study created in memory with name: gradient_boosting_optimization
INFO:optuna_optimizer:Created Optuna study: gradient_boosting_optimization
INFO:optuna_optimizer:Starting optimization for gradient_boosting...
[I 2025-10-01 09:58:01,720] Trial 0 finished with value: 1.0 and parameters: {'n_estimators': 144, 'learning_rate': 0.2536999076681772, 'max_depth': 8, 'subsample': 0.8394633936788146}. Best is trial 0 with value: 1.0.
[I 2025-10-01 09:58:01,848] Trial 1 finished with value: 0.8431372549019608 and parameters: {'n_estimators': 89, 'learning_rate': 0.01699897838270077, 'max_depth': 3, 'subsample': 0.9464704583099741}. Best is trial 0 with value: 1.0.
[I 2025-10-01 09:58:02,126] Trial 2 finished with value: 1.0 and parameters: {'n_estimators': 200, 'learning_rate': 0.11114989443094977, 'max_depth': 3, 'subsample': 0.9879639408647978}. Best is trial 0 with value: 1.0.
[I 2025-10-01 09:58:02,550] Trial 3 finished with value: 1.0 and parameters: {'n_estimators': 258, 'learning_rate': 0.020589728197687916, 'max_depth': 4, 'subsample': 0.6733618039413735}. Best is trial 0 with value: 1.0.
[I 2025-10-01 09:58:02,916] Trial 4 finished with value: 1.0 and parameters: {'n_estimators': 126, 'learning_rate': 0.05958389350068958, 'max_depth': 6, 'subsample': 0.7164916560792167}. Best is trial 0 with value: 1.0.
[I 2025-10-01 09:58:03,394] Trial 5 finished with value: 1.0 and parameters: {'n_estimators': 203, 'learning_rate': 0.01607123851203988, 'max_depth': 5, 'subsample': 0.7465447373174767}. Best is trial 0 with value: 1.0.
[I 2025-10-01 09:58:03,671] Trial 6 finished with value: 1.0 and parameters: {'n_estimators': 164, 'learning_rate': 0.14447746112718687, 'max_depth': 4, 'subsample': 0.8056937753654446}. Best is trial 0 with value: 1.0.
[I 2025-10-01 09:58:04,383] Trial 7 finished with value: 1.0 and parameters: {'n_estimators': 198, 'learning_rate': 0.011711509955524094, 'max_depth': 7, 'subsample': 0.6682096494749166}. Best is trial 0 with value: 1.0.
[I 2025-10-01 09:58:04,607] Trial 8 finished with value: 0.9803921568627451 and parameters: {'n_estimators': 66, 'learning_rate': 0.2521267904777921, 'max_depth': 10, 'subsample': 0.9233589392465844}. Best is trial 0 with value: 1.0.
