[I 2025-10-01 09:58:06,804] Trial 8 finished with value: 0.8921568627450981 and parameters: {}. Best is trial 0 with value: 0.8921568627450981.
🖥️ Using FAISS CPU-accelerated KNN for embeddings
✅ FAISS CPU index created with 820 vectors, dimension 13
🚀 Using euclidean metric on CPU (optimized)
[I 2025-10-01 09:58:06,807] Trial 9 finished with value: 0.8921568627450981 and parameters: {}. Best is trial 0 with value: 0.8921568627450981.
INFO:optuna_optimizer:Optimization completed for knn
INFO:optuna_optimizer:Best score: 0.8922
INFO:optuna_optimizer:Best params: {}
🖥️ Using FAISS CPU-accelerated KNN for embeddings
✅ FAISS CPU index created with 820 vectors, dimension 13
🚀 Using euclidean metric on CPU (optimized)
DEBUG: Starting cache save for knn
DEBUG: Cache directory created: cache\models\knn\numeric_dataset_RobustScaler\8720ce35c468034e6315b6c5536a34998e20d2a7c35fe65164b87c6162cd223f
DEBUG: Model artifact saved: cache\models\knn\numeric_dataset_RobustScaler\8720ce35c468034e6315b6c5536a34998e20d2a7c35fe65164b87c6162cd223f\model.pkl
DEBUG: Params saved: cache\models\knn\numeric_dataset_RobustScaler\8720ce35c468034e6315b6c5536a34998e20d2a7c35fe65164b87c6162cd223f\params.json
DEBUG: Metrics saved: cache\models\knn\numeric_dataset_RobustScaler\8720ce35c468034e6315b6c5536a34998e20d2a7c35fe65164b87c6162cd223f\metrics.json
DEBUG: Config saved: cache\models\knn\numeric_dataset_RobustScaler\8720ce35c468034e6315b6c5536a34998e20d2a7c35fe65164b87c6162cd223f\config.json
INFO:cache_manager:Cache saved for knn at cache\models\knn\numeric_dataset_RobustScaler\8720ce35c468034e6315b6c5536a34998e20d2a7c35fe65164b87c6162cd223f
DEBUG: Garbage collection completed for knn
DEBUG: Garbage collection completed for knn
[I 2025-10-01 09:58:07,144] A new study created in memory with name: naive_bayes_optimization
INFO:optuna_optimizer:Created Optuna study: naive_bayes_optimization
INFO:optuna_optimizer:Starting optimization for naive_bayes...
📊 Using GaussianNB for dense features
🔄 CPU multithreading: Using all available cores
[I 2025-10-01 09:58:07,147] Trial 0 finished with value: 0.8333333333333334 and parameters: {}. Best is trial 0 with value: 0.8333333333333334.
📊 Using GaussianNB for dense features
🔄 CPU multithreading: Using all available cores
[I 2025-10-01 09:58:07,148] Trial 1 finished with value: 0.8333333333333334 and parameters: {}. Best is trial 0 with value: 0.8333333333333334.
📊 Using GaussianNB for dense features
🔄 CPU multithreading: Using all available cores
[I 2025-10-01 09:58:07,150] Trial 2 finished with value: 0.8333333333333334 and parameters: {}. Best is trial 0 with value: 0.8333333333333334.
📊 Using GaussianNB for dense features
🔄 CPU multithreading: Using all available cores
[I 2025-10-01 09:58:07,151] Trial 3 finished with value: 0.8333333333333334 and parameters: {}. Best is trial 0 with value: 0.8333333333333334.
📊 Using GaussianNB for dense features
🔄 CPU multithreading: Using all available cores
[I 2025-10-01 09:58:07,152] Trial 4 finished with value: 0.8333333333333334 and parameters: {}. Best is trial 0 with value: 0.8333333333333334.
📊 Using GaussianNB for dense features
🔄 CPU multithreading: Using all available cores
[I 2025-10-01 09:58:07,153] Trial 5 finished with value: 0.8333333333333334 and parameters: {}. Best is trial 0 with value: 0.8333333333333334.
📊 Using GaussianNB for dense features
🔄 CPU multithreading: Using all available cores
[I 2025-10-01 09:58:07,154] Trial 6 finished with value: 0.8333333333333334 and parameters: {}. Best is trial 0 with value: 0.8333333333333334.
📊 Using GaussianNB for dense features
🔄 CPU multithreading: Using all available cores
[I 2025-10-01 09:58:07,155] Trial 7 finished with value: 0.8333333333333334 and parameters: {}. Best is trial 0 with value: 0.8333333333333334.
📊 Using GaussianNB for dense features
🔄 CPU multithreading: Using all available cores
[I 2025-10-01 09:58:07,156] Trial 8 finished with value: 0.8333333333333334 and parameters: {}. Best is trial 0 with value: 0.8333333333333334.
📊 Using GaussianNB for dense features
🔄 CPU multithreading: Using all available cores
[I 2025-10-01 09:58:07,157] Trial 9 finished with value: 0.8333333333333334 and parameters: {}. Best is trial 0 with value: 0.8333333333333334.
INFO:optuna_optimizer:Optimization completed for naive_bayes
INFO:optuna_optimizer:Best score: 0.8333
INFO:optuna_optimizer:Best params: {}
📊 Using GaussianNB for dense features
🔄 CPU multithreading: Using all available cores
DEBUG: Starting cache save for naive_bayes
DEBUG: Cache directory created: cache\models\naive_bayes\numeric_dataset_RobustScaler\8268c18c8ed997b8cf0ec0fea976f3a73fe29e7a7b905f210e9a15d8590a1f8a
DEBUG: Model artifact saved: cache\models\naive_bayes\numeric_dataset_RobustScaler\8268c18c8ed997b8cf0ec0fea976f3a73fe29e7a7b905f210e9a15d8590a1f8a\model.pkl
DEBUG: Params saved: cache\models\naive_bayes\numeric_dataset_RobustScaler\8268c18c8ed997b8cf0ec0fea976f3a73fe29e7a7b905f210e9a15d8590a1f8a\params.json
DEBUG: Metrics saved: cache\models\naive_bayes\numeric_dataset_RobustScaler\8268c18c8ed997b8cf0ec0fea976f3a73fe29e7a7b905f210e9a15d8590a1f8a\metrics.json
DEBUG: Config saved: cache\models\naive_bayes\numeric_dataset_RobustScaler\8268c18c8ed997b8cf0ec0fea976f3a73fe29e7a7b905f210e9a15d8590a1f8a\config.json
INFO:cache_manager:Cache saved for naive_bayes at cache\models\naive_bayes\numeric_dataset_RobustScaler\8268c18c8ed997b8cf0ec0fea976f3a73fe29e7a7b905f210e9a15d8590a1f8a
DEBUG: Garbage collection completed for naive_bayes
DEBUG: Garbage collection completed for naive_bayes
SUCCESS: Step 4 data saved to session state
2025-10-01 09:58:07.464 Removing orphaned files...
(PJ3.1) PS C:\Users\User\OneDrive\Cloud\0. Studying\250516 AIO2025\z. Git\AIO\250914 Project 4>